id	sentence	raw	ipa	gloss_en	features	notes
ar-LB-001	مَرْحَبَا، شُو أَخْبَارَك؟ كِيفَك وكِيف الصِّحَّة؟	مرحبا، شو أخبارك؟ كيفك وكيف الصحة؟	marħabeː ʃuː ʔaxbeːrak kiːfak wkiːf ɑsˤsˤiħħe	Hello, what's your news? How are you and how is your health?	kaf;hamza;ta_marbuta;sun_assim;emphatic;pharyngeal;geminate;long_vowel;diphthong;question	šū interrogative (cowell1964 p.566); Beiruti kīfak (almbark2015); geminate حّ in ṣiḥḥa
ar-LB-002	اَلْبَحْر هَادِي الْيَوم وَالشَّمْس طَالْعَة عَ الْمِينَا.	البحر هادي اليوم والشمس طالعة ع المينا.	albaħr haːdiː ljoːm waʃʃams tˤɑːlʕe ʕe lmiːneː	The sea is calm today and the sun is rising over the harbour.	ta_marbuta;sun_assim;emphatic;pharyngeal;geminate;long_vowel;diphthong;statement	monophthong ō in اليوم /aljoːm/ (almbark2015: Levantine aw→ō); emphatic ط; ʕa- 'on' contraction (cowell1964)
ar-LB-003	مَا بَدِّي رُوح عَ الشُّغُل بُكْرَا، عِنْدِي مَوْعِد عَنْد الْحَكِيم.	ما بدي روح ع الشغل بكرا، عندي موعد عند الحكيم.	meː baddiː ruːħ ʕe ʃʃuɣul bukreː ʕindiː moːʕid ʕand alħakiːm	I don't want to go to work tomorrow, I have an appointment at the doctor's.	kaf;sun_assim;pharyngeal;geminate;long_vowel;diphthong;negation	baddi negation mā baddi (cowell1964 p.415); ʕa-š-šuɣl with article assimilation after ʕa-
ar-LB-004	قَدَّيْش حَقّ كِيلُو التُّفَّاح بِسُوق الضَّيْعَة؟	قديش حق كيلو التفاح بسوق الضيعة؟	ʔaddeːʃ ħaʔʔ kiːluː ttuffaːħ bisuːʔ ɑdˤdˤeːʕe	How much is a kilo of apples in the village market?	qaf;kaf;ta_marbuta;sun_assim;emphatic;pharyngeal;geminate;long_vowel;diphthong;question;number	ʔaddēš (cowell1964 p.567); ق=/ʔ/ (almbark2015; fadda2016); geminates قّ فّ; ض=/dˤ/ stop
ar-LB-005	عَمِّي جَاب زَيْتُون وجِبْنِة بَلَدِيِّة مِن الضَّيْعَة.	عمي جاب زيتون وجبنة بلدية من الضيعة.	ʕammiː ʒeːb zeːtuːn wʒibne baladijje min ɑdˤdˤeːʕe	My uncle brought olives and local cheese from the village.	jim;ta_marbuta;sun_assim;emphatic;pharyngeal;geminate;long_vowel;diphthong;statement	ج=/ʒ/ (cowell1964 ch.1); Beiruti imala aː→eː in ʒeːb (almbark2015: Beirut fronted ā); imala -e in جِبْنِة
