id	sentence	raw	ipa	gloss_en	features	notes
ar-LY-001	شِن الْحَال؟ كِيف صَحّْتَك الْيُوم يَا خُوي؟	شن الحال؟ كيف صحتك اليوم يا خوي؟	ʃin alħaːl kiːf sˤɑħħtak aljuːm jaː xuːj	How are things? How is your health today, brother?	kaf;emphatic;pharyngeal;geminate;long_vowel;question	šin il-ḥāl Libyan greeting (pereira2008); geminate حّ; xūy vocative
ar-LY-002	اَلْجَوّ سْخُون هَلْبَة الْيُوم فِي طْرَابْلُس.	الجو سخون هلبة اليوم في طرابلس.	alʒaww sxuːn halba ljuːm fiː tˤraːblus	The weather is very hot today in Tripoli.	jim;ta_marbuta;emphatic;geminate;long_vowel;diphthong;statement	halba 'very' (hallmark Libyan lexeme, pereira2008); ج=/ʒ/; cluster ṭr- in طْرَابْلُس
ar-LY-003	مَا نِبِّيش قَهْوَة، نِبِّي شَاهِي أَحْمَر.	ما نبيش قهوة، نبي شاهي أحمر.	maː nibbiːʃ ɡahwa nibbiː ʃaːhiː ʔaħmar	I don't want coffee, I want red tea.	qaf;hamza;ta_marbuta;pharyngeal;geminate;long_vowel;negation	nibbi 'I want' (Libyan hallmark, pereira2008); ma-...-š; ق=/ɡ/ gahwa (pereira2008: Tripoli g-dialect); geminate بّ
ar-LY-004	شْرِيت تْلَاتَة كِيلُو حُوت مِن السُّوق بِعَشْرَة دِينَار.	شريت تلاتة كيلو حوت من السوق بعشرة دينار.	ʃriːt tlaːta kiːluː ħuːt min assuːɡ biʕaʃra diːnaːr	I bought three kilos of fish from the market for ten dinars.	qaf;kaf;ta_marbuta;sun_assim;pharyngeal;geminate;long_vowel;statement;number	ḥūt 'fish' (Maghrebi lexeme); ث→/t/ tlāta (skeleton first-alts); ق=/ɡ/ sūg
ar-LY-005	اَلرَّاجِل هَادَاك يِخْدِم فِي الظُّهْر زَادَة.	الراجل هاداك يخدم في الظهر زادة.	arraːʒil haːdaːk jixdim fiː dˤdˤuhr zaːda	That man works at noon as well.	jim;interdental;kaf;ta_marbuta;sun_assim;emphatic;geminate;long_vowel;statement	hādāk ذ→/d/ stop reflex; ظ first-alt /dˤ/; zāda 'also' (shared with Tunisian)
