id	sentence	raw	ipa	gloss_en	features	notes
ar-MA-001	لَبَاس عْلِيك؟ كِي دَايِر الْيُوم؟	لباس عليك؟ كي داير اليوم؟	laˈbaːs ˈʕliːk ˈkiː ˈdaːjir alˈjuːm	Are you well? How are you doing today?	kaf;pharyngeal;long_vowel;question	labās greeting, ki dāyr (harrell1962 §greetings; PADIC-MOROCCAN attests dāyr); initial cluster ʕl-
ar-MA-002	اَلْجَوّ زْوِين الْيُوم وَالشَّمْش طَالْعَة بِكْرِي.	الجو زوين اليوم والشمش طالعة بكري.	alˈʒaww ˈzwiːn alˈjuːm waʃˈʃamʃ ˈtˤɑːlʕa ˈbəkriː	The weather is nice today and the sun rose early.	jim;kaf;ta_marbuta;sun_assim;emphatic;pharyngeal;geminate;long_vowel;diphthong;statement	zwīn 'nice' (harrell1962 s.v.); ج=/ʒ/ (heath2020); شمش Darija form with final š (harrell1962); bikri 'early'; short high /i/ reduces to schwa before a cluster — weak-position syncope (heath2020; watson2002)
ar-MA-003	مَا بْغِيتْش قَهْوَة، بْغِيت أَتَاي بِالنَّعْنَاع.	ما بغيتش قهوة، بغيت أتاي بالنعناع.	ˈmaː ˈbɣiːtʃ ˈqahwa ˈbɣiːt ʔaˈtaːj binnaʕˈnaːʕ	I don't want coffee, I want tea with mint.	qaf;hamza;ta_marbuta;sun_assim;pharyngeal;geminate;long_vowel;negation	circumfix negation ma-...-š (harrell1962 §negation); bɣīt 'I want'; atāy 'tea' (Darija); ق=/q/ urban (noamane2020)
ar-MA-004	شْرِيت تْلَاتَة كِيلُو مَاطِيشَة مِن السُّوق بِعَشْرَة دْرَاهِم.	شريت تلاتة كيلو ماطيشة من السوق بعشرة دراهم.	ˈʃriːt ˈtlaːta ˈkiːluː mɑːˈtˤiːʃa ˈmin asˈsuːq biˈʕaʃra ˈdraːhim	I bought three kilos of tomatoes from the market for ten dirhams.	qaf;kaf;ta_marbuta;sun_assim;emphatic;pharyngeal;geminate;long_vowel;statement;number	maṭīša 'tomato' (Darija lexeme, harrell1962); ث→/t/ tlāta (heath2020: stop reflexes); initial clusters šr-/tl-/dr-
ar-MA-005	هَادْ الرَّاجِل خْدَّام بْزَّاف وْمَا كَيْگْلَسْش فِي الظُّهْر.	هاد الراجل خدام بزاف وما كيگلسش في الظهر.	ˈhaːd arˈraːʒil ˈxddaːm ˈbzzaːf ˈwmaː kajɡˈlasʃ ˈfiː dˤˈdˤuhr	This man works a lot and doesn't sit down at noon.	jim;interdental;kaf;sun_assim;emphatic;geminate;long_vowel;statement;negation	bzzāf 'a lot' (harrell1962); گ=/ɡ/ in kayglas (Darija g, heath2020); durative ka-/kay- (ennaji2004); ma-...-š
ar-MA-006	سِير لِلسُّوق وْشْرِي الْخُبْز، عَافَاك.	سير للسوق وشري الخبز، عافاك.	ˈsiːr lisˈsuːq ˈwʃriː lˈxubz ʕaːˈfaːk	Go to the market and buy the bread, please.	qaf;kaf;pharyngeal;geminate;long_vowel;imperative	Darija imperatives sir/shri (harrell1962); heavy onset clusters from vowel syncope; ʕafak politeness tag
ar-MA-007	الْيُوم الْجَوّ بَارْد وْمَا كَايْنْش الشّْتَا.	اليوم الجو بارد وما كاينش الشتا.	alˈjuːm alˈʒaww ˈbaːrd ˈwmaː ˈkaːjnʃ ˈaʃʃtaː	Today the weather is cold and there is no rain.	jim;kaf;sun_assim;geminate;long_vowel;diphthong;statement;negation	bard 'cold', existential negation ma kayn-š (harrell1962 §negation); š-šta 'the rain' sun-assimilated (shadda on sīn); w-ma proclitic before consonant
ar-MA-008	بِشْحَال هَاد الْخُبْز؟ بْجُوج دْرَاهِم.	بشحال هاد الخبز؟ بجوج دراهم.	bəʃˈħaːl ˈhaːd alˈxubz ˈbʒuːʒ ˈdraːhim	How much is this bread? Two dirhams.	jim;pharyngeal;long_vowel;question;number	bšḥal 'how much', juj 'two' (Darija numeral, harrell1962); ق=/q/ urban reflex (noamane2020); initial clusters bʒ-/dr-; short high /i/ reduces to schwa before a cluster — weak-position syncope (heath2020; watson2002)
ar-MA-009	عَنْدِي مَوْعِد مْعَ الطّْبِيب فْالتّْلَاتَة.	عندي موعد مع الطبيب فالتلاتة.	ˈʕandiː ˈmawʕid ˈmʕa tˤtˤˈbiːb fattˈlaːta	I have an appointment with the doctor at three.	ta_marbuta;sun_assim;emphatic;pharyngeal;geminate;long_vowel;diphthong;statement;number	ʕndi 'I have', mʕa 'with', ṭbib 'doctor'; f-t-tlata 'at three' with ث→t stop reflex (heath2020); ط emphatic
ar-MA-010	خُويَا كَيَسْكُن فْالرّْبَاط مْعَ الْعَايْلَة.	خويا كيسكن فالرباط مع العايلة.	ˈxuːjaː kaˈjaskun farrˈbɑːtˤ ˈmʕa lˈʕaːjla	My brother lives in Rabat with the family.	kaf;ta_marbuta;sun_assim;emphatic;pharyngeal;geminate;long_vowel;statement	xuya 'my brother', durative prefix ka-/kay- on the imperfect (ennaji2004); ʕayla 'family'; emphatic ṛ in Rbaṭ raises ā
ar-MA-011	دُوز مِنْ هْنَا وْدُور عَ الْيْمِين.	دوز من هنا ودور ع اليمين.	ˈduːz ˈmən ˈhnaː ˈwduːr ˈʕa ljˈmiːn	Pass by here and turn to the right.	pharyngeal;long_vowel;imperative	Darija imperatives duz 'pass', dur 'turn' (harrell1962); hna 'here' (Darija, not MSA hunā); ʕa + article proclitic; short high /i/ reduces to schwa before a cluster — weak-position syncope (heath2020; watson2002)
ar-MA-012	الْمَاكْلَة كَانْت بْنِينَة بْزَّاف الْبَارِح.	الماكلة كانت بنينة بزاف البارح.	alˈmaːkla ˈkaːnt ˈbniːna ˈbzzaːf alˈbaːriħ	The food was very tasty yesterday.	kaf;ta_marbuta;pharyngeal;geminate;long_vowel;statement	makla 'food', bnin/bnina 'tasty', bzzaf 'a lot', l-bariḥ 'yesterday' (harrell1962); geminate zz
ar-MA-013	فِينْ مْشَاو؟ مَا جَاوْش الْيُوم.	فين مشاو؟ ما جاوش اليوم.	ˈfiːn ˈmʃaːuː ˈmaː ˈʒaːwʃ alˈjuːm	Where did they go? They didn't come today.	jim;long_vowel;question;negation	fin 'where', mšaw 'they went', circumfix negation ma-…-š (harrell1962); ج=/ʒ/ fricative (heath2020)
ar-MA-014	شْحَال مِنْ وَلْد عَنْدَك؟	شحال من ولد عندك؟	ˈʃħaːl ˈmən ˈwald ˈʕandak	How many children do you have?	kaf;pharyngeal;long_vowel;question;number	šḥal mn 'how many' governs a singular count noun (harrell1962); wld 'child/son'; pharyngeal ḥ; short high /i/ reduces to schwa before a cluster — weak-position syncope (heath2020; watson2002)
ar-MA-015	إِلَا جِيتِي غَدَّا، نْمْشِيو مْعَ بْعْضِيَّتْنَا.	إلا جيتي غدا، نمشيو مع بعضيتنا.	ˈʔilaː ˈʒiːtiː ˈɣaddaː ˈnmʃiːuː ˈmʕa bʕdˤijˈjatnaː	If you come tomorrow, we will go together.	jim;hamza;emphatic;pharyngeal;geminate;long_vowel;statement	ila 'if' conditional, jiti 'you came', ghadda 'tomorrow'; n-…-u 1pl imperfect nmšiw (ennaji2004); bʕḍiyyatna 'together'; geminate jj
ar-MA-016	الْبَارِح مْشِيت لْلْمْدِينَة وْشْرِيت جَلَّابَة جْدِيدَة.	البارح مشيت للمدينة وشريت جلابة جديدة.	alˈbaːriħ ˈmʃiːt ˈllmdiːna ˈwʃriːt ʒalˈlaːba ˈʒdiːda	Yesterday I went to the old city and bought a new jellaba.	jim;ta_marbuta;pharyngeal;geminate;long_vowel;statement	mšit 1sg past, jellaba 'robe', jdida 'new'; heavy onset clusters mš-/šr-/jd- from short-vowel syncope (heath2020); geminate ll
ar-MA-017	غَادِي نْسَافِر لِفْرَانْسَا فْالصِّيف الْجَاي.	غادي نسافر لفرانسا فالصيف الجاي.	ˈɣaːdiː ˈnsaːfir ləfˈraːnsaː fɑsˤˈsˤiːf alˈʒaːj	I am going to travel to France next summer.	jim;sun_assim;emphatic;long_vowel;statement	ghadi future particle + n- imperfect (ennaji2004); ṣ-ṣif 'the summer' sun-assimilated; l-jay 'coming/next'; short high /i/ reduces to schwa before a cluster — weak-position syncope (heath2020; watson2002)
ar-MA-018	عَيَّطْ لِيَّ فْالتّْلِيفُون مْنِين تُوصَل.	عيط لي فالتليفون منين توصل.	ˈʕajjɑtˤ ˈlijja fattliːˈfuːn ˈmniːn ˈtuːsˤɑl	Call me on the phone when you arrive.	sun_assim;emphatic;pharyngeal;geminate;long_vowel;diphthong;imperative	ʕayyaṭ 'call' imperative, mnin 'when', tuṣal 'you arrive' (harrell1962); geminate jj/ll; ط emphatic
ar-MA-019	السّْلَامْ عْلِيكُم، أَشْ خْبَارَك؟ الْحَمْدُ لِلّاه كُلْشِي مْزْيَان.	السلام عليكم، أش خبارك؟ الحمد للاه كلشي مزيان.	assˈlaːm ˈʕliːkum ˈʔaʃ ˈxbaːrak alˈħamdu lilˈlaːh ˈkulʃiː ˈmzjaːn	Peace be upon you, how are you? Praise God, everything is fine.	kaf;hamza;sun_assim;pharyngeal;geminate;long_vowel;question;statement	s-slam ʕlikum + response pair; ash xbarak 'how are you', kulshi mzyan 'everything fine' (harrell1962); frozen ḥamdu-lillah formula
ar-MA-020	اللِّي فَاتْ مَاتْ.	اللي فات مات.	ˈalliː ˈfaːt ˈmaːt	What has passed is dead.	sun_assim;geminate;long_vowel;statement	Darija proverb lli fat mat; relative particle əlli (harrell1962); ث→t / stop reflexes throughout
