id	sentence	raw	ipa	gloss_en	features	notes
ar-NG-001	كَيف حَالَك يَا أَخُوي؟ اِنْتَ سَلَامَة؟	كيف حالك يا أخوي؟ انت سلامة؟	ˈkajf ˈħaːlak ˈjaː ʔaˈxuːj ˈʔinta saˈlaːma	How are you my brother? Are you well?	kaf;hamza;ta_marbuta;pharyngeal;long_vowel;diphthong;question	Shuwa greeting (owens1993 §greetings); diphthong ay retained in كَيف (owens1993: NA kayf)
ar-NG-002	اَلْمَطَر نَزَل أَمْبَارِح وَالْوَادِي مَلَان مُويَة.	المطر نزل أمبارح والوادي ملان موية.	ˈalmɑtˤɑr ˈnazal ʔamˈbaːriħ walˈwaːdiː maˈlaːn ˈmuːja	The rain fell yesterday and the wadi is full of water.	hamza;ta_marbuta;emphatic;pharyngeal;long_vowel;statement	ambāriḥ 'yesterday', mōya 'water' (West-Sudanic lexemes, owens1993); pharyngeal ح
ar-NG-003	أَنَا مَا نِدَوْر شَاهِي، نَدَوْر لَبَن بَس.	أنا ما ندور شاهي، ندور لبن بس.	ˈʔanaː ˈmaː niˈdawr ˈʃaːhiː naˈdawr ˈlaban ˈbas	I don't want tea, I want milk only.	hamza;long_vowel;diphthong;negation	n- 1sg imperfect (owens1993 §verb: Nigerian Arabic n-prefix); ndawr 'want'
ar-NG-004	اِشْتَرَيت تَلَاتَة بَقَرَات مِن السُّوق بِقُرُوش كَتِير.	اشتريت تلاتة بقرات من السوق بقروش كتير.	ʔiʃtaˈrajt taˈlaːta baɡaˈraːt ˈmin asˈsuːɡ biɡuˈruːʃ kaˈtiːr	I bought three cows from the market for a lot of money.	qaf;kaf;ta_marbuta;sun_assim;geminate;long_vowel;diphthong;statement;number	ث→/t/ in talāta/katīr (owens1993: stop reflexes); ق=/ɡ/ in gurūš 'money'
ar-NG-005	اَلظُّهُر دَا اَلشَّمِس حَارَّة وَالْخَلَا كُلَّه رَمِل.	الظهر دا الشمس حارة والخلا كله رمل.	ˈɑdˤdˤuhur ˈdaː ˈaʃʃamis ˈħaːrra ˈwalxalaː ˈkullah ˈramil	At this noon the sun is hot and the bush is all sand.	interdental;kaf;ta_marbuta;sun_assim;emphatic;pharyngeal;geminate;long_vowel;statement	ظ stop reflex /dˤ/ (holes2004); demonstrative dā (owens1993); geminates رّ لّ
