id	sentence	raw	ipa	gloss_en	features	notes
ar-OM-001	كَيف حَالَك الْيَوم؟ عَسَاك طَيِّب.	كيف حالك اليوم؟ عساك طيب.	ˈkajf ˈħaːlak alˈjawm ʕaˈsaːk ˈtˤɑjjib	How are you today? I hope you are well.	kaf;emphatic;pharyngeal;geminate;long_vowel;diphthong;question	kayf with plain /k/ — NO affrication (albalushi2016: sedentary Omani lacks Gulf čim); diphthongs ay/aw RETAINED (albalushi2016: Omani sedentary diagnostic vs Gulf ē/ō)
ar-OM-002	اَلْقَهْوَة الْعُمَانِيَّة طَيِّبَة مَع التَّمَر وَالْحَلْوَى.	القهوة العمانية طيبة مع التمر والحلوى.	alˈqahwa lʕumaːˈnijja ˈtˤɑjjiba ˈmaʕ ˈattamar walˈħalwaː	Omani coffee is good with dates and halwa.	qaf;ta_marbuta;sun_assim;emphatic;pharyngeal;geminate;long_vowel;diphthong;statement	ق=/q/ retained qahwa (albalushi2016: Muscat sedentary); sun assimilation at-t; geminate يّ
ar-OM-003	مَا أَبْغَى شَاي، أَبْغَى قَهْوَة خَفِيفَة بَس.	ما أبغى شاي، أبغى قهوة خفيفة بس.	maː ˈʔabɣaː ˈʃaːj ˈʔabɣaː ˈqahwa xaˈfiːfa ˈbas	I don't want tea, I only want light coffee.	qaf;hamza;ta_marbuta;long_vowel;negation	abɣā; ق=/q/ (sedentary, vs Bedouin g, albalushi2016); ɣ voiced uvular
ar-OM-004	اِشْتَرَيت ثَلَاث كَيلُوَات سَمَك مِن سُوق مَطْرَح.	اشتريت ثلاث كيلوات سمك من سوق مطرح.	ʔiʃtaˈrajt θaˈlaːθ kajluˈwaːt ˈsamak min ˈsuːq ˈmɑtˤraħ	I bought three kilos of fish from Mutrah market.	qaf;interdental;kaf;emphatic;pharyngeal;long_vowel;diphthong;statement;number	ث retained /θ/; سَمَك plain /k/ (no affrication — diagnostic vs Gulf simač); ق=/q/ sūq; sedentary Omani /q/ retained, /k/ unaffricated, interdental retention per (albalushi2016)
ar-OM-005	هَاذَا الرَّجَّال يِشْتِغِل فِي الظَّهِيرَة عِنْد الْمِينَا.	هاذا الرجال يشتغل في الظهيرة عند المينا.	ˈhaːðaː rradʒˈdʒaːl ˈjiʃtiɣil fiː ðˤðˤɑˈhiːra ˈʕind alˈmiːnaː	This man works at midday near the harbour.	jim;interdental;ta_marbuta;sun_assim;emphatic;pharyngeal;geminate;long_vowel;statement	ذ retained hāða; ظ=/ðˤ/ retained (albalushi2016); geminate جّ raǧǧāl /dʒ/
ar-OM-006	اِسْمَع زَين، وَبَعْدَين قُول لِي رَايَك.	اسمع زين، وبعدين قول لي رايك.	ˈʔismaʕ ˈzajn wabaʕˈdajn ˈquːl liː ˈraːjak	Listen well, and then tell me your opinion.	qaf;kaf;pharyngeal;long_vowel;diphthong;imperative	Omani sedentary control: imperative qul keeps /q/ and the diphthong in baʕdayn survives (albalushi2016)
ar-OM-007	الْيَوم الْجَوّ حَار وَمَا فِيه مَطَر.	اليوم الجو حار وما فيه مطر.	alˈjawm alˈdʒaww ˈħaːr wamaː ˈfiːh ˈmɑtˤɑr	Today the weather is hot and there's no rain.	jim;emphatic;pharyngeal;geminate;long_vowel;diphthong;statement;negation	geminate جّ jaww; retained diphthong aw in al-yawm (albalushi2016: sedentary Omani keeps ay/aw, unlike mainstream Gulf ē/ō); negation mā fīh existential
ar-OM-008	بِكَم هَالسَّمَك؟ بِرِيَالَين وَنُص.	بكم هالسمك؟ بريالين ونص.	ˈbikam ˈhaːlssamak birijaːˈlajn ˈwanusˤ	How much is this fish? Two and a half rials.	kaf;sun_assim;emphatic;geminate;long_vowel;diphthong;question;number	plain /k/ in bikam — NO affrication (albalushi2016 p.89: the prestige Muscat/Ṣalālah sedentary koine does not productively affricate /k/); dual riyālayn keeps diphthong ay
ar-OM-009	الْمَوعِد السَّاعَة سَبْعَة فِي الصُّبْح.	الموعد الساعة سبعة في الصبح.	alˈmawʕid asˈsaːʕa ˈsabʕa fiː sˤˈsˤubħ	The appointment is at seven in the morning.	ta_marbuta;sun_assim;emphatic;pharyngeal;geminate;long_vowel;diphthong;statement;number	sun assimilation as-sāʕa and aṣ-ṣubḥ (geminate ṣṣ); retained diphthong aw in mawʕid (albalushi2016 sedentary)
ar-OM-010	بَيتِي فِي مَطْرَح وَأَهْلِي كُلّهُم هِنَا.	بيتي في مطرح وأهلي كلهم هنا.	ˈbajtiː fiː ˈmɑtˤraħ waˈʔahliː ˈkullhum ˈhinaː	My house is in Mutrah and my family are all here.	kaf;hamza;emphatic;pharyngeal;geminate;long_vowel;diphthong;statement	plain /k/ kullhum, k before /u/ (albalushi2016: no Muscat sedentary affrication); geminate ll; retained diphthong ay in bayt
ar-OM-011	سِير سِيدَة وَبَعْدَين لِف يَمِين عِنْد الْبَنْك.	سير سيدة وبعدين لف يمين عند البنك.	ˈsiːr ˈsiːda wabaʕˈdajn ˈlif jaˈmiːn ˈʕind alˈbank	Go straight then turn right at the bank.	kaf;ta_marbuta;pharyngeal;long_vowel;diphthong;imperative	plain /k/ coda in al-bank — no affrication (albalushi2016); retained diphthong ay in baʕdayn; imperative sīr
ar-OM-012	الْأَكْل كَان زَين وَالسَّمَك طَازَة.	الأكل كان زين والسمك طازة.	alˈʔakl ˈkaːn ˈzajn ˈwassamak ˈtˤɑːza	The food was good and the fish was fresh.	kaf;hamza;ta_marbuta;sun_assim;emphatic;geminate;long_vowel;diphthong;statement	plain /k/ kān (albalushi2016 sedentary); sun assimilation was-samak; retained diphthong ay in zayn
ar-OM-013	وَين رِحْت أَمْس؟ مَا رِحْت وَلَا مَكَان.	وين رحت أمس؟ ما رحت ولا مكان.	ˈwajn ˈriħt ˈʔams maː ˈriħt ˈwalaː maˈkaːn	Where did you go yesterday? I didn't go anywhere.	kaf;hamza;pharyngeal;long_vowel;diphthong;question;negation	retained diphthong ay in wayn — Muscat sedentary keeps /aj/ and does NOT monophthongize to wēn (albalushi2016); negation mā ... walā
ar-OM-014	كَم وَاحِد يِبْغَى قَهْوَة؟	كم واحد يبغى قهوة؟	ˈkam ˈwaːħid ˈjibɣaː ˈqahwa	How many people want coffee?	qaf;kaf;ta_marbuta;pharyngeal;long_vowel;question;number	ق=/q/ retained qahwa (albalushi2016 p.88: Muscat/Ṣalālah sedentary keep Old Arabic *q as [q], unlike Gulf [ɡ]); plain /k/ kam
ar-OM-015	إِذَا مَا عِنْدَك وَقْت الْيَوم، تَعَال بُكْرَة.	إذا ما عندك وقت اليوم، تعال بكرة.	ˈʔiðaː maː ˈʕindak ˈwaqt alˈjawm taˈʕaːl ˈbukra	If you don't have time today, come tomorrow.	qaf;interdental;kaf;hamza;ta_marbuta;pharyngeal;long_vowel;diphthong;negation;imperative	ق=/q/ retained waqt (albalushi2016 sedentary); interdental ذ /ð/ retained in iḏā (albalushi2016 p.87); plain /k/ ʕindak; imperative taʕāl
ar-OM-016	رِحْت السُّوق، اِشْتَرَيت خُبْز وَتَمَر.	رحت السوق، اشتريت خبز وتمر.	ˈriħt asˈsuːq ʔiʃtaˈrajt ˈxubz ˈwatamar	I went to the market, I bought bread and dates.	qaf;sun_assim;pharyngeal;geminate;long_vowel;diphthong;statement	ق=/q/ retained sūq (albalushi2016 sedentary); sun assimilation as-sūq; retained diphthong ay in ishtarayt
ar-OM-017	بَاسَافِر صَلَالَة الشَّهْر الْجَاي.	باسافر صلالة الشهر الجاي.	baːˈsaːfir sˤɑˈlaːla ʃˈʃahr alˈdʒaːj	I'm going to travel to Salalah next month.	jim;ta_marbuta;sun_assim;emphatic;geminate;long_vowel;statement	sun assimilation ash-shahr (geminate ʃʃ); jīm /dʒ/ retained in al-jāy (albalushi2016 p.89: [dʒ] the kept realisation); future prefix b(ā)-
ar-OM-018	كَلّمْنِي الْمَغْرِب لَو سَمَحْت.	كلمني المغرب لو سمحت.	ˈkallmniː lˈmaɣrib law saˈmaħt	Call me in the evening please.	kaf;pharyngeal;geminate;long_vowel;diphthong;imperative	plain /k/ kallimni, k before /a/ — no affrication (albalushi2016 sedentary); geminate ll; retained diphthong aw in law
ar-OM-019	السَّلَام عَلَيكُم، كَيف الْحَال؟	السلام عليكم، كيف الحال؟	assaˈlaːm ʕaˈlajkum ˈkajf alˈħaːl	Peace be upon you, how are things?	kaf;sun_assim;pharyngeal;geminate;long_vowel;diphthong;statement;question	sun assimilation as-salām (geminate ss); plain /k/ kayf; retained diphthong ay in ʕalaykum (albalushi2016 sedentary)
ar-OM-020	الصَّبْر مِفْتَاح الْفَرَج.	الصبر مفتاح الفرج.	ɑsˤˈsˤɑbr mifˈtaːħ ˈalfaradʒ	Patience is the key to relief.	jim;sun_assim;emphatic;pharyngeal;long_vowel;statement	emphatic ص in aṣ-ṣabr with sun assimilation (geminate ṣṣ) and emphatic backing (albalushi2016 p.90); jīm /dʒ/ retained al-faraj
