id	sentence	raw	ipa	gloss_en	features	notes
ar-QA-001	شْحَالَك؟ عَسَاك بِخَير يَا وَلَد عَمِّي.	شحالك؟ عساك بخير يا ولد عمي.	ʃħaːlak ʕasaːk bixeːr jaː walad ʕammiː	How are you? I hope you are well, my cousin.	kaf;pharyngeal;geminate;long_vowel;diphthong;question	šḥālak greeting; ʕasāk optative (Gulf); monophthong ē in بِخَير (Gulf ay→ē, holes2004); geminate مّ
ar-QA-002	اَلْحَرّ فِي الدَّوحَة شَدِيد وَالرُّطُوبَة عَالْيَة.	الحر في الدوحة شديد والرطوبة عالية.	alħarr fiː ddoːħa ʃadiːd warrutˤuːba ʕaːlja	The heat in Doha is severe and the humidity is high.	ta_marbuta;sun_assim;emphatic;pharyngeal;geminate;long_vowel;diphthong;statement	sun assimilation ad-d/ar-r; aw in الدَّوحَة; pharyngeal ح; geminate رّ
ar-QA-003	مَا أَبْغَى عَشَا، أَبْغَى چَاي حَلِيب بَس.	ما أبغى عشا، أبغى چاي حليب بس.	maː ʔabɣaː ʕaʃaː ʔabɣaː tʃaːj ħaliːb bas	I don't want dinner, I only want milk tea.	hamza;pharyngeal;long_vowel;negation	abɣā (Gulf); چ=/tʃ/ karak-tea context (alshammari2026); ɣ voiced uvular
ar-QA-004	اِشْتَرَيت ثَلَاث ثِيَاب مِن السُّوق بِمِيتَين رِيَال.	اشتريت ثلاث ثياب من السوق بميتين ريال.	ʔiʃtareːt θalaːθ θijaːb min assuːɡ bimiːteːn rijaːl	I bought three garments from the market for two hundred riyals.	qaf;interdental;sun_assim;geminate;long_vowel;diphthong;statement;number	double interdental ث (retention); ق=/ɡ/ (Gulf g-qaf, holes2004); mītēn monophthong ē
ar-QA-005	هَاذَا الظُّهُر الشَّمْس قَوِيَّة وَايِد عَالْبَحَر.	هاذا الظهر الشمس قوية وايد عالبحر.	haːðaː ðˤðˤuhur aʃʃams ɡawijja waːjid ʕaːlbaħar	This noon the sun is very strong over the sea.	qaf;interdental;ta_marbuta;sun_assim;emphatic;pharyngeal;geminate;long_vowel;diphthong;statement	ظ=/ðˤ/ retained; ق=/ɡ/ gawiyya; wāyid (Gulf); ʕa-l contraction
