id	sentence	raw	ipa	gloss_en	features	notes
ar-SA-x-qassim-001	賵賽卮 賱賻賵賳賻賰 丕賱賿賷賻賵賲責 毓賻爻賻丕賰 亘賽禺賻賷乇 賷賻丕 亘購賵 禺賻丕賱賽丿.	賵卮 賱賵賳賰 丕賱賷賵賲責 毓爻丕賰 亘禺賷乇 賷丕 亘賵 禺丕賱丿.	藞wi蕛 藞lo藧nak al藞jo藧m 蕰a藞sa藧k bi藞xe藧r 藞ja藧 藞bu藧 藞xa藧lid	How are you today? Hope you're well, Abu Khalid.	kaf;sun_assim;pharyngeal;long_vowel;diphthong;question	wi蕛 l艒nak Qassimi/Najdi greeting (ingham1994); 賱賻賵賳鈫抂lo藧n], 丕賱賿賷賻賵賲鈫抂jo藧m] monophthongs (alhoody2019 p.42)
ar-SA-x-qassim-002	丕賱賿賯賻賴賿賵賻丞 丨賻賯賾 丕賱囟購賾賷購賵賮 噩賻丕賴賿夭賻丞 賮賽賷 丕賱賿賲賻噩賿賱賽爻.	丕賱賯賴賵丞 丨賯 丕賱囟賷賵賮 噩丕賴夭丞 賮賷 丕賱賲噩賱爻.	al藞伞ahawa 藞魔a伞伞 蓱冒摔冒摔u藞ju藧f 藞d蕭a藧hza 藞fi藧 l藞mad蕭lis	The coffee for the guests is ready in the sitting room.	qaf;jim;ta_marbuta;sun_assim;emphatic;pharyngeal;geminate;long_vowel;diphthong;statement	gahawa epenthesis 丕賱賿賯賻賴賿賵賻丞鈫抂al伞ahawa] (ingham1994); 賯=/伞/, 囟/馗 merger in 丕賱囟賷賵賮 (alhoody2019 p.41); hagg possessive
ar-SA-x-qassim-003	賲賻丕 兀賻亘賿睾賻賶 卮賻賷貙 亘賻爻 兀賻亘賿睾賻賶 賰賽賷賱購賵 鬲賻賲賿乇 賵賻丕丨賽丿.	賲丕 兀亘睾賶 卮賷貙 亘爻 兀亘睾賶 賰賷賱賵 鬲賲乇 賵丕丨丿.	藞ma藧 藞蕯ab桑a藧 藞蕛e藧 藞bas 藞蕯ab桑a藧 藞tsi藧lu藧 藞tamr 藞wa藧魔id	I don't want anything, I just want one kilo of dates.	kaf;hamza;pharyngeal;long_vowel;diphthong;negation	ab桑膩 Najdi (ingham1994); 賰賽賷賱購賵鈫抂tsi藧lu藧] velar affrication /k/鈫抂ts] before front vowel (alhoody2019 p.42; alrojaie2013)
ar-SA-x-qassim-004	丕賽卮賿鬲賻乇賻賷鬲 孬賻賱賻丕孬 賰購鬲購亘 賲賽賳 丕賱爻購賾賵賯 亘賽毓賽卮賿乇賽賷賳 乇賽賷賻丕賱.	丕卮鬲乇賷鬲 孬賱丕孬 賰鬲亘 賲賳 丕賱爻賵賯 亘毓卮乇賷賳 乇賷丕賱.	蕯i蕛ta藞re藧t 胃a藞la藧胃 藞kutub 藞min as藞su藧伞 bi蕰i蕛藞ri藧n ri藞ja藧l	I bought three books from the market for twenty riyals.	qaf;interdental;kaf;sun_assim;pharyngeal;geminate;long_vowel;diphthong;number	孬 retained /胃/ (ingham1994); 丕賽卮賿鬲賻乇賻賷鬲鈫抂蕯i蕛tare藧t] monophthong (alhoody2019 p.42); 賯=/伞/ s奴g; sun assim as-su藧伞
ar-SA-x-qassim-005	賷賻丕 賵賻賱賻丿貙 乇購賵丨 噩賽賷亘 賱賽賷 睾賻乇賿卮賻丞 賲賻賵賿賷賻丞 亘賻丕乇賿丿賻丞.	賷丕 賵賱丿貙 乇賵丨 噩賷亘 賱賷 睾乇卮丞 賲賵賷丞 亘丕乇丿丞.	藞ja藧 藞walad 藞ru藧魔 藞d蕭i藧b 藞li藧 藞桑ar蕛a 藞mo藧ja 藞ba藧rda	Boy, go bring me a cold bottle of water.	jim;ta_marbuta;pharyngeal;long_vowel;diphthong;imperative	imperatives ruh/jib; 賲賻賵賿賷賻丞鈫抂mo藧ja] monophthong; 噩=/d蕭/ (ingham1994 sedentary Najdi)
ar-SA-x-qassim-006	賴賻匕賻丕 丕賱乇賽賾噩賻賾丕賱 賷賽毓賿乇賽賮 丕賱胤賻賾乇賽賷賯 賱賽亘購乇賻賷賿丿賻丞 夭賻賷賳.	賴匕丕 丕賱乇噩丕賱 賷毓乇賮 丕賱胤乇賷賯 賱亘乇賷丿丞 夭賷賳.	藞ha冒a藧 rrid蕭藞d蕭a藧l 藞ji蕰rif 蓱t摔t摔蓱藞ri藧dz libu藞re藧da 藞ze藧n	This man knows the road to Buraydah well.	qaf;jim;interdental;ta_marbuta;sun_assim;emphatic;pharyngeal;geminate;long_vowel;diphthong;statement	geminate 乇賽賾噩賻賾丕賱; 丕賱胤賻賾乇賽賷賯鈫抂蓱t摔t摔蓱ri藧dz] qaf-reflex /伞/鈫抂dz] before front vowel (alhoody2019 p.42); 夭賻賷賳鈫抂ze藧n], 亘購乇賻賷賿丿賻丞鈫抂bure藧da] monophthongs
