id	sentence	raw	ipa	gloss_en	features	notes
ar-SD-001	كِيفَك يَا أَخُوي؟ اِنْتَ تَمَام النَّهَارْدَة؟	كيفك يا أخوي؟ انت تمام النهاردة؟	ˈkeːfak jaː ʔaˈxuːj ˈʔinta taˈmaːm annaˈhaːrda	How are you my brother? Are you well today?	kaf;hamza;ta_marbuta;sun_assim;geminate;long_vowel;question	kēfak greeting; tamām; Khartoum form (dickins2007); sun assimilation an-n
ar-SD-002	اَلْجَوّ سُخُن شَدِيد فِي الْخُرْطُوم وَالشَّمِس حَارَّة.	الجو سخن شديد في الخرطوم والشمس حارة.	alˈɟaww ˈsuxun ʃaˈdiːd fiː lxurˈtˤuːm ˈwaʃʃamis ˈħaːrra	The weather is very hot in Khartoum and the sun is burning.	jim;ta_marbuta;sun_assim;emphatic;pharyngeal;geminate;long_vowel;diphthong;statement	ج=/ɟ/ palatal stop (dickins2007 §1: Sudanese ǧīm); suxun 'hot' (dickins2007 s.v.); geminate رّ
ar-SD-003	مَا دَايِر قَهْوَة، أَنَا بَشْرَب شَاي بِاللَّبَن.	ما داير قهوة، أنا بشرب شاي باللبن.	maː ˈdaːjir ˈɡahwa ˈʔanaː ˈbaʃrab ˈʃaːj ˈbillaban	I don't want coffee, I drink tea with milk.	qaf;hamza;ta_marbuta;sun_assim;geminate;long_vowel;negation	dāyir 'wanting' (dickins2007 s.v. داير); ق=/ɡ/ in gahwa (dickins2007; youssef2021); b-imperfect بَشْرَب
ar-SD-004	اِشْتَرَيت تَلَاتَة كِيلُو طَمَاطِم مِن السُّوق بِأَلْفَين جِنَيه.	اشتريت تلاتة كيلو طماطم من السوق بألفين جنيه.	ʔiʃtaˈreːt taˈlaːta ˈkiːluː tˤɑˈmɑːtˤim min asˈsuːɡ biʔalˈfeːn ɟiˈneːh	I bought three kilos of tomatoes from the market for two thousand pounds.	qaf;jim;kaf;hamza;ta_marbuta;sun_assim;emphatic;geminate;long_vowel;diphthong;statement;number	ث→/t/ in talāta (dickins2007: stop reflexes); ق=/ɡ/ in سوق sūg; monophthong ē in ألفين جنيه
ar-SD-005	اَلزُّول دَا قَاعِد يِتْكَلَّم عَن الظُّرُوف بِتَاعَت الشُّغُل.	الزول دا قاعد يتكلم عن الظروف بتاعت الشغل.	azˈzuːl ˈdaː ˈɡaːʕid jitˈkallam ʕan ɑdˤdˤuˈruːf biˈtaːʕat ˈaʃʃuɣul	That man is talking about the work conditions.	qaf;interdental;kaf;sun_assim;emphatic;pharyngeal;geminate;long_vowel;statement	zōl 'person' (hallmark Sudanese lexeme, dickins2007); progressive gāʕid (leddycecere2021); ظ→/dˤ/ stop reflex
ar-SD-006	أَقِيف هِنَا يَا زُول وَخَلِّيك سَاكِت شْوَيَّة.	أقيف هنا يا زول وخليك ساكت شوية.	ʔaˈɡiːf ˈhinaː jaː ˈzuːl waxalˈliːk ˈsaːkit ˈʃwajja	Stop here, man, and keep quiet a bit.	qaf;kaf;hamza;ta_marbuta;geminate;long_vowel;diphthong;imperative	Sudanese imperative agif with qaf→g and the zol vocative (dickins2007)
ar-SD-007	اَلْجَوّ مَا بَارِد أَبَدًا فِي الصَّيف، حَار شَدِيد.	الجو ما بارد أبدا في الصيف، حار شديد.	alˈɟaww maː ˈbaːrid ˈʔabadan fiː sˤˈsˤeːf ˈħaːr ʃaˈdiːd	The weather isn't cold at all in summer, it's very hot.	jim;hamza;sun_assim;emphatic;pharyngeal;geminate;long_vowel;diphthong;statement;negation	ma-negation of predicate (dickins2007); ج=/ɟ/ palatal in aljaww; sun assim aṣ-ṣ; retained diphthong ɑj in ṣayf (leddycecere2021)
ar-SD-008	بِكَم الْكِيلُو بِتَاع الْمَانْجُو؟ بِأَلْف جِنَيه؟	بكم الكيلو بتاع المانجو؟ بألف جنيه؟	ˈbikam alˈkiːluː biˈtaːʕ alˈmaːnɟuː biˈʔalf ɟiˈneːh	How much is the kilo of mango? A thousand pounds?	jim;kaf;hamza;pharyngeal;long_vowel;diphthong;question;number	bitāʕ genitive exponent (dickins2007); ج=/ɟ/ in mānjū/jinēh; number alf; retained diphthong ajh
ar-SD-009	عِنْدِي مَعَاد مَعَ الدُّكْتُور السَّاعَة أَرْبَعَة الْعَصُر.	عندي معاد مع الدكتور الساعة أربعة العصر.	ˈʕindiː maˈʕaːd ˈmaʕa ddukˈtuːr asˈsaːʕa ˈʔarbaʕa ˈalʕɑsˤur	I have an appointment with the doctor at four in the afternoon.	kaf;hamza;ta_marbuta;sun_assim;emphatic;pharyngeal;geminate;long_vowel;statement;number	maʕād 'appointment', ʕaṣur with epenthesis (dickins2007); sun assim ad-d, as-s; ʕ pharyngeal; number arbaʕa
ar-SD-010	أَنَا سَاكِن فِي أَمْدُرْمَان مَعَ أَهْلِي وَعِيَالِي.	أنا ساكن في أمدرمان مع أهلي وعيالي.	ˈʔanaː ˈsaːkin fiː ʔamdurˈmaːn ˈmaʕa ˈʔahliː waʕiˈjaːliː	I live in Omdurman with my family and my kids.	kaf;hamza;pharyngeal;long_vowel;statement	sākin 'residing', ʕiyāl 'children' (dickins2007); Omdurman toponym; hamza in ana/ahli
ar-SD-011	أَمْشِي سِيدَة وَلِف يَمِين عِنْد الْجَامِع.	أمشي سيدة ولف يمين عند الجامع.	ˈʔamʃiː ˈsiːda ˈwalif jaˈmiːn ˈʕind alˈɟaːmiʕ	Go straight and turn right at the mosque.	jim;hamza;ta_marbuta;pharyngeal;long_vowel;imperative	imperatives amshi/liff, sīda 'straight ahead' (dickins2007); ج=/ɟ/ in jāmiʕ
ar-SD-012	الْأَكِل كَان لَذِيذ مَرَّة، أَكَلْنَا كِسْرَة بِالْمُلَاح.	الأكل كان لذيذ مرة، أكلنا كسرة بالملاح.	ˈalʔakil ˈkaːn laˈdiːd ˈmarra ʔaˈkalnaː ˈkisra bilmuˈlaːħ	The food was really delicious, we ate kisra with mulah.	interdental;kaf;hamza;ta_marbuta;pharyngeal;geminate;long_vowel;statement	kisra sorghum flatbread, mulāḥ stew, marra intensifier (dickins2007); ذ→d interdental merger in laẕīẕ→ladīd (leddycecere2021)
ar-SD-013	وَيْن مِفْتَاح الْبَيت؟ مَا لَقَيْتُو خَالِص.	وين مفتاح البيت؟ ما لقيتو خالص.	ˈweːn mifˈtaːħ alˈbeːt maː laˈɡeːtuː ˈxaːlisˤ	Where is the house key? I didn't find it at all.	qaf;sun_assim;emphatic;pharyngeal;long_vowel;diphthong;question;negation	wēn 'where', ma...khāliṣ 'not at all' (dickins2007); ق=/ɡ/ in lagēto; retained diphthong aj in wēn/lagēto (youssef2021)
ar-SD-014	كَم وَلَد عِنْدَك فِي الْمَدْرَسَة؟	كم ولد عندك في المدرسة؟	ˈkam ˈwalad ˈʕindak fiː lˈmadrasa	How many children do you have at school?	kaf;ta_marbuta;pharyngeal;long_vowel;question;number	kam interrogative quantifier (dickins2007); ta marbuta madrasa
ar-SD-015	لَو جِيت بَدْرِي، كُنَّا مَشَينَا سَوَا لِلسُّوق.	لو جيت بدري، كنا مشينا سوا للسوق.	ˈloː ˈɟiːt ˈbadriː ˈkunnaː maˈʃeːnaː ˈsawaː lisˈsuːɡ	If you had come early, we'd have gone to the market together.	qaf;jim;kaf;geminate;long_vowel;diphthong;statement	law-conditional; badri 'early', sawa 'together' (dickins2007); ج=/ɟ/ in jīt; ق=/ɡ/ in sūg; geminate kunna
ar-SD-016	أَمْس رُحْت السُّوق، اِشْتَرَيت خُضَار وَلَحَمَة.	أمس رحت السوق، اشتريت خضار ولحمة.	ˈʔams ˈruħt asˈsuːɡ ʔiʃtaˈreːt xuˈdˤɑːr waˈlaħama	Yesterday I went to the market and bought vegetables and meat.	qaf;hamza;ta_marbuta;sun_assim;emphatic;pharyngeal;geminate;long_vowel;diphthong;statement	ams 'yesterday', laḥama with epenthesis (dickins2007); ق=/ɡ/ in sūg; sun assim as-s
ar-SD-017	بُكْرَة بِنِسَافِر لِمَدَنِي بِالْبَاص الصُّبُح.	بكرة بنسافر لمدني بالباص الصبح.	ˈbukra biniˈsaːfir liˈmadaniː bilˈbɑːsˤ ˈɑsˤsˤubuħ	Tomorrow we'll travel to Madani by bus in the morning.	kaf;ta_marbuta;sun_assim;emphatic;pharyngeal;long_vowel;statement	b-imperfect future binsāfir (dickins2007); Wad Madani toponym; bāṣ loan; sun assim aṣ-ṣ
ar-SD-018	كَلِّمْنِي فِي التِّلِفُون لَمَّا تُوصَل الْبَيت.	كلمني في التلفون لما توصل البيت.	kalˈlimniː fiː ttiliˈfoːn ˈlammaː ˈtuːsˤɑl alˈbeːt	Call me on the phone when you get home.	kaf;sun_assim;emphatic;geminate;long_vowel;diphthong;imperative	imperative kallimni, lamma 'when' (dickins2007); geminates ll/mm; sun assim at-t
ar-SD-019	السَّلَام عَلَيْكُم يَا زُول. وَعَلَيْكُم السَّلَام، أَهْلًا وَسَهْلًا.	السلام عليكم يا زول. وعليكم السلام، أهلا وسهلا.	assaˈlaːm ʕaˈleːkum jaː ˈzuːl waʕaˈleːkum assaˈlaːm ˈʔahlan waˈsahlan	Peace be upon you, man. And peace upon you, welcome.	kaf;hamza;sun_assim;pharyngeal;geminate;long_vowel;diphthong;statement	greeting adjacency pair; zōl vocative (dickins2007); sun assim as-s
ar-SD-020	الصَّبِر مِفْتَاح الْفَرَج، وَالْعَاقِبَة دَايْمًا سَلَامَة.	الصبر مفتاح الفرج، والعاقبة دايما سلامة.	ˈɑsˤsˤɑbir mifˈtaːħ ˈalfaraɟ walˈʕaːɡiba ˈdaːjman saˈlaːma	Patience is the key to relief, and the outcome is always safe.	qaf;jim;ta_marbuta;sun_assim;emphatic;pharyngeal;long_vowel;statement	proverb closing; ṣabir with epenthesis (dickins2007); ج=/ɟ/ in faraj; ق=/ɡ/ in ʕāqiba; sun assim aṣ-ṣ
