id	sentence	raw	ipa	gloss_en	features	notes
ar-SA-x-hejaz-001	اِزَّيَّك يَا شَيخ؟ اِنْتَ كُوَيِّس النَّهَارْدَة وَلَّا لَأ؟	ازيك يا شيخ؟ انت كويس النهاردة ولا لأ؟	ʔizzajjak jaː ʃeːx ʔinta kuwajjis annahaːrda wallaː laʔa	How are you, sheikh? Are you well today or not?	kaf;hamza;ta_marbuta;sun_assim;geminate;long_vowel;diphthong;question	urban Hejazi shares izzayyak/kuwayyis with Cairene register (omar1975 §urban lexicon); geminates زّ يّ
ar-SA-x-hejaz-002	اَلْجَوّ فِي جِدَّة حَارّ وَرَطِب طُول السَّنَة.	الجو في جدة حار ورطب طول السنة.	aldʒaww fiː dʒidda ħaːrr warɑtˤib tˤuːl assana	The weather in Jeddah is hot and humid all year.	jim;ta_marbuta;sun_assim;emphatic;pharyngeal;geminate;long_vowel;diphthong;statement	ج=/dʒ/ ǧidda (abdoh2010); geminates وّ دّ; emphatic ط
ar-SA-x-hejaz-003	مَا أَبْغَى قَهْوَة دِلْوَقْتِي، أَبْغَى شَاهِي بِالنَّعْنَاع.	ما أبغى قهوة دلوقتي، أبغى شاهي بالنعناع.	maː ʔabɣaː ɡahwa dilwaɡtiː ʔabɣaː ʃaːhiː binnaʕnaːʕ	I don't want coffee right now, I want tea with mint.	qaf;hamza;ta_marbuta;sun_assim;pharyngeal;geminate;long_vowel;negation	abɣā (Hejazi, omar1975); ق=/ɡ/ gahwa (abdoh2010 §consonants: Hejazi g); sun assimilation an-n
ar-SA-x-hejaz-004	اِشْتَرَيت تَلَات كَيلُو تَمَر هِنْدِي مِن السُّوق بِعِشْرِين رِيَال.	اشتريت تلات كيلو تمر هندي من السوق بعشرين ريال.	ʔiʃtareːt talaːt keːluː tamar hindiː min assuːɡ biʕiʃriːn rijaːl	I bought three kilos of tamarind from the market for twenty riyals.	qaf;kaf;sun_assim;pharyngeal;geminate;long_vowel;diphthong;statement;number	ث→/t/ talāt (omar1975: urban Hejazi stop reflexes); ق=/ɡ/ sūg
ar-SA-x-hejaz-005	هَادَا الظَّابِط رِجِع مِن الدَّوَام مَبْسُوط.	هادا الظابط رجع من الدوام مبسوط.	haːdaː dˤdˤɑːbitˤ ridʒiʕ min addawaːm mabsuːtˤ	This officer came back from work happy.	jim;interdental;sun_assim;emphatic;pharyngeal;geminate;long_vowel;diphthong;statement	hāda with ذ→/d/ (urban Hejazi, omar1975); ظ→/dˤ/ stop (abdoh2010); sun assimilation ad-d
