id	sentence	raw	ipa	gloss_en	features	notes
ar-SA-x-hejaz-001	كِيف حَالَك يَا شَيخ؟ اِنْتَ كُوَيِّس الْيَوم وَلَّا لَأ؟	كيف حالك يا شيخ؟ انت كويس اليوم ولا لأ؟	ˈkiːf ˈħaːlak jaː ˈʃeːx ˈʔinta kuˈwajjis alˈjoːm ˈwallaː ˈlaʔa	How are you, sheikh? Are you well today or not?	kaf;hamza;pharyngeal;geminate;long_vowel;diphthong;question	kiif haalak greeting (omar1975); ay→eː in sheekh; walla la' tag question. Row corrected: earlier izzayyak/innaharda were Cairene lexicon, not Hejazi
ar-SA-x-hejaz-002	اَلْجَوّ فِي جِدَّة حَارّ وَرَطِب طُول السَّنَة.	الجو في جدة حار ورطب طول السنة.	alˈdʒaww fiː ˈdʒidda ˈħaːrr ˈwarɑtˤib ˈtˤuːl ˈassana	The weather in Jeddah is hot and humid all year.	jim;ta_marbuta;sun_assim;emphatic;pharyngeal;geminate;long_vowel;diphthong;statement	ج=/dʒ/ ǧidda (abdoh2010); geminates وّ دّ; emphatic ط
ar-SA-x-hejaz-003	مَا أَبْغَى قَهْوَة دَحِّين، أَبْغَى شَاهِي بِالنَّعْنَاع.	ما أبغى قهوة دحين، أبغى شاهي بالنعناع.	maː ˈʔabɣaː ˈɡahwa daħˈħiːn ˈʔabɣaː ˈʃaːhiː binnaʕˈnaːʕ	I don't want coffee now, I want mint tea.	qaf;hamza;ta_marbuta;sun_assim;pharyngeal;geminate;long_vowel;negation	abgha 'want'; dahhiin 'now' — the Hejazi form (abdoh2010), replacing the earlier Cairene dilwaqti; qaf→g in gahwa
ar-SA-x-hejaz-004	اِشْتَرَيت تَلَات كَيلُو تَمَر هِنْدِي مِن السُّوق بِعِشْرِين رِيَال.	اشتريت تلات كيلو تمر هندي من السوق بعشرين ريال.	ʔiʃtaˈreːt taˈlaːt ˈkeːluː ˈtamar ˈhindiː min asˈsuːɡ biʕiʃˈriːn riˈjaːl	I bought three kilos of tamarind from the market for twenty riyals.	qaf;kaf;sun_assim;pharyngeal;geminate;long_vowel;diphthong;statement;number	ث→/t/ talāt (omar1975: urban Hejazi stop reflexes); ق=/ɡ/ sūg
ar-SA-x-hejaz-005	هَادَا الظَّابِط رِجِع مِن الدَّوَام مَبْسُوط.	هادا الظابط رجع من الدوام مبسوط.	ˈhaːdaː dˤˈdˤɑːbitˤ ˈridʒiʕ min addaˈwaːm mabˈsuːtˤ	This officer came back from work happy.	jim;interdental;sun_assim;emphatic;pharyngeal;geminate;long_vowel;statement	hāda with ذ→/d/ (urban Hejazi, omar1975); ظ→/dˤ/ stop (abdoh2010); sun assimilation ad-d
ar-SA-x-hejaz-006	تَعَال شُوف الْبَيْت الْجَدِيد وَقُول لِي رَايَك.	تعال شوف البيت الجديد وقول لي رايك.	taˈʕaːl ˈʃuːf alˈbeːt aldʒaˈdiːd waˈɡuːl liː ˈraːjak	Come see the new house and tell me your opinion.	qaf;jim;kaf;pharyngeal;long_vowel;diphthong;imperative	Hejazi imperatives taʕal/shuf/gul; ay→ē monophthongization in albeːt (omar1975); qaf→g
ar-SA-x-hejaz-007	الْجَوّ الْيَوم مُو بَارِد، حِلُو.	الجو اليوم مو بارد، حلو.	alˈdʒaww alˈjoːm muː ˈbaːrid ˈħiluː	The weather today isn't cold, it's nice.	jim;pharyngeal;geminate;long_vowel;diphthong;negation	predicate negator مو /muː/ (Hejazi, omar1975), not Cairene mish; ħilu 'nice'; aw→oː in alyoːm; جو geminate ww
ar-SA-x-hejaz-008	بِكَم هَادَا؟ بِخَمْسَة عَشَر رِيَال.	بكم هادا؟ بخمسة عشر ريال.	ˈbikam ˈhaːdaː biˈxamsa ˈʕaʃar riˈjaːl	How much is this? Fifteen riyals.	kaf;ta_marbuta;pharyngeal;long_vowel;question;number	price question بِكَم bikam (omar1975); هَادَا hāda demonstrative (abdoh2010)
ar-SA-x-hejaz-009	الْمَوْعِد بُكْرَة السَّاعَة أَرْبَعَة.	الموعد بكرة الساعة أربعة.	alˈmoːʕid ˈbukra sˈsaːʕa ˈʔarbaʕa	The appointment is tomorrow at four o'clock.	kaf;hamza;ta_marbuta;sun_assim;pharyngeal;geminate;long_vowel;diphthong;statement	aw→oː in mōʕid (omar1975); bukra 'tomorrow'; sun assimilation as-sāʕa
ar-SA-x-hejaz-010	أَهْلِي سَاكْنِين فِي الْمَدِينَة.	أهلي ساكنين في المدينة.	ˈʔahliː saːkˈniːn fiː lmaˈdiːna	My family lives in Medina.	kaf;hamza;ta_marbuta;long_vowel;statement	ahl 'family', active participle sāknīn for present residence (omar1975)
ar-SA-x-hejaz-011	رُوح دُغْرِي وَبَعْدَين لِف يَمِين.	روح دغري وبعدين لف يمين.	ˈruːħ ˈduɣriː wabaʕˈdeːn ˈlif jaˈmiːn	Go straight, then turn right.	pharyngeal;long_vowel;diphthong;imperative	imperatives rūḥ/lif; dughri 'straight' urban koine (omar1975); ay→eː in baʕdeːn
ar-SA-x-hejaz-012	الأَكِل كَان لَذِيذ مَرَّة.	الأكل كان لذيذ مرة.	ˈalʔakil ˈkaːn laˈdiːd ˈmarra	The food was very delicious.	interdental;kaf;hamza;ta_marbuta;geminate;long_vowel;statement	intensifier مَرَّة marra 'very' (Hejazi, omar1975); ذ→d ladīd urban stop reflex (abdoh2010); kān past
ar-SA-x-hejaz-013	فِين السُّوق؟ مَا أَعْرِف.	فين السوق؟ ما أعرف.	ˈfiːn asˈsuːɡ maː ˈʔaʕrif	Where's the market? I don't know.	qaf;hamza;sun_assim;pharyngeal;geminate;long_vowel;question;negation	interrogative fīn 'where' (omar1975); mā + imperfect negation; qaf→g sūg (abdoh2010)
ar-SA-x-hejaz-014	كَم أَخ عِنْدَك؟	كم أخ عندك؟	ˈkam ˈʔax ˈʕindak	How many brothers do you have?	kaf;hamza;pharyngeal;question;number	kam + singular count noun (omar1975); ʕindak possessive
ar-SA-x-hejaz-015	إِذَا تَبْغَى نَرُوح سَوَا.	إذا تبغى نروح سوا.	ˈʔidaː ˈtabɣaː naˈruːħ ˈsawaː	If you want, we'll go together.	interdental;hamza;pharyngeal;long_vowel;diphthong;statement	conditional إذا; abغā 'want' Hejazi verb tabghā (omar1975); sawa 'together'; ذ→d in idā (abdoh2010)
ar-SA-x-hejaz-016	أَمْس رُحْت السُّوق وَجِبْت خُضَار.	أمس رحت السوق وجبت خضار.	ˈʔams ˈruħt asˈsuːɡ waˈdʒibt xuˈdˤɑːr	Yesterday I went to the market and brought vegetables.	qaf;jim;hamza;sun_assim;emphatic;pharyngeal;geminate;long_vowel;statement	past narrative ruḥt/jibt (jāb 'bring', omar1975); qaf→g sūg; emphatic ض in khudˤār
ar-SA-x-hejaz-017	بُكْرَة بَسَافِر مَكَّة وَكَمَان الطَّايِف.	بكرة بسافر مكة وكمان الطايف.	ˈbukra baˈsaːfir ˈmakka wakaˈmaːn ɑtˤˈtˤɑːjif	Tomorrow I'll travel to Mecca and Taif too.	kaf;ta_marbuta;sun_assim;emphatic;geminate;long_vowel;statement	b-future prefix basāfir (omar1975); كَمَان kamān 'also' (Hejazi); sun assimilation aṭ-ṭāyif, emphatic ط
ar-SA-x-hejaz-018	كَلِّمْنِي عَلَى الْجَوَّال بُكْرَة.	كلمني على الجوال بكرة.	kalˈlimniː ˈʕalaː ldʒawˈwaːl ˈbukra	Call me on the mobile tomorrow.	jim;kaf;ta_marbuta;pharyngeal;geminate;long_vowel;diphthong;imperative	imperative kallim geminate ll; jawwāl 'mobile phone' جيم=/dʒ/ + geminate ww (abdoh2010)
ar-SA-x-hejaz-019	السَّلَام عَلَيْكُم. وَعَلَيْكُم السَّلَام.	السلام عليكم. وعليكم السلام.	assaˈlaːm ʕaˈleːkum waʕaˈleːkum assaˈlaːm	Peace be upon you. And upon you peace.	kaf;sun_assim;pharyngeal;geminate;long_vowel;diphthong;statement	greeting adjacency pair; ay→eː in ʕaleːkum (omar1975); sun assimilation as-salām
ar-SA-x-hejaz-020	اللَّه يَعْطِيك الْعَافْيَة.	الله يعطيك العافية.	ˈallah jaʕˈtˤiːk alˈʕaːfja	May God give you good health.	kaf;ta_marbuta;sun_assim;emphatic;pharyngeal;geminate;long_vowel;statement	closing formula; emphatic ط in yaʕṭīk; sun assimilation al-ʕāfya; urban Hijazi emphatic/inventory phonology per (omar1975)
