id	sentence	raw	ipa	gloss_en	features	notes
ar-TN-001	شْنُوَّة أَحْوَالَك؟ لَبَاس عْلِيك الْيُوم؟	شنوة أحوالك؟ لباس عليك اليوم؟	ˈʃnuwwa ʔaħˈwɛːlak laˈbɛːs ˈʕliːk alˈjuːm	How are you? Are you well today?	kaf;hamza;ta_marbuta;pharyngeal;geminate;long_vowel;question	šnuwwa interrogative (Tunis hallmark; PADIC/QADI-TN attest); labās (Maghrebi greeting); geminate وّ; Tunis consonant system and lexicon (šnuwwa, gemination) per (singer1984)
ar-TN-002	اَلْجَوّ بَاهِي الْيُوم وَالْبْحَر هَادِي فِي تُونِس.	الجو باهي اليوم والبحر هادي في تونس.	alˈʒaww ˈbɛːhiː lˈjuːm ˈwalbħar ˈhɛːdiː ˈfiː ˈtuːnis	The weather is fine today and the sea is calm in Tunis.	jim;pharyngeal;geminate;long_vowel;diphthong;statement	bāhi 'good' (Tunisian hallmark lexeme); ج=/ʒ/ (singer1984); cluster lbḥ-
ar-TN-003	مَا نْحِبّْش قَهْوَة، نْحِبّ تَاي سْخُون بَرْشَة.	ما نحبش قهوة، نحب تاي سخون برشة.	ˈmɛː ˈnħibbʃ ˈqahwa ˈnħibb ˈtaːj ˈsxuːn ˈbarʃa	I don't want coffee, I like very hot tea.	qaf;ta_marbuta;pharyngeal;geminate;long_vowel;negation	n- 1sg + ma-...-š negation (Maghrebi, versteegh-type; singer1984); barša 'a lot' (Tunisian hallmark); geminate بّ
ar-TN-004	شْرِيت ثْلَاثَة كِيلُو عْنَب مِن السُّوق بِخَمْسَة دِينَارَات.	شريت ثلاثة كيلو عنب من السوق بخمسة دينارات.	ˈʃriːt ˈθlɛːθa ˈkiːluː ˈʕnab ˈmin asˈsuːq biˈxamsa diːnaːˈraːt	I bought three kilos of grapes from the market for five dinars.	qaf;interdental;kaf;ta_marbuta;sun_assim;pharyngeal;geminate;long_vowel;statement;number	ث retained /θ/ in θlāθa (gibson2009 EALL: Tunis interdental retention — spec reflexes reordered accordingly); ق=/q/ sūq; clusters šr-/θl-/ʕn-
ar-TN-005	اَلرَّاجِل هَاذَاكَة يِخْدِم فِي الظّهْر زَادَة.	الراجل هاذاكة يخدم في الظهر زادة.	arˈraːʒil hɛːˈðɛːka ˈjixdim ˈfiː ˈɑðˤðˤhr ˈzɛːda	That man works at noon too.	jim;interdental;kaf;ta_marbuta;sun_assim;emphatic;geminate;long_vowel;statement	hāðāka demonstrative with ذ /ð/ retained (gibson2009); zāda 'also' (Tunisian); ظ=/ðˤ/ retained
ar-TN-006	اِمْشِي لِلسُّوق وْشْرِي الْخُبْز، يَعَيْشِك.	امشي للسوق وشري الخبز، يعيشك.	ˈʔimʃiː lisˈsuːq ˈwʃriː lˈxubz jaˈʕiːʃik	Go to the market and buy the bread, please.	qaf;kaf;pharyngeal;geminate;long_vowel;imperative	Tunis imperatives imshi/shri with syncope clusters; yaʕayshik politeness with the cited ay→iː monophthongization (gibson2009)
ar-TN-007	الْيُوم الْجَوّ مُوش بَاهِي، فَمَّة بَرْد بَرْشَة.	اليوم الجو موش باهي، فمة برد برشة.	alˈjuːm alˈʒaww ˈmuːʃ ˈbɛːhiː ˈfamma ˈbard ˈbarʃa	Today the weather isn't good, there's a lot of cold.	jim;ta_marbuta;geminate;long_vowel;diphthong;negation	mūš predicate negation + famma existential (Tunis; singer1984); bāhi 'good' and barša 'a lot' Tunis hallmark lexemes (gibson2009 EALL); imāla raises bāhi→[bɛːhiː].
ar-TN-008	بِقَدَّاش هَاذِي؟ بِثْلَاثَة دِينَار وْنُصّ.	بقداش هاذي؟ بثلاثة دينار ونص.	biqadˈdɛːʃ ˈhɛːðiː biθˈlɛːθa diːˈnaːr ˈwnusˤsˤ	How much is this? Three dinars and a half.	qaf;interdental;ta_marbuta;emphatic;geminate;long_vowel;question;number	bqaddāš 'how much' (Tunis); ث retained /θ/ in θlāθa (gibson2009 EALL: Tunis interdental retention); imāla raises θlāθa→[θlɛːθa] but is blocked before /r/ in dinār→[diːnaːr] (singer1984 imāla-block).
ar-TN-009	وَقْتَاش الْمِيعَاد؟ عَ الْعَشْرَة الصّْبَاح.	وقتاش الميعاد؟ ع العشرة الصباح.	waqˈtɛːʃ almiːˈʕaːd ˈʕa lˈʕaʃra sˤsˤˈbaːħ	When is the appointment? At ten in the morning.	qaf;ta_marbuta;sun_assim;emphatic;pharyngeal;long_vowel;question	waqtāš 'when' (Tunis interrogative); imāla blocked adjacent to /ʕ/ (mīʕād→[miːʕaːd]) and under emphasis (ṣbāḥ→[sˤsˤbaːħ]) — singer1984, gibson2009; sun-letter assimilation written on ص.
ar-TN-010	نُسْكُن فِي دَار كْبِيرَة مَعَ الْعَايْلَة فِي تُونِس.	نسكن في دار كبيرة مع العايلة في تونس.	ˈnuskun ˈfiː ˈdaːr ˈkbiːra ˈmaʕa lˈʕaːjla ˈfiː ˈtuːnis	I live in a big house with the family in Tunis.	kaf;ta_marbuta;pharyngeal;long_vowel;statement	residence frame: nuskun 'I live', dār 'house', ʕāyla 'family' (Tunis); dār→[daːr] imāla blocked before /r/ (singer1984), so the long vowel keeps its back quality against the raised default (gibson2009).
ar-TN-011	أَمْشِي دُغْرِي وْدَوَّرْ عَ الْيَسَار قُدَّام الْجَامِع.	أمشي دغري ودور ع اليسار قدام الجامع.	ˈʔamʃiː ˈduɣriː ˈwdawwar ˈʕa ljaˈsaːr qudˈdɛːm alˈʒɛːmiʕ	Go straight and turn left in front of the mosque.	qaf;jim;hamza;pharyngeal;geminate;long_vowel;diphthong;imperative	imperative chain amšī/dawwar; ج=/ʒ/ sedentary Maghrebi reflex, no occlusive onset (watson2002 p.16); imāla raises jāmiʕ→[ʒɛːmiʕ] and quddām→[quddɛːm] (gibson2009); dawwar keeps its geminate /ww/.
ar-TN-012	الْمَاكْلَة الّي كْلِينَا الْبَارِح كَانِت بَاهْيَة بَرْشَة.	الماكلة الي كلينا البارح كانت باهية برشة.	alˈmɛːkla ˈalliː ˈkliːnɛː alˈbaːriħ ˈkɛːnit ˈbɛːhja ˈbarʃa	The food we ate yesterday was very good.	kaf;ta_marbuta;pharyngeal;geminate;long_vowel;statement	past evaluation: mākla 'food', bāriḥ 'yesterday', barša 'a lot' (Tunis); imāla raised in mākla→[mɛːkla], kānit→[kɛːnit], bāhya→[bɛːhja] but blocked before /r/ in bāriḥ→[baːriħ] (singer1984, gibson2009).
ar-TN-013	وِين مْشِيت الْبَارِح؟ مَا لْقِيتْش صَاحْبِك فِي الدّار.	وين مشيت البارح؟ ما لقيتش صاحبك في الدار.	ˈwiːn ˈmʃiːt alˈbaːriħ ˈmɛː ˈlqiːtʃ ˈsˤɑːħbik ˈfiː dˈdaːr	Where did you go yesterday? I didn't find your friend at home.	qaf;kaf;sun_assim;emphatic;pharyngeal;geminate;long_vowel;question;negation	wīn 'where' + mā...š negation (Tunis; singer1984); ق=/q/ retained (lqīt); emphatic backing in ṣāḥbik→[sˤɑːħbik]; dār→[daːr] imāla blocked before /r/ (gibson2009).
ar-TN-014	قَدَّاش عَنْدِك مِن وْلَاد؟ عَنْدِي زُوز.	قداش عندك من ولاد؟ عندي زوز.	qadˈdɛːʃ ˈʕandik ˈmin ˈwlɛːd ˈʕandiː ˈzuːz	How many children do you have? I have two.	qaf;kaf;pharyngeal;geminate;long_vowel;question;number	qaddāš 'how many'; zūz 'two' < *zawj by long-distance sibilant harmony (singer1984:9); imāla raises qaddāš→[qadˈdɛːʃ] and wlād→[wlɛːd] (gibson2009).
ar-TN-015	كَان تْجِي غُدْوَة، نَمْشِيوْ لِلسُّوق مَعَ بَعْضْنَا.	كان تجي غدوة، نمشيو للسوق مع بعضنا.	ˈkɛːn ˈtʒiː ˈɣudwa namˈʃiːw lisˈsuːq ˈmaʕa ˈbaʕdˤnɛː	If you come tomorrow, we'll go to the market together.	qaf;jim;kaf;ta_marbuta;emphatic;pharyngeal;geminate;long_vowel;statement	conditional kān 'if' + ġudwa 'tomorrow' (Tunis; singer1984); n-...-w 1pl imperfect namšīw; ق=/q/ retained in sūq; imāla raises kān→[kɛːn] (gibson2009).
ar-TN-016	الْبَارِح مْشِيت لِلسُّوق وْشْرِيت خُبْز وْزِيت وْطَمَاطِم.	البارح مشيت للسوق وشريت خبز وزيت وطماطم.	alˈbaːriħ ˈmʃiːt lisˈsuːq ˈwʃriːt ˈxubz ˈwziːt wtˤɑˈmɑːtˤim	Yesterday I went to the market and bought bread, oil and tomatoes.	qaf;emphatic;pharyngeal;geminate;long_vowel;statement	past-narrative shopping: mšīt 'I went', šrīt 'I bought', ṭamāṭim 'tomatoes' (Tunis); bāriḥ→[baːriħ] imāla blocked before /r/; emphatic backing in ṭamāṭim→[tˤɑmɑːtˤim] (singer1984); sūq /q/ retained (gibson2009).
ar-TN-017	غُدْوَة بَاش نْسَافْرُوا لْصَفَاقُس بِالْكَار.	غدوة باش نسافروا لصفاقس بالكار.	ˈɣudwa ˈbɛːʃ ˈnsɛːfruː lsˤɑˈfaːqus bilˈkaːr	Tomorrow we will travel to Sfax by bus.	qaf;kaf;ta_marbuta;emphatic;long_vowel;statement	future particle bāš + ġudwa 'tomorrow' (Tunis; singer1984); kār 'bus' (Romance adstrate); imāla raised in bāš→[bɛːʃ], nsāfrū→[nsɛːfruː] but blocked under emphasis in ṣfāqus→[sˤɑfaːqus] and before /r/ in kār→[kaːr] (gibson2009).
ar-TN-018	عَيَّطْلِي فِي التِّيلِيفُون قَبْل مَا تْجِي، يَعَيْشِك.	عيطلي في التيليفون قبل ما تجي، يعيشك.	ʕajˈjɑtˤliː ˈfiː ttiːliːˈfuːn ˈqabl ˈmɛː ˈtʒiː jaˈʕiːʃik	Call me on the phone before you come, please.	qaf;jim;kaf;sun_assim;emphatic;pharyngeal;geminate;long_vowel;diphthong;imperative	ʕayyaṭ 'to phone/call' imperative, keeping its geminate /jj/; yaʕayšik politeness with the cited ay→iː monophthongisation → [jaʕiːʃik] (gibson2009 monophthong rule; singer1984); sun-letter assimilation written on ت.
ar-TN-019	عَسْلَامَة، شْنُوَّة أَحْوَالِك؟ الْحَمْدُ لِلَّه لَبَاس.	عسلامة، شنوة أحوالك؟ الحمد لله لباس.	ʕasˈlɛːma ˈʃnuwwa ʔaħˈwɛːlik alˈħamdu ˈlillah laˈbɛːs	Hello, how are you? Praise God, fine.	kaf;hamza;ta_marbuta;pharyngeal;geminate;long_vowel;question	greeting adjacency pair: ʕaslāma / šnuwwa aḥwālik / lābās Tunis formulae (singer1984); šnuwwa keeps geminate /ww/; imāla raises ʕaslāma→[ʕaslɛːma], aḥwālik→[ʔaħwɛːlik], lābās→[laˈbɛːs] (gibson2009).
ar-TN-020	الّي فَات مَات، وْرَبّي يْسَهِّل عْلِيك.	الي فات مات، وربي يسهل عليك.	ˈalliː ˈfɛːt ˈmɛːt ˈwrabbiː ˈjsahhil ˈʕliːk	What's past is past, and may God make it easy for you.	kaf;pharyngeal;geminate;long_vowel;statement	closing proverb 'illī fāt māt'; imāla raises fāt→[fɛːt] and māt→[mɛːt] (singer1984, gibson2009); geminates rabbī, ysahhil kept.
