id	sentence	raw	ipa	gloss_en	features	notes
ar-x-peninsular-001	كَيف حَالَك الْيَوم؟ عَادَك طَيِّب؟	كيف حالك اليوم؟ عادك طيب؟	ˈkajf ˈħaːlak alˈjawm ˈʕaːdak ˈtˤɑjjib	How are you today? Are you still well?	kaf;emphatic;pharyngeal;geminate;long_vowel;diphthong;question	pan-Peninsular ʕād- 'still' + suffix (watson2002; ingham1994); aw/ay diphthongs retained (kayf, al-yawm) — node conservative rank-1
ar-x-peninsular-002	الْيَوم بَارِد وَالسَّمَاء صَافِيَة.	اليوم بارد والسماء صافية.	alˈjawm ˈbaːrid wassaˈmaːʔ ˈsˤɑːfija	Today is cold and the sky is clear.	hamza;ta_marbuta;sun_assim;emphatic;geminate;long_vowel;diphthong;statement	diphthong retained (al-yawm); hamza final samāʔ; ta_marbuta; sun assimilation none; diphthong retention and final hamza per (watson2002)
ar-x-peninsular-003	مَا أَبْغَى قَهْوَة، أَبْغَى شَاهِي.	ما أبغى قهوة، أبغى شاهي.	ˈmaː ˈʔabɣaː ˈqahwa ˈʔabɣaː ˈʃaːhiː	I don't want coffee, I want tea.	qaf;hamza;ta_marbuta;long_vowel;negation	pan-Peninsular abġa 'I want' (ingham1994); ق→q retained is node rank-1 (omar1975 urban Hijazi retention); negation mā
ar-x-peninsular-004	اِشْتَرَيت ثَلَاثَة أَكْيَاس زَبِيب مِن السُّوق.	اشتريت ثلاثة أكياس زبيب من السوق.	ʔiʃtaˈrajt θaˈlaːθa ʔakˈjaːs zaˈbiːb ˈmin asˈsuːq	I bought three bags of raisins from the market.	qaf;interdental;kaf;hamza;ta_marbuta;sun_assim;geminate;long_vowel;diphthong;statement;number	ث retained /θ/ fricative-first is node rank-1 (watson2002); ق→q (sūq); number; diphthong akyās
ar-x-peninsular-005	هَذَا الرِّجَّال يِذْكُر الظُّهُر ذَاك.	هذا الرجال يذكر الظهر ذاك.	ˈhaðaː rridʒˈdʒaːl ˈjiðkur ˈɑðˤðˤuhur ˈðaːk	This man remembers that noon.	jim;interdental;kaf;sun_assim;emphatic;geminate;long_vowel;statement	ذ retained /ð/ and ظ retained /ðˤ/ fricative-first (watson2002; albalushi2016); geminate جّ; ḏāk demonstrative
ar-x-peninsular-006	قُوم رُوح لِلسُّوق وَجِيب سَمَك طَازَج.	قوم روح للسوق وجيب سمك طازج.	ˈquːm ˈruːħ lisˈsuːq waˈdʒiːb ˈsamak ˈtˤɑːzadʒ	Get up, go to the market and get fresh fish.	qaf;jim;kaf;emphatic;pharyngeal;geminate;long_vowel;imperative	peninsular imperatives gūm/rūḥ/jīb; ق→q (sūq); ج→dʒ; long vowels; sedentary qāf [q] and ǧīm→[dʒ] per (watson2002)
ar-x-peninsular-007	الْيَوم مُو حَارّ وَالسَّمَاء فِيهَا غِيُوم.	اليوم مو حار والسماء فيها غيوم.	alˈjawm ˈmuː ˈħaːrr wassaˈmaːʔ ˈfiːhaː ˈɣiːuːm	Today is not hot and there are clouds in the sky.	hamza;sun_assim;pharyngeal;geminate;long_vowel;diphthong;statement;negation	negator mū; diphthong retained (al-yawm); hamza samāʔ; geminate رّ; diphthong retention and emphatic/gemination phonology per (watson2002)
ar-x-peninsular-008	بِكَم الْكِيلُو؟ بِخَمْسَة وَنُصّ.	بكم الكيلو؟ بخمسة ونص.	ˈbikam alˈkiːluː biˈxamsa waˈnusˤsˤ	How much is the kilo? Five and a half.	kaf;ta_marbuta;emphatic;long_vowel;question;number	bikam question; geminate صّ; number; emphatic ص; Peninsular emphatic/gemination phonology per (watson2002)
ar-x-peninsular-009	الْمَوْعِد السَّاعَة ثَلَاثَة وَنُصّ الْعَصِر.	الموعد الساعة ثلاثة ونص العصر.	alˈmawʕid asˈsaːʕa θaˈlaːθa waˈnusˤsˤ ˈalʕɑsˤir	The appointment is at half past three in the afternoon.	interdental;ta_marbuta;sun_assim;emphatic;pharyngeal;geminate;long_vowel;diphthong;statement;number	ث retained /θ/ (watson2002); sun assimilation as-s; emphatic ص; geminate صّ
ar-x-peninsular-010	أَخُوي الْكِبِير سَاكِن فِي الْمَدِينَة.	أخوي الكبير ساكن في المدينة.	ʔaˈxuːj alkiˈbiːr ˈsaːkin ˈfiː lmaˈdiːna	My elder brother lives in the city.	kaf;hamza;ta_marbuta;long_vowel;statement	long vowels; pan-Peninsular axūy; kaf plain /k/; Peninsular vowel phonology per (watson2002)
ar-x-peninsular-011	رُوح سِيدَة وَبَعْدَين لِفّ يَمِين.	روح سيدة وبعدين لف يمين.	ˈruːħ ˈsiːda wabaʕˈdajn ˈliff jaˈmiːn	Go straight ahead and then turn right.	ta_marbuta;pharyngeal;geminate;long_vowel;diphthong;imperative	imperative rūḥ; diphthong retained (baʕdayn); geminate فّ; pan-Peninsular sīda 'straight'; diphthong retention per (watson2002)
ar-x-peninsular-012	الْأَكِل كَان زَين بَسّ الْمَرَق كَان بَارِد.	الأكل كان زين بس المرق كان بارد.	ˈalʔakil ˈkaːn ˈzajn ˈbass ˈalmaraq ˈkaːn ˈbaːrid	The food was good but the broth was cold.	qaf;kaf;hamza;geminate;long_vowel;diphthong;statement	pan-Peninsular zēn evaluation + maraq 'broth' (ingham1994); geminate سّ; sun assimilation none
ar-x-peninsular-013	وَين حَطَّيت الْمِفْتَاح؟ مَا لَقِيتُه.	وين حطيت المفتاح؟ ما لقيته.	ˈwajn ħɑtˤˈtˤɑjt almifˈtaːħ ˈmaː laˈqiːtuh	Where did you put the key? I did not find it.	qaf;emphatic;pharyngeal;long_vowel;diphthong;question;negation	pan-Peninsular wēn (ingham1994); diphthong environment; geminate طّ; negation mā
ar-x-peninsular-014	كَم وَاحِد جَاء أَمْس؟	كم واحد جاء أمس؟	ˈkam ˈwaːħid ˈdʒaːʔ ˈʔams	How many came yesterday?	jim;kaf;hamza;pharyngeal;long_vowel;question;number	ج→dʒ; hamza in jāʔ; kam + number question; pan-Peninsular ams 'yesterday'; ǧīm→[dʒ] and final hamza per (watson2002)
ar-x-peninsular-015	إِذَا جِيت بَدْرِي نْرُوح سَوَا.	إذا جيت بدري نروح سوا.	ˈʔiðaː ˈdʒiːt ˈbadriː ˈnruːħ ˈsawaː	If you come early we go together.	jim;interdental;hamza;pharyngeal;long_vowel;diphthong;statement	conditional iḏa with retained interdental ذ (watson2002); ج→dʒ; long vowels
ar-x-peninsular-016	رِحِت أَمْس لِلسُّوق وَجِبِت سَمَك طَازَج.	رحت أمس للسوق وجبت سمك طازج.	ˈriħit ˈʔams lisˈsuːq ˈwadʒibit ˈsamak ˈtˤɑːzadʒ	I went to the market yesterday and got fresh fish.	qaf;jim;kaf;hamza;emphatic;pharyngeal;geminate;long_vowel;statement	past narrative; ق→q (sūq); ج→dʒ; pan-Peninsular ams; diphthong absent; sedentary qāf [q] and ǧīm→[dʒ] per (watson2002)
ar-x-peninsular-017	بَاكِر نْسَافِر الصُّبْح بَدْرِي.	باكر نسافر الصبح بدري.	ˈbaːkir ˈnsaːfir ɑsˤˈsˤubħ ˈbadriː	Tomorrow we travel early in the morning.	kaf;sun_assim;emphatic;pharyngeal;long_vowel;statement	pan-Peninsular bākir 'tomorrow' (ingham1994); sun assimilation aṣ-ṣ; kaf plain; emphatic ص
ar-x-peninsular-018	أَلُو، مِنُو مَعَاي؟	ألو، منو معاي؟	ˈʔaluː ˈminuː maˈʕaːj	Hello, who is with me?	hamza;pharyngeal;long_vowel;question	phone frame; pan-Peninsular minu 'who' (ingham1994); long vowel
ar-x-peninsular-019	صَبَاح الْخَير، كَيف حَالَك؟	صباح الخير، كيف حالك؟	sˤɑˈbaːħ alˈxajr ˈkajf ˈħaːlak	Good morning, how are you?	kaf;emphatic;pharyngeal;long_vowel;diphthong;question	greeting pair; kayf ḥālak; diphthong retained in al-xayr, kayf (watson2002)
ar-x-peninsular-020	الصَّبِر زَين يَا طَوِيل الْعُمُر.	الصبر زين يا طويل العمر.	ˈɑsˤsˤɑbir ˈzajn ˈjaː tˤɑˈwijl ˈalʕumur	Patience is good, may you live long.	sun_assim;emphatic;pharyngeal;long_vowel;diphthong;statement	proverb closing; pan-Peninsular zēn; ṭawīl al-ʕumr politeness; geminate صّ; emphatic ص; Peninsular emphatic/gemination phonology per (watson2002)
