id	sentence	raw	ipa	gloss_en	features	notes
ar-YE-001	كَيف حَالَك الْيَوم يَا أَخِي؟ عَادَك طَيِّب؟	كيف حالك اليوم يا أخي؟ عادك طيب؟	kajf ħaːlak aljawm jaː ʔaxiː ʕaːdak tˤɑjjib	How are you today my brother? Are you still well?	kaf;hamza;emphatic;pharyngeal;geminate;long_vowel;diphthong;question	ʕād- 'still' + suffix (Sanaani, watson2002); diphthongs ay/aw retained (watson2002: Sanaani conservatism)
ar-YE-002	صَنْعَاء الْيَوم بَارِدَة وَالسَّمَاء صَافِيَة.	صنعاء اليوم باردة والسماء صافية.	sˤɑnʕaːʔ aljawm baːrida wassamaːʔ sˤɑːfija	Sanaa today is cold and the sky is clear.	hamza;ta_marbuta;sun_assim;emphatic;pharyngeal;geminate;long_vowel;diphthong;statement	emphatic ص with backing; hamza final سَمَاء; sun assimilation as-s
ar-YE-003	مَا أَشْتِي قَهْوَة، أَشْتِي شَاهِي بِالْحَلِيب.	ما أشتي قهوة، أشتي شاهي بالحليب.	maː ʔaʃtiː ɡahwa ʔaʃtiː ʃaːhiː bilħaliːb	I don't want coffee, I want tea with milk.	qaf;hamza;ta_marbuta;pharyngeal;long_vowel;negation	aští 'I want' (hallmark Sanaani verb, watson2002 s.v. šty); ق=/ɡ/ gahwa (watson2002: Sanaani g)
ar-YE-004	اِشْتَرَيت ثَلَاثَة أَكْيَاس زَبِيب مِن السُّوق بِأَلْفَين رِيَال.	اشتريت ثلاثة أكياس زبيب من السوق بألفين ريال.	ʔiʃtarajt θalaːθa ʔakjaːs zabiːb min assuːɡ biʔalfajn rijaːl	I bought three bags of raisins from the market for two thousand riyals.	qaf;interdental;kaf;hamza;ta_marbuta;sun_assim;geminate;long_vowel;diphthong;statement;number	ث retained /θ/ (watson2002: Sanaani interdental retention); ق=/ɡ/ sūg
ar-YE-005	هَاذَا الرَّجُل يِذْكُر الظُّهُر ذَاك زَين.	هاذا الرجل يذكر الظهر ذاك زين.	haːðaː rradʒul jiðkur ɑðˤðˤuhur ðaːk zajn	This man remembers that noon well.	jim;interdental;kaf;sun_assim;emphatic;geminate;long_vowel;diphthong;statement	ذ retained /ð/ in hāða/ðāk; ظ=/ðˤ/ retained (watson2002); zayn with ay retained (Sanaani conservatism)
