id	sentence	raw	ipa	gloss_en	features	notes
arb-001	قَالَ الرَّجُلُ الْحَكِيمُ إِنَّ الصِّدْقَ مَنْجَاةٌ لِلْمُؤْمِنِينَ.	قال الرجل الحكيم إن الصدق منجاة للمؤمنين.	ˈqaːla rˈradʒulu lħaˈkiːmu ˈʔinna sˤˈsˤidqa manˈdʒaːtun lilmuʔmiˈniːna	The wise man said that truthfulness is a salvation for the believers.	qaf;jim;kaf;hamza;ta_marbuta;sun_assim;emphatic;pharyngeal;geminate;long_vowel;statement	uvular /q/ (watson2002 §1); sun assimilation ar-r, as-s (ryding-conventions per holes2004); geminate نّ in إِنَّ
arb-002	ذَلِكَ الضَّيْفُ الْكَرِيمُ شَرِبَ الْقَهْوَةَ ثُمَّ غَادَرَ الْمَجْلِسَ.	ذلك الضيف الكريم شرب القهوة ثم غادر المجلس.	ˈðalika ɮˤˈɮˤajfu lkaˈriːmu ˈʃariba lˈqahwaa ˈθumma ˈɣaːdara lˈmadʒlisa	That noble guest drank the coffee and then left the gathering.	qaf;jim;interdental;kaf;ta_marbuta;sun_assim;emphatic;geminate;long_vowel;diphthong;statement	ض = [ɮˤɮˤ] lateral-emphatic geminate after article (Sibawayhi's value, versteegh2001 ch.2; arb spec note); interdental ذ
arb-003	هَلْ سَمِعْتُمْ ظَهِيرَةَ الْيَوْمِ صَوْتَ الرَّعْدِ فِي السَّحَابِ؟	هل سمعتم ظهيرة اليوم صوت الرعد في السحاب؟	ˈhal saˈmiʕtum ðˤaˈhiːraa lˈjawmi ˈsˤawta rˈraʕdi ˈfiː ssaˈħaːbi	Did you hear, at today's midday, the sound of thunder in the clouds?	interdental;ta_marbuta;sun_assim;emphatic;pharyngeal;geminate;long_vowel;diphthong;question	emphatic interdental ظ /ðˤ/ (watson2002); diphthongs /aw/ in صَوْت /aj/ absent — يَوْم aw; wasl elision fiː s-saḥāb
arb-004	لَنْ يَخْسَرَ الصَّابِرُونَ أَجْرَهُمْ أَبَدًا وَلَوْ طَالَ الزَّمَانُ.	لن يخسر الصابرون أجرهم أبدا ولو طال الزمان.	ˈlan ˈjaxsara sˤsˤaːbiˈruːna ˈʔadʒrahum ˈʔabadan ˈwalaw ˈtˤaːla zzaˈmaːnu	The patient will never lose their reward, even if time grows long.	jim;hamza;sun_assim;emphatic;geminate;long_vowel;diphthong;negation;statement	future negation لَنْ + subjunctive (classical syntax, versteegh2001); tanwin fath + silent alif in أَبَدًا
arb-005	اِشْتَرَتْ خَدِيجَةُ سَبْعَةَ أَثْوَابٍ بِالدِّينَارِ الذَّهَبِيِّ.	اشترت خديجة سبعة أثواب بالدينار الذهبي.	ˈʔiʃtarat xaˈdiːdʒau ˈsabʕaa ʔaθˈwaːbin biddiːˈnaːri ððahaˈbijji	Khadija bought seven garments with the golden dinar.	jim;interdental;hamza;ta_marbuta;sun_assim;pharyngeal;geminate;long_vowel;statement;number	wasl-initial verb اِشْتَرَتْ; ta marbuta liaison /tu/ in خَدِيجَةُ; interdentals ث ذ; geminate يّ in الذَّهَبِيِّ
