id	sentence	ipa	gloss_en	features	notes
ast-x-leon-001	El rapaz cueye la fueya del carbayu.	el rapaz̻ kweʝe la fweʝa del kaɾbaʝu	The boy picks the leaf of the oak.	diphthong_ie_ue;final_u;sibilant_voicing;rhotic;statement	Tonic Ŏ>/ue/ 'cueye','fueya', -LJ->[ʝ] and final -u 'carbayu' per morala_egido2009; the Leonese sibilant system realises coda ⟨z⟩ as an apico-alveolar (here [z̻]) not Castilian [θ] per garcia_arias2003.
ast-x-leon-002	La ñeve cubrió tol prau de Babia.	la ɲebe kubɾiɔ tol pɾaw de baβja	The snow covered the whole meadow of Babia.	palatal_nasal;palatal_initial;statement	Word-initial N->[ɲ] 'ñeve' per morala_egido2009; falling diphthong 'prau' and betacism 'ñeve' [b] per garcia_arias2003.
ast-x-leon-003	El gatu ñeru duerme cabu del llume.	el ɡatu ɲeɾu dweɾme kaβu del ʎume	The cat sleeps by the fire.	lateral_palatal;palatal_nasal;palatal_initial;diphthong_ie_ue;final_u;statement	Word-initial N->[ɲ] 'ñeru' and L->[ʎ] 'llume' per morala_egido2009; tonic Ŏ>/ue/ 'duerme' and final -u per garcia_arias2003.
ast-x-leon-004	¿Cuántos años tien to buelu?	kuantos̺ aɲos̺ tjen to bwelu	How many years does your grandfather have?	palatal_nasal;diphthong_ie_ue;final_u;sandhi;question;number	⟨ñ⟩ [ɲ] 'años' and diphthong 'tien' per morala_egido2009; final -u 'buelu' (< abuelo) per garcia_arias2003.
ast-x-leon-005	¡Baxa y pieslla la portiella!	baʃa ʝ pjes̺ʎa la poɾtjeʎa	Come down and shut the little gate!	lateral_palatal;diphthong_ie_ue;imperative	-LL->[ʎ] 'pieslla','portiella' and tonic Ĕ>/ie/ per morala_egido2009; ⟨x⟩ [ʃ] 'Baxa' per garcia_arias2003.
ast-x-leon-006	La muyer merca fariña na plaza.	la muʝeɾ meɾka faɾiɲa na plad͡za	The woman buys flour in the square.	palatal_nasal;sibilant_voicing;statement	-LJ->[ʝ] 'muyer' and ⟨ñ⟩ [ɲ] 'fariña' per morala_egido2009; the Leonese sibilant system realises ⟨z⟩ as an affricate [d͡z] here, not Castilian [θ] per garcia_arias2003.
ast-x-leon-007	Tres vacas pacen na braña.	tɾes̺ bakas̺ pat͡sen na bɾaɲa	Three cows graze on the high pasture.	palatal_nasal;sandhi;statement;number	⟨ñ⟩ [ɲ] 'braña' per morala_egido2009; ⟨c⟩ before front vowel realised as the Leonese affricate [t͡s] (medieval sibilant reflex) not [θ] per garcia_arias2003.
ast-x-leon-008	El molineiru moliú el centenu.	el molinejɾu moliu el t͡sentenu	The miller ground the rye.	final_u;sandhi;statement	Western ⟨ei⟩ 'molineiru' and final -u 'centenu' per morala_egido2009; ⟨c⟩ realised as affricate [t͡s] per garcia_arias2003.
ast-x-leon-009	Llovía muitu na Cabreira.	ʎobia mwitu na kabɾejɾa	It rained a lot in Cabreira.	lateral_palatal;palatal_initial;final_u;statement	Word-initial L->[ʎ] 'Llovía', -CT->/it/ 'muitu' and western ⟨ei⟩ 'Cabreira' per morala_egido2009; final -u per garcia_arias2003.
ast-x-leon-010	La fonte cuerre cerca del teixu.	la fonte kwere t͡seɾka del tejʃu	The spring runs near the yew.	diphthong_ie_ue;final_u;rhotic;statement	Tonic Ŏ>/ue/ 'cuerre' and western ⟨ei⟩ 'teixu' per morala_egido2009; ⟨c⟩ affricate [t͡s] 'cerca', trill [r] and final -u per garcia_arias2003.
ast-x-leon-011	El perru lladra tola nueite.	el peru ʎadɾa tola nweite	The dog barks all night.	lateral_palatal;palatal_initial;diphthong_ie_ue;final_u;rhotic;statement	Word-initial L->[ʎ] 'lladra' and -CT->/it/ 'nueite' per morala_egido2009; trill [r] 'perru' and final -u per garcia_arias2003.
ast-x-leon-012	Comimos queisu con pan de centenu.	komimos̺ kejz̺u kon pan de t͡sentenu	We ate cheese with rye bread.	final_u;sibilant_voicing;statement	Western ⟨ei⟩ 'queisu' and final -u per morala_egido2009; intervocalic ⟨s⟩ voiced [z̺] and ⟨c⟩ affricate [t͡s] — the Leonese sibilant system — per garcia_arias2003.
ast-x-leon-013	El ferreiru fizo una reya.	el ferejɾu fid͡zo una reʝa	The blacksmith made a plough-blade.	final_u;sibilant_voicing;rhotic;sandhi;statement	Western ⟨ei⟩ 'ferreiru', -LJ->[ʝ] 'reya' and final -u per morala_egido2009; ⟨z⟩ voiced affricate [d͡z] 'fizo' and trill [r] per garcia_arias2003.
ast-x-leon-014	¿Ónde ta el caminu pa la ilesia?	ɔnde ta el kaminu pa la ilez̺ja	Where is the way to the church?	final_u;sibilant_voicing;sandhi;question	Final -u 'caminu' per morala_egido2009; intervocalic ⟨s⟩ voiced [z̺] 'ilesia' and simplified 'ilesia' per garcia_arias2003.
ast-x-leon-015	La lluz del sol rellumbra na peña.	la ʎuz̻ del s̺ol reʎumbɾa na peɲa	The sunlight shines over the crag.	lateral_palatal;palatal_nasal;palatal_initial;sibilant_voicing;rhotic;statement	Word-initial and -LL->[ʎ] 'lluz','rellumbra', ⟨ñ⟩ [ɲ] 'peña' per morala_egido2009; coda ⟨z⟩ apico [z̻] and trill [r] per garcia_arias2003.
ast-x-leon-016	El rapaz ruempe la rama del ñozal.	el rapaz̻ rwempe la rama del ɲod͡zal	The boy breaks the branch of the walnut tree.	palatal_nasal;palatal_initial;diphthong_ie_ue;sibilant_voicing;rhotic;statement	Word-initial N->[ɲ] 'ñozal' and tonic Ŏ>/ue/ 'ruempe' per morala_egido2009; coda ⟨z⟩ [z̻], ⟨z⟩ affricate [d͡z] 'ñozal' and trill [r] per garcia_arias2003.
ast-x-leon-017	Falóu con Xuan na romería.	falɔu kon ʃwan na romeɾia	He talked with Xuan at the pilgrimage.	rhotic;statement	Western ⟨ou⟩ 'Falóu', F- retention and ⟨x⟩ [ʃ] 'Xuan' per morala_egido2009; trill [r] 'romería' per garcia_arias2003.
ast-x-leon-018	Diez ovejas baxan pol monte.	djez̻ obeʒas̺ baʃan pol monte	Ten sheep go down the hillside.	diphthong_ie_ue;sibilant_voicing;sandhi;statement;number	Diphthong 'Diez' [dje-] and ⟨x⟩ [ʃ] 'baxan' per morala_egido2009; ⟨j⟩ voiced [ʒ] 'ovejas' and coda ⟨z⟩ [z̻] 'Diez' — the Leonese voiced-sibilant reflex — per garcia_arias2003.
ast-x-leon-019	La muyer coyó fabes nel güertu.	la muʝeɾ koʝɔ faβes̺ nel ɡweɾtu	The woman picked beans in the garden.	final_u;sandhi;statement	-LJ->[ʝ] 'muyer','coyó' and final -u 'güertu' per morala_egido2009; intervocalic ⟨s⟩ voiced [z̺] 'fabes' per garcia_arias2003.
ast-x-leon-020	Nun quiero más pan nin queisu.	nun kjeɾo mas̺ pan nin kejz̺u	I don't want more bread or cheese.	diphthong_ie_ue;final_u;sibilant_voicing;negation;statement	Negator 'nun'/'nin' and diphthong 'quiero' per morala_egido2009; western ⟨ei⟩ 'queisu', final -u and intervocalic voiced ⟨s⟩ [z̺] per garcia_arias2003.
