id	sentence	ipa	gloss_en	features	notes
ca-x-balear-001	Es al¬∑lot cerca sa clau p'es carrer.	ňą…ôz …ôňąlňź…Ēt ňąs…õrk…ô ňąsa ňąklaw ňąp…õs k…ôňąre	The lad looks for the key along the street.	open_mid;schwa;sibilant_voicing;rhotic;sandhi	Salat article ‚ü®es‚ü© […ôz] 'es al¬∑lot' (Balearic definite from ipse) per veny1982; final-‚ü®r‚ü© loss 'carrer' [k…ôňąre] and geminate ‚ü®l¬∑l‚ü© [lňź] per recasens1996.
ca-x-balear-002	Sa casa √©s plena de gent.	ňąsa ňąkaz…ô ňąes ňąpl…õn…ô ňą√į…ô ňą í…õnt	The house is full of people.	open_mid;schwa;sibilant_voicing;sandhi	Salat article ‚ü®sa‚ü© [sa] per veny1982; voiced prepalatal ‚ü®g‚ü© [ í] 'gent' and atonic ‚ü®a/e‚ü©‚Üí[…ô] 'casa','plena' per recasens1996.
ca-x-balear-003	Aquesta pera √©s seca com un os.	…ôňąk…õst…ô ňąp…õ…ĺ…ô ňąes ňąs…õk…ô ňąk…Ēm ňąun ňą…Ēs	This pear is dry as a bone.	open_mid;schwa;sandhi	Balearic open-mid stressed ‚ü®e‚ü© [ňąp…õ…ĺ…ô],[ňąs…õk…ô] per veny1982; atonic final ‚ü®a‚ü©‚Üí[…ô] and open-mid ‚ü®o‚ü© [ňą…Ēs] per recasens1996.
ca-x-balear-004	Es moix dorm damunt sa cadira.	ňą…ôz ňąm…Ē í ňą√į…Ērm d…ôňąmun ňąsa k…ôňą√įi…ĺ…ô	The cat sleeps on the chair.	open_mid;schwa;sibilant_voicing;rhotic;sandhi	Salat article ‚ü®es‚ü© […ôz] 'es moix' per veny1982; voiced prepalatal ‚ü®ix‚ü© [ í] 'moix' and open-mid [ňąm…Ē í],[ňą√į…Ērm] per recasens1996.
ca-x-balear-005	Ses cases velles tenen ses finestres grosses.	ňąs…õs ňąkaz…ôz ňąv…õ é…ôs ňąt…õn…ôn ňąs…õs fiňąn…õst…ĺ…ôz ňą…£…ĺ…Ēs…ôs	The old houses have big windows.	lateral_palatal;open_mid;schwa;sibilant_voicing;sandhi	Palatal lateral ‚ü®ll‚ü© [ é] 'velles' and salat plural ‚ü®ses‚ü© [s…õs] per veny1982; final ‚ü®s‚ü© voiced [z] before vowel 'cases velles' (sandhi) per recasens1996.
ca-x-balear-006	On √©s sa clau des cotxe?	ňąon ňąes ňąsa ňąklaw ňą√į…õs ňąkot É…ô	Where is the key of the car?	open_mid;schwa	Salat forms ‚ü®sa‚ü©,‚ü®des‚ü© [sa],[√į…õs] (‚ü®de+es‚ü© contraction) per veny1982; open-mid [ňąkot É…ô] per recasens1996.
ca-x-balear-007	Es meu germ√† viu prop de sa pla√ßa.	ňą…ôz ňąm…õw  í…ôňąrma ňąviw ňąp…ĺ…Ēb ňąd…ô ňąsa ňąplas…ô	My brother lives near the square.	open_mid;schwa;sibilant_voicing;rhotic;sandhi	Salat ‚ü®es‚ü© […ôz] and phonemic labiodental ‚ü®v‚ü© [v] 'viu' (Balearic keeps /v/) per veny1982; final ‚ü®p‚ü©‚Üí[b] 'prob de' assimilation (sandhi) per recasens1996.
ca-x-balear-008	Sa reuni√≥ √©s dem√† a les tres.	ňąsa r…ôwniňąo ňąez √į…ôňąma ňą…ô ňąl…ôs ňąt…ĺ…õs	The meeting is tomorrow at three.	open_mid;schwa;sibilant_voicing;rhotic;sandhi	Salat ‚ü®sa‚ü© [sa] per veny1982; copula ‚ü®s‚ü© voiced [z] '√©s dem√†' and open-mid [ňąt…ĺ…õs] per recasens1996.
ca-x-balear-009	Vine de d'all√† i tanca es portal.	ňąvin…ô ňą√į…ô √į…ôňą éa ňąi ňątaŇčk…ô ňą…ôs poňąrtal	Come over here and shut the front door.	lateral_palatal;schwa;velar_nasal;rhotic;sandhi	Palatal lateral ‚ü®ll‚ü© [ é] 'd'all√†' and salat ‚ü®es‚ü© […ôs] 'es portal' per veny1982; velar nasal [Ňč] 'tanca' per recasens1996.
ca-x-balear-010	Quinze taronges i dotze pomes valen deu euros.	ňąkinz…ô t…ôňą…ĺ…Ē…≤ í…ôz ňąi ňą√į…Ēdz…ô ňąp…Ēm…ôz ňąval…ôn ňąd…õw ňą…õw…ĺos	Fifteen oranges and twelve apples cost ten euros.	palatal_nasal;open_mid;schwa;sibilant_voicing;sandhi	Palatal nasal ‚ü®ny‚ü© […≤] 'taronges' and voiced ‚ü®tz/dz‚ü© [dz] 'dotze' per recasens1996; phonemic ‚ü®v‚ü© [v] 'valen' per veny1982.
ca-x-balear-011	Es ca corre per sa vora des torrent.	ňą…ôs ňąka ňąk…Ēr…ô ňąp…ôr ňąsa ňąv…Ē…ĺ…ô ňą√į…õs toňąr…õnt	The dog runs along the bank of the stream.	open_mid;schwa;rhotic	Salat ‚ü®es‚ü©,‚ü®sa‚ü©,‚ü®des‚ü© per veny1982; phonemic ‚ü®v‚ü© [v] 'vora', trill ‚ü®rr‚ü© [r] 'corre','torrent' and open-mid [ňąk…Ēr…ô] per recasens1996.
ca-x-balear-012	Sa madona menja pa amb oli.	ňąsa m…ôňą√į…Ēn…ô ňąm…õ…≤ í…ô ňąpa ňą…ôm ňą…Ēli	The mistress of the house eats bread with oil.	palatal_nasal;open_mid;schwa;sibilant_voicing;sandhi	Salat ‚ü®sa‚ü© [sa] and lexical 'madona' per veny1982; palatal nasal ‚ü®nj‚ü© […≤] 'menja' and open-mid [ňą…Ēli] per recasens1996.
ca-x-balear-013	Aquell al¬∑lot jove fa feina a sa f√†brica.	…ôňąk…õ é …ôňąlňź…Ēd ňą í…Ēv…ô ňąfa ňąf…õjn…ô ňą…ô ňąsa ňąfaő≤…ĺik…ô	That young lad works at the factory.	lateral_palatal;open_mid;schwa;sibilant_voicing;sandhi	Palatal lateral ‚ü®ll‚ü© [ é] 'aquell', geminate ‚ü®l¬∑l‚ü© [lňź] 'al¬∑lot' and 'fa feina' idiom per veny1982; phonemic ‚ü®v‚ü© [v] 'jove' per recasens1996.
ca-x-balear-014	No crec que faci sol aquesta setmana.	ňąno ňąk…ĺ…õk ňąk…ô ňąfasi ňąs…Ēl …ôňąk…õst…ô s…ôňątman…ô	I do not think it will be sunny this week.	open_mid;schwa	Open-mid ‚ü®o‚ü© [ňąs…Ēl] and stressed [ňąk…ĺ…õk] per recasens1996; atonic ‚ü®a/e‚ü©‚Üí[…ô] 'aquesta','setmana' per veny1982.
ca-x-balear-015	Sa muntanya √©s plena de neu enguany.	ňąsa muňąnt…ô…≤…ô ňąes ňąpl…õn…ô ňą√į…ô ňąn…õw …ôňąn…°wa…≤	The mountain is full of snow this year.	palatal_nasal;open_mid;schwa;sandhi	Salat ‚ü®sa‚ü© [sa] per veny1982; palatal nasal ‚ü®ny‚ü© […≤] 'muntanya','enguany' and open-mid [ňąpl…õn…ô],[ňąn…õw] per recasens1996.
ca-x-balear-016	Es nins petits juguen a sa pla√ßa.	ňą…ôz ňąnins p…ôňątidz ňą íu…£…ôn ňą…ô ňąsa ňąplas…ô	The little children play in the square.	schwa;sibilant_voicing;sandhi	Salat ‚ü®es‚ü©,‚ü®sa‚ü© per veny1982; final ‚ü®ts‚ü© voiced [dz] 'petits' before vowel (sandhi) and atonic reduction per recasens1996.
ca-x-balear-017	Quanta gent ha vengut a sa festa?	ňąkwant…ô ňą í…õnt ňąa v…ôňąn…°ut ňą…ô ňąsa ňąf…õst…ô	How many people have come to the party?	open_mid;schwa;sibilant_voicing	Salat ‚ü®sa‚ü© [sa] per veny1982; phonemic ‚ü®v‚ü© [v] 'vengut' and voiced ‚ü®g‚ü© [ í] 'gent' [ňą í…õnt] per recasens1996.
ca-x-balear-018	Sent sa pluja caure damunt ses teulades.	ňąs…õn ňąsa ňąplu í…ô ňąkaw…ĺ…ô √į…ôňąmun ňąs…õs t…ôňąwla√į…ôs	I hear the rain falling on the roofs.	open_mid;schwa;sibilant_voicing	Salat ‚ü®sa‚ü©,‚ü®ses‚ü© per veny1982; voiced prepalatal ‚ü®j‚ü© [ í] 'pluja' and final ‚ü®t‚ü© loss 'sent' [ňąs…õn] per recasens1996.
ca-x-balear-019	Bon dia, com va sa vida per aqu√≠?	ňąb…Ēn ňądi…ô ňąk…Ēm ňąva ňąsa ňąvi√į…ô ňąp…ôr …ôňąki	Good morning, how is life around here?	open_mid;schwa;rhotic	Salat ‚ü®sa‚ü© [sa] per veny1982; phonemic ‚ü®v‚ü© [v] 'va','vida' and open-mid [ňąb…Ēn],[ňąk…Ēm] per recasens1996.
ca-x-balear-020	Sa meva filla du un vestit vermell.	ňąsa ňąm…õv…ô ňąfi é…ô ňą√įu ňąun v…ôňąstid v…ôňąrm…õ é	My daughter is wearing a red dress.	lateral_palatal;final_u;open_mid;schwa;rhotic;sandhi	Salat ‚ü®sa‚ü© [sa] and verb 'du' (dur) [ňą√įu] with atonic final ‚ü®u‚ü© per veny1982; palatal lateral ‚ü®ll‚ü© [ é] 'filla','vermell' and phonemic ‚ü®v‚ü© [v] 'vestit' per recasens1996.
