id	sentence	ipa	gloss_en	features	notes
es-CL-x-chilote-001	En Chilo√© se prepara el curanto en un hoyo con piedras.	ňąen t Éiňąloe ňąse p…ĺeňąpa…ĺa ňąel kuňą…ĺanto ňąen ňąun oňą Ěo ňąkon ňąpjed…ĺas	In Chilo√© the curanto is cooked in a pit with stones.	yeismo;diphthong_ie_ue;sandhi;statement	ye√≠smo ‚ü®ll/y‚ü© to [ Ě]; tonic ńĒ>ie / ŇĆ>ue diphthong [je we]; coda /s/ retained as [s] per lipski1994.
es-CL-x-chilote-002	Los vecinos hacen una minga para mover la casa.	ňąlos beňąsinos ňąasen ňąuna ňąmin…°a ňąpa…ĺa moňąbe…ĺ ňąla ňąkasa	The neighbours hold a minga to move the house.	seseo;sandhi;statement	seseo merges ‚ü®c/z‚ü© to [s]; coda /s/ retained as [s] per lipski1994.
es-CL-x-chilote-003	Mi abuela cuenta cuentos de la Pincoya y el Trauco.	ňąmi aňąő≤wela ňąkwenta ňąkwentos ňąde ňąla piňąnko Ěa ňąi ňąel ňąt…ĺawko	My grandmother tells tales of the Pincoya and the Trauco.	yeismo;diphthong_ie_ue;sandhi;statement	ye√≠smo ‚ü®ll/y‚ü© to [ Ě]; tonic ńĒ>ie / ŇĆ>ue diphthong [je we]; coda /s/ retained as [s] per lipski1994.
es-CL-x-chilote-004	El bote cruza el canal cuando baja la marea.	ňąel ňąbote ňąk…ĺusa ňąel kaňąnal ňąkwando ňąbaxa ňąla ňąma…ĺea	The boat crosses the channel when the tide goes out.	seseo;sandhi;statement	seseo merges ‚ü®c/z‚ü© to [s]; coda /s/ retained as [s] per lipski1994.
es-CL-x-chilote-005	Nosotros juntamos le√Īa seca para el fog√≥n.	noňąsot…ĺos xuňąntamos ňąle…≤a ňąseka ňąpa…ĺa ňąel foňą…£on	We gather dry firewood for the hearth.	palatal_nasal;sandhi;statement	palatal nasal ‚ü®√Ī‚ü© […≤]; coda /s/ retained as [s] per lipski1994.
es-CL-x-chilote-006	La lluvia cae sin parar durante todo el mes.	ňąla ňą Ěubja ňąkae ňąsin paňą…ĺa…ĺ duňą…ĺante ňąto√įo ňąel ňąmes	The rain falls nonstop the whole month.	yeismo;sandhi;statement	ye√≠smo ‚ü®ll/y‚ü© to [ Ě]; coda /s/ retained as [s] per lipski1994.
es-CL-x-chilote-007	Comimos milcao y chapaleles con chicharr√≥n.	koňąmimos ňąmilkao ňąi t Éapaňąleles ňąkon t Éit Éaňąron	We ate milcao and chapaleles with pork crackling.	rhotic;sandhi;statement	trill [r]; coda /s/ retained as [s] per lipski1994.
es-CL-x-chilote-008	El cordero se asa despacio junto al fuego.	ňąel koňą…ĺde…ĺo ňąse ňąasa deňąspasjo ňąxunto ňąal ňąfwe…£o	The lamb roasts slowly by the fire.	seseo;diphthong_ie_ue;sandhi;statement	seseo merges ‚ü®c/z‚ü© to [s]; tonic ńĒ>ie / ŇĆ>ue diphthong [je we]; coda /s/ retained as [s] per lipski1994.
es-CL-x-chilote-009	¬ŅVos vais a la fiesta del pueblo el domingo?	ňąbos ňąbajs ňąa ňąla ňąfjesta ňądel ňąpweblo ňąel doňąmin…°o	Are you going to the town feast on Sunday?	diphthong_ie_ue;sandhi;question	tonic ńĒ>ie / ŇĆ>ue diphthong [je we]; coda /s/ retained as [s] per lipski1994.
es-CL-x-chilote-010	Los pescadores salen temprano a buscar choros.	ňąlos peskaňą√įo…ĺes ňąsalen teňąmp…ĺano ňąa buňąska…ĺ ňąt Éo…ĺos	The fishermen set out early to gather mussels.	sandhi;statement	cross-word sandhi elision; coda /s/ retained as [s] per lipski1994.
es-CL-x-chilote-011	La ni√Īa recoge manzanas para hacer chicha.	ňąla ňąni…≤a reňąkoxe maňąnsanas ňąpa…ĺa aňąse…ĺ ňąt Éit Éa	The girl gathers apples to make chicha.	seseo;palatal_nasal;rhotic;statement	seseo merges ‚ü®c/z‚ü© to [s]; palatal nasal ‚ü®√Ī‚ü© […≤]; trill [r]; coda /s/ retained as [s] per lipski1994.
es-CL-x-chilote-012	El caballo corre por la pampa mojada del campo.	ňąel kaňąő≤a Ěo ňąkore ňąpo…ĺ ňąla ňąpampa moňąxa√įa ňądel ňąkampo	The horse runs across the wet field.	yeismo;rhotic;statement	ye√≠smo ‚ü®ll/y‚ü© to [ Ě]; trill [r]; coda /s/ retained as [s] per lipski1994.
es-CL-x-chilote-013	Tra√©me la olla que dej√© en la cocina de fierro.	ňąt…ĺaeme ňąla ňąo Ěa ňąke deňąxe ňąen ňąla koňąsina ňąde ňąfjero	Bring me the pot I left on the iron stove.	seseo;yeismo;diphthong_ie_ue;rhotic;sandhi;imperative	seseo merges ‚ü®c/z‚ü© to [s]; ye√≠smo ‚ü®ll/y‚ü© to [ Ě]; tonic ńĒ>ie / ŇĆ>ue diphthong [je we]; coda /s/ retained as [s] per lipski1994.
es-CL-x-chilote-014	El bosque guarda muchos helechos y musgos.	ňąel ňąboske ňą…°a…ĺda ňąmut Éos eňąlet Éos ňąi ňąmus…°os	The forest holds many ferns and mosses.	statement	cross-word sandhi elision; coda /s/ retained as [s] per lipski1994.
es-CL-x-chilote-015	Prende el chonch√≥n que se cort√≥ la luz.	ňąp…ĺende ňąel t Éoňąnt Éon ňąke ňąse koňą…ĺto ňąla ňąlus	Light the oil lamp, the power went out.	seseo;sandhi;imperative	seseo merges ‚ü®c/z‚ü© to [s]; coda /s/ retained as [s] per lipski1994.
es-CL-x-chilote-016	Mi t√≠o teje redes para pescar en el mar.	ňąmi ňątio ňątexe ňąre√įes ňąpa…ĺa peňąska…ĺ ňąen ňąel ňąma…ĺ	My uncle weaves nets to fish at sea.	rhotic;statement	trill [r]; coda /s/ retained as [s] per lipski1994.
es-CL-x-chilote-017	El zorro chilote se esconde entre los arbustos.	ňąel ňąsoro t Éiňąlote ňąse eňąskonde ňąent…ĺe ňąlos aňą…ĺbustos	The Chilo√© fox hides among the bushes.	seseo;rhotic;sandhi;statement	seseo merges ‚ü®c/z‚ü© to [s]; trill [r]; coda /s/ retained as [s] per lipski1994.
es-CL-x-chilote-018	Hierve el agua para el mate de la tarde.	ňąje…ĺbe ňąel ňąa…°a ňąpa…ĺa ňąel ňąmate ňąde ňąla ňąta…ĺde	Boil the water for the afternoon mate.	diphthong_ie_ue;sandhi;imperative	tonic ńĒ>ie / ŇĆ>ue diphthong [je we]; coda /s/ retained as [s] per lipski1994.
es-CL-x-chilote-019	Corre a cerrar la puerta que entra el viento.	ňąkore ňąa seňąra…ĺ ňąla ňąpwe…ĺta ňąke ňąent…ĺa ňąel ňąbjento	Run to shut the door, the wind is coming in.	seseo;diphthong_ie_ue;rhotic;sandhi;imperative	seseo merges ‚ü®c/z‚ü© to [s]; tonic ńĒ>ie / ŇĆ>ue diphthong [je we]; trill [r]; coda /s/ retained as [s] per lipski1994.
es-CL-x-chilote-020	La se√Īora vende papas nativas en la feria.	ňąla seňą…≤o…ĺa ňąbende ňąpapas naňątibas ňąen ňąla ňąfe…ĺja	The lady sells native potatoes at the market.	palatal_nasal;sandhi;statement	palatal nasal ‚ü®√Ī‚ü© […≤]; coda /s/ retained as [s] per lipski1994.
