id	sentence	ipa	gloss_en	features	notes
es-DO-001	Las casas est√°n cerradas por el aguacero fuerte.	lah ňąkasah eňąstaŇč seňąra√įah po…ĺ el a…°aňąse…ĺo ňąfwe…ĺte	The houses are shut because of the heavy downpour.	seseo;coda_s_aspiration;diphthong_ie_ue;velar_nasal;rhotic;sandhi	coda /s/ aspiration to [h] (Caribbean weakening); word-final /n/ velarisation to [Ňč] per hualde2005.
es-DO-002	Mi pana comi√≥ arroz con habichuelas en el concho.	mi ňąpana koňąmio aňąros koŇč aő≤iňąt Éwelah eŇč el ňąkont Éo	My buddy ate rice with beans in the shared taxi.	seseo;coda_s_aspiration;diphthong_ie_ue;velar_nasal;rhotic;sandhi	coda /s/ aspiration to [h] (Caribbean weakening); word-final /n/ velarisation to [Ňč] per fontanella_de_weinberg1992.
es-DO-003	El ni√Īo peque√Īo juega en el parque los domingos.	el ňąni…≤o peňąke…≤o ňąxwe…£a eŇč el ňąpa…ĺke loh doňąmin…°oh	The little boy plays in the park on Sundays.	palatal_nasal;coda_s_aspiration;diphthong_ie_ue;velar_nasal;sandhi	coda /s/ aspiration to [h] (Caribbean weakening); word-final /n/ velarisation to [Ňč] per penny2002.
es-DO-004	¬ŅVamos a coger la guagua para el centro?	ňąbamoh a koňąxe…ĺ la ňą…°a…°a pa…ĺa el ňąsent…ĺo	Shall we take the bus downtown?	seseo;coda_s_aspiration;sandhi	coda /s/ aspiration to [h] (Caribbean weakening); seseo: ‚ü®c/z‚ü© merged to [s] per hualde2005.
es-DO-005	Ese muchacho baila muy bien la bachata.	ňąese muňąt Éat Éo ňąbajla ňąmui ňąbjeŇč la baňąt Éata	That boy dances bachata really well.	diphthong_ie_ue;velar_nasal	word-final /n/ velarisation to [Ňč]; Romance rising diphthong ‚ü®ie/ue‚ü© [je/we] per fontanella_de_weinberg1992.
es-DO-006	La luz del faro brilla sobre el malec√≥n de noche.	la ňąlus del ňąfa…ĺo ňąb…ĺi Ěa ňąsob…ĺe el maleňąkoŇč de ňąnot Ée	The lighthouse beam shines over the seafront at night.	seseo;yeismo;velar_nasal;sandhi	word-final /n/ velarisation to [Ňč]; seseo: ‚ü®c/z‚ü© merged to [s] per penny2002.
es-DO-007	Compr√© diez guineos maduros en el colmado.	koňąmp…ĺe ňądjes ňą…°ineoh maňą√įu…ĺoh eŇč el koňąlma√įo	I bought ten ripe bananas at the corner store.	seseo;coda_s_aspiration;diphthong_ie_ue;velar_nasal;sandhi	coda /s/ aspiration to [h] (Caribbean weakening); word-final /n/ velarisation to [Ňč] per hualde2005.
es-DO-008	El coraz√≥n de la ciudad late con merengue y baile.	el ko…ĺaňąsoŇč de la sjuňą√įa ňąlate koŇč meňą…ĺen…°e i ňąbajle	The heart of the city beats with merengue and dance.	seseo;velar_nasal	word-final /n/ velarisation to [Ňč]; seseo: ‚ü®c/z‚ü© merged to [s] per fontanella_de_weinberg1992.
es-DO-009	Los pescadores salen al amanecer con sus redes.	loh peskaňą√įo…ĺeh ňąsaleŇč al amaneňąse…ĺ koŇč suh ňąre√įeh	The fishermen set out at dawn with their nets.	seseo;coda_s_aspiration;velar_nasal;rhotic;sandhi	coda /s/ aspiration to [h] (Caribbean weakening); word-final /n/ velarisation to [Ňč] per penny2002.
es-DO-010	¬ŅCu√°ntas personas vienen a la fiesta esta noche?	ňąkuantah peňą…ĺsonah ňąbjeneŇč a la ňąfjesta ňąesta ňąnot Ée	How many people are coming to the party tonight?	coda_s_aspiration;diphthong_ie_ue;velar_nasal;sandhi	coda /s/ aspiration to [h] (Caribbean weakening); word-final /n/ velarisation to [Ňč] per hualde2005.
es-DO-011	La regi√≥n del Cibao guarda muchos pueblos antiguos.	la reňąxioŇč del ňąsiő≤ao ňą…°a…ĺda ňąmut Éoh ňąpwebloh aňąnti…°oh	The Cibao region holds many old villages.	seseo;coda_s_aspiration;diphthong_ie_ue;velar_nasal;rhotic;sandhi	coda /s/ aspiration to [h] (Caribbean weakening); word-final /n/ velarisation to [Ňč] per fontanella_de_weinberg1992.
es-DO-012	El perro corre detr√°s del carro por la avenida.	el ňąpero ňąkore deňąt…ĺah del ňąkaro po…ĺ la abeňąni√įa	The dog runs after the car along the avenue.	coda_s_aspiration;rhotic;sandhi	coda /s/ aspiration to [h] (Caribbean weakening); alveolar trill [r] preserved per penny2002.
es-DO-013	No quiero que llueva sobre las monta√Īas hoy.	ňąno ňąkje…ĺo ke ňą Ěweba ňąsob…ĺe lah moňąnta…≤ah ňąoi	I don't want it to rain over the mountains today.	yeismo;palatal_nasal;coda_s_aspiration;diphthong_ie_ue;sandhi	coda /s/ aspiration to [h] (Caribbean weakening); ye√≠smo: ‚ü®ll/y‚ü© realised [ Ě] per hualde2005.
es-DO-014	Mi hermano vive lejos, cerca del r√≠o grande.	mi eňą…ĺmano ňąbibe ňąlexoh ňąse…ĺka del ňąrio ňą…°…ĺande	My brother lives far away, near the big river.	seseo;coda_s_aspiration;rhotic	coda /s/ aspiration to [h] (Caribbean weakening); seseo: ‚ü®c/z‚ü© merged to [s] per fontanella_de_weinberg1992.
es-DO-015	La mujer canta una canci√≥n vieja y hermosa.	la muňąxe…ĺ ňąkanta una kaňąnsioŇč ňąbjexa i eňą…ĺmosa	The woman sings an old and beautiful song.	seseo;diphthong_ie_ue;velar_nasal;sandhi	word-final /n/ velarisation to [Ňč]; seseo: ‚ü®c/z‚ü© merged to [s] per penny2002.
es-DO-016	Dame un poco de agua bien fr√≠a, por favor.	ňądame uŇč ňąpoko de ňąa…°a ňąbjeŇč ňąf…ĺia po…ĺ faňąbo…ĺ	Give me a little very cold water, please.	diphthong_ie_ue;velar_nasal;sandhi	word-final /n/ velarisation to [Ňč]; Romance rising diphthong ‚ü®ie/ue‚ü© [je/we] per hualde2005.
es-DO-017	Aquellos √°rboles dan sombra en el conuco.	aňąke Ěoh ňąa…ĺboleh ňądaŇč ňąsomb…ĺa eŇč el koňąnuko	Those trees give shade over the small farm plot.	yeismo;coda_s_aspiration;velar_nasal;sandhi	coda /s/ aspiration to [h] (Caribbean weakening); word-final /n/ velarisation to [Ňč] per fontanella_de_weinberg1992.
es-DO-018	El se√Īor mayor cuenta historias de su juventud.	el seňą…≤o…ĺ maňą Ěo…ĺ ňąkwenta iňąsto…ĺjah de su xubeňąntu	The old gentleman tells stories of his youth.	yeismo;palatal_nasal;coda_s_aspiration;diphthong_ie_ue;sandhi	coda /s/ aspiration to [h] (Caribbean weakening); ye√≠smo: ‚ü®ll/y‚ü© realised [ Ě] per penny2002.
es-DO-019	Las estrellas alumbran el campo durante la madrugada.	lah eňąst…ĺe Ěah aňąlumb…ĺaŇč el ňąkampo duňą…ĺante la mad…ĺuňą…£a√įa	The stars light up the countryside in the early morning.	yeismo;coda_s_aspiration;velar_nasal;sandhi	coda /s/ aspiration to [h] (Caribbean weakening); word-final /n/ velarisation to [Ňč] per hualde2005.
es-DO-020	Buenos d√≠as, ¬Ņc√≥mo amaneci√≥ usted por ac√°?	ňąbwenoh ňądiah ňąkomo amaneňąsio uňąste po…ĺ aňąka	Good morning, how did you wake up around here?	seseo;coda_s_aspiration;diphthong_ie_ue;sandhi	coda /s/ aspiration to [h] (Caribbean weakening); seseo: ‚ü®c/z‚ü© merged to [s] per fontanella_de_weinberg1992.
