id	sentence	ipa	gloss_en	features	notes
es-EC-001	El guagua llora porque tiene mucha hambre.	el ňą…°wa…£wa ňą Ěo…ĺa ňąpo…ĺke ňątjene ňąmut Éa ňąamb…ĺe	The baby cries because it is very hungry.	yeismo;diphthong_ie_ue;statement	Quichua loan guagua; seseo and yeismo per hualde2005
es-EC-002	¬ŅVas a comprar el mote en la plaza ma√Īana?	ňąbas a koňąmp…ĺa…ĺ el ňąmote en la ňąplasa maňą…≤ana	Are you buying the hominy at the square tomorrow?	seseo;palatal_nasal;sandhi;question	Ecuadorian lexicon (mote); palatal nasal ma√Īana; penny2002
es-EC-003	Ella lleva la llave de la casa en la mano.	ňąe Ěa ňą Ěeba la ňą Ěabe de la ňąkasa en la ňąmano	She carries the house key in her hand.	yeismo;sandhi;statement	yeismo ll/y‚Üí[ Ě]; lipski1994
es-EC-004	No quiero que llegues tarde a la minga.	ňąno ňąkje…ĺo ke ňą Ěe…°es ňąta…ĺde a la ňąmin…°a	I don't want you to be late to the communal work.	yeismo;diphthong_ie_ue;sandhi;negation	yeismo llegues‚Üí[ Ě]; diphthong quiero‚Üí[je]; fontanella_de_weinberg1992
es-EC-005	Sirve el encebollado bien caliente al almuerzo.	ňąsi…ĺbe el enseő≤oňą Ěa√įo ňąbjen kaňąljente al aňąlmwe…ĺso	Serve the fish soup nice and hot for lunch.	seseo;yeismo;diphthong_ie_ue;sandhi;imperative	Ecuadorian dish; diphthong caliente‚Üí[je]; hualde2005
es-EC-006	Mi √Īa√Īo trabaja en la hacienda del valle.	mi ňą…≤a…≤o t…ĺaňąő≤axa en la aňąsjenda del ňąba Ěe	My brother works on the estate in the valley.	seseo;yeismo;palatal_nasal;palatal_initial;diphthong_ie_ue;sandhi;statement	word-initial √Ī‚Üí[…≤]; yeismo valle‚Üí[ Ě]; penny2002
es-EC-007	Los perros ladran junto al r√≠o toda la noche.	los ňąperos ňąlad…ĺan ňąxunto al ňąrio ňąto√įa la ňąnot Ée	The dogs bark by the river all night.	rhotic;sandhi;statement	trill perros/r√≠o; seseo n/a; lipski1994
es-EC-008	¬ŅCu√°ntos a√Īos vives en Quito ya, vecino?	ňąkuantos ňąa…≤os ňąbibes en ňąkito ňą Ěa beňąsino	How many years have you lived in Quito now, neighbor?	seseo;yeismo;palatal_nasal;sandhi;question	diphthong vives n/a; sandhi; fontanella_de_weinberg1992
es-EC-009	Compramos dos mil d√≥lares de material ayer.	koňąmp…ĺamos ňądos ňąmil ňądola…ĺes de mateňą…ĺjal aňą Ěe…ĺ	We bought two thousand dollars of material yesterday.	yeismo;sandhi;number	numeral; local currency; hualde2005
es-EC-010	La se√Īora vende llapingachos en el mercado.	la seňą…≤o…ĺa ňąbende  Ěapiňąn…°at Éos en el meňą…ĺka√įo	The lady sells potato patties at the market.	yeismo;palatal_nasal;palatal_initial;sandhi;statement	yeismo llapingachos‚Üí[ Ě]; palatal nasal se√Īora; penny2002
es-EC-011	Nadie quiere caminar bajo la lluvia fr√≠a.	ňąna√įje ňąkje…ĺe kamiňąna…ĺ ňąbaxo la ňą Ěubja ňąf…ĺia	Nobody wants to walk under the cold rain.	yeismo;diphthong_ie_ue;negation	yeismo lluvia‚Üí[ Ě]; diphthong quiere‚Üí[je]; lipski1994
es-EC-012	Trae el aj√≠ de la cocina para el hornado.	ňąt…ĺae el aňąxi de la koňąsina pa…ĺa el oňą…ĺna√įo	Bring the chili from the kitchen for the roast pork.	seseo;sandhi;imperative	Ecuadorian cuisine; seseo cocina‚Üí[s]; fontanella_de_weinberg1992
es-EC-013	El ni√Īo juega con la pelota en el patio.	el ňąni…≤o ňąxwe…£a kon la peňąlota en el ňąpatjo	The child plays with the ball in the yard.	palatal_nasal;diphthong_ie_ue;sandhi;statement	palatal nasal ni√Īo; diphthong juega‚Üí[we]; hualde2005
es-EC-014	Vamos a la fiesta del pueblo este domingo.	ňąbamos a la ňąfjesta del ňąpweblo ňąeste doňąmin…°o	We are going to the town festival this Sunday.	diphthong_ie_ue;sandhi;statement	diphthong fiesta/pueblo‚Üí[je/we]; sandhi; penny2002
es-EC-015	¬ŅPor qu√© no llamaste a tu mam√° anoche?	po…ĺ ňąke ňąno  Ěaňąmaste a tu maňąma aňąnot Ée	Why didn't you call your mom last night?	yeismo;final_u;sandhi;question;negation	yeismo llamaste‚Üí[ Ě]; lipski1994
es-EC-016	Sube al bus que ya nos vamos a Ambato.	ňąsuő≤e al ňąbus ke ňą Ěa nos ňąbamos a aňąmbato	Get on the bus, we are leaving for Ambato.	yeismo;sandhi;imperative	sandhi; Ecuadorian geography; fontanella_de_weinberg1992
es-EC-017	El cuy asado se sirve con papa y man√≠.	el ňąkui aňąsa√įo se ňąsi…ĺbe kon ňąpapa i maňąni	Roast guinea pig is served with potato and peanut.	statement	Andean cuisine; seseo n/a; hualde2005
es-EC-018	La llama pasta tranquila en el p√°ramo verde.	la ňą Ěama ňąpasta t…ĺaňąnkila en el ňąpa…ĺamo ňąbe…ĺde	The llama grazes calmly on the green moor.	yeismo;sandhi;statement	yeismo llama‚Üí[ Ě]; Ecuadorian p√°ramo; penny2002
es-EC-019	Guarda bien la cosecha antes de que llueva.	ňą…°wa…ĺda ňąbjen la koňąset Éa ňąantes de ke ňą Ěweba	Store the harvest well before it rains.	yeismo;diphthong_ie_ue;sandhi;imperative	seseo cosecha‚Üí[s]; lipski1994
es-EC-020	Ese muchacho estudia en la universidad central.	ňąese muňąt Éat Éo eňąstu√įja en la unibe…ĺsiňą√įa√į seňąnt…ĺal	That young man studies at the central university.	seseo;sandhi;statement	seseo central‚Üí[s]; fontanella_de_weinberg1992
