id	sentence	ipa	gloss_en	features	notes
es-EC-x-andino-001	El guagua se durmi√≥ abrigado con la cobija.	el ňą…°wa…£wa se duňą…ĺmio ab…ĺiňą…£a√įo kon la koňąő≤ixa	The baby fell asleep wrapped in the blanket.	sandhi;statement	Quichua loan guagua; serrano yeismo per lipski1994
es-EC-x-andino-002	Deme haciendo un favorcito, por favor.	ňądeme aňąsjendo un faő≤oňą…ĺsito po…ĺ faňąő≤o…ĺ	Do me a little favor, please.	seseo;diphthong_ie_ue;sandhi;imperative	serrano gerund construction 'dar haciendo'; lipski1994
es-EC-x-andino-003	¬ŅYa lleg√≥ no m√°s el taita de la feria?	ňą ía  íeňą…£o ňąno ňąmas el ňątajta de la ňąfe…ĺja	Did the father just arrive from the fair?	sibilant_voicing;sandhi;question	serrano 'no m√°s'; word-initial patterns; lipski1994
es-EC-x-andino-004	Mi √Īa√Īa teje una bufanda de lana de borrego.	mi ňą…≤a…≤a ňątexe una buňąfanda de ňąlana de boňąre…£o	My sister knits a sheep-wool scarf.	palatal_nasal;palatal_initial;rhotic;sandhi;statement	word-initial √Ī‚Üí[…≤]; palatal nasal; lipski1994
es-EC-x-andino-005	No quiero que vendas la chacra de la loma.	ňąno ňąkje…ĺo ke ňąbendas la ňąt Éak…ĺa de la ňąloma	I don't want you to sell the field on the hill.	diphthong_ie_ue;sandhi;negation	seseo vendas‚Üí[s]; diphthong quiero‚Üí[je]; lipski1994
es-EC-x-andino-006	Sirve la colada morada bien calientita.	ňąsi…ĺbe la koňąla√įa moňą…ĺa√įa ňąbjen kaljeňąntita	Serve the purple drink nice and warm.	diphthong_ie_ue;imperative	serrano diminutive; Ecuadorian dish; lipski1994
es-EC-x-andino-007	Los cerros de Chimborazo se ven nevados.	los ňąseros de t Éimboňą…ĺaso se ňąben neňąő≤a√įos	The Chimborazo hills look snow-capped.	seseo;rhotic;sandhi;statement	trill cerros; seseo n/a; lipski1994
es-EC-x-andino-008	¬ŅCu√°ntos borregos tienes en el potrero, taita?	ňąkuantos boňąre…£os ňątjenes en el poňąt…ĺe…ĺo ňątajta	How many sheep do you have in the pasture, father?	diphthong_ie_ue;rhotic;sandhi;question	diphthong tienes‚Üí[je]; serrano address; lipski1994
es-EC-x-andino-009	Ella lleva el guagua cargado en la espalda.	ňąe ía ňą íeő≤a el ňą…°wa…£wa kaňą…ĺ…°a√įo en la eňąspalda	She carries the baby on her back.	sibilant_voicing;sandhi;statement	yeismo lleva‚Üí[ Ě]; lipski1994
es-EC-x-andino-010	Harto trabajo hay en la cosecha de cebada.	ňąa…ĺto t…ĺaňąő≤axo ňąai en la koňąset Éa de seňąő≤a√įa	There is a lot of work in the barley harvest.	seseo;statement	seseo cosecha/cebada‚Üí[s]; lipski1994
es-EC-x-andino-011	Compramos cinco quintales de papa chola.	koňąmp…ĺamos ňąsinko kiňąntales de ňąpapa ňąt Éola	We bought five hundredweights of chola potato.	seseo;sandhi;number	numeral; serrano produce; lipski1994
es-EC-x-andino-012	Nadie conoce mejor el p√°ramo que el vaquero.	ňąna√įje koňąnose meňąxo…ĺ el ňąpa…ĺamo ke el baňąke…ĺo	Nobody knows the moor better than the cowherd.	seseo;diphthong_ie_ue;sandhi;negation	seseo conoce‚Üí[s]; lipski1994
es-EC-x-andino-013	Sube no m√°s al cami√≥n que ya oscurece.	ňąsuő≤e ňąno ňąmas al kaňąmion ke ňą ía oskuňą…ĺese	Just get on the truck, it is getting dark.	seseo;sibilant_voicing;sandhi;imperative	serrano 'no m√°s'; seseo oscurece‚Üí[s]; lipski1994
es-EC-x-andino-014	El r√≠o Pastaza baja turbio con la lluvia.	el ňąrio paňąstasa ňąbaxa ňątu…ĺbjo kon la ňą íuő≤ja	The Pastaza river runs muddy with the rain.	seseo;sibilant_voicing;rhotic;statement	trill r√≠o; yeismo lluvia‚Üí[ Ě]; lipski1994
es-EC-x-andino-015	La se√Īora vende quesillo fresco en el camino.	la seňą…≤o…ĺa ňąbende keňąsi ío ňąf…ĺesko en el kaňąmino	The lady sells fresh cheese along the road.	sibilant_voicing;palatal_nasal;sandhi;statement	palatal nasal se√Īora; yeismo quesillo‚Üí[ Ě]; lipski1994
es-EC-x-andino-016	Traiga la yunta para arar el terreno duro.	ňąt…ĺaj…£a la ňą íunta pa…ĺa aňą…ĺa…ĺ el teňąreno ňądu…ĺo	Bring the ox team to plow the hard plot.	sibilant_voicing;rhotic;sandhi;imperative	seseo n/a; serrano farming; lipski1994
es-EC-x-andino-017	Dos llamas cargan la papa por el chaqui√Ī√°n.	ňądos ňą íamas ňąka…ĺ…°an la ňąpapa po…ĺ el t Éakiňą…≤an	Two llamas carry the potatoes along the trail.	sibilant_voicing;palatal_nasal;palatal_initial;sandhi;number	yeismo llamas‚Üí[ Ě]; Quichua loan chaqui√Ī√°n; lipski1994
es-EC-x-andino-018	¬ŅDe d√≥nde vienes tan chumado, compadre?	de ňądonde ňąbjenes ňątan t Éuňąma√įo koňąmpad…ĺe	Where are you coming from so drunk, pal?	diphthong_ie_ue;question	diphthong vienes‚Üí[je]; serrano 'chumado'; lipski1994
es-EC-x-andino-019	El ma√≠z y la quinua se secan al sol andino.	el ňąmais i la ňąkinwa se ňąsekan al ňąsol aňąndino	The corn and quinoa dry in the Andean sun.	seseo;statement	seseo n/a; Andean crops; lipski1994
es-EC-x-andino-020	C√≥jase el poncho que hace fr√≠o en la sierra.	ňąkoxase el ňąpont Éo ke ňąase ňąf…ĺio en la ňąsjera	Grab your poncho, it is cold in the highlands.	seseo;diphthong_ie_ue;rhotic;sandhi;imperative	serrano reflexive; seseo n/a; lipski1994
