id	sentence	ipa	gloss_en	features	notes
es-GT-001	Vos sabés que el zorro azul corre por el campo.	ˈbos saˈβes ˈke ˈel ˈsoro aˈsul ˈkore ˈpoɾ ˈel ˈkampo	You know the blue fox runs across the field.	seseo;rhotic;sandhi;statement	seseo ⟨c/z⟩ merged to [s]; strong-R trill [r]; cross-word sandhi junction per lipski1994. voseo verbal morphology (sabés) and Guatemalan usage per hualde2005.
es-GT-002	Tomá la taza de agua y vení a la milpa.	toˈma ˈla ˈtasa ˈde ˈaɡa ˈi beˈni ˈa ˈla ˈmilpa	Take the cup of water and come to the maize field.	seseo;sandhi;statement;imperative	seseo ⟨c/z⟩ merged to [s]; cross-word sandhi junction per lipski1994. voseo imperatives (tomá, vení) and Guatemalan 'milpa' per hualde2005.
es-GT-003	El patojo tiene un perro grande y bravo.	ˈel paˈtoxo ˈtjene ˈun ˈpero ˈɡɾande ˈi ˈbɾabo	The kid has a big, fierce dog.	diphthong_ie_ue;rhotic;sandhi;statement	tonic diphthong ⟨ie/ue⟩ [je we]; strong-R trill [r]; cross-word sandhi junction per lipski1994. Guatemalan 'patojo' for a child per hualde2005.
es-GT-004	Mañana el niño juega en la plaza con vos.	maˈɲana ˈel ˈniɲo ˈxweɣa ˈen ˈla ˈplasa ˈkon ˈbos	Tomorrow the boy plays in the square with you.	seseo;palatal_nasal;diphthong_ie_ue;sandhi;statement	seseo ⟨c/z⟩ merged to [s]; palatal nasal ⟨ñ⟩ [ɲ]; tonic diphthong ⟨ie/ue⟩ [je we]; cross-word sandhi junction per lipski1994. voseo object pronoun (con vos) per hualde2005.
es-GT-005	La calle está llena de gente joven.	ˈla ˈkaʝe eˈsta ˈʝena ˈde ˈxente ˈxoben	The street is full of young people.	yeismo;sandhi;statement	yeísmo ⟨ll/y⟩ to [ʝ]; cross-word sandhi junction per lipski1994. general Central American usage per hualde2005.
es-GT-006	¿Querés arroz con pollo o preferís frijoles?	keˈɾes aˈros ˈkon ˈpoʝo ˈo pɾefeˈɾis fɾiˈxoles	Do you want rice with chicken or do you prefer beans?	seseo;yeismo;rhotic;sandhi;question	seseo ⟨c/z⟩ merged to [s]; yeísmo ⟨ll/y⟩ to [ʝ]; strong-R trill [r]; cross-word sandhi junction per lipski1994. voseo interrogative (querés, preferís) per hualde2005.
es-GT-007	Buscá un zapato nuevo en aquel mercado.	buˈska ˈun saˈpato ˈnwebo ˈen aˈkel meˈɾkaðo	Look for a new shoe in that market.	seseo;diphthong_ie_ue;sandhi;statement;imperative	seseo ⟨c/z⟩ merged to [s]; tonic diphthong ⟨ie/ue⟩ [je we]; cross-word sandhi junction per lipski1994. voseo imperative (buscá) per hualde2005.
es-GT-008	La lluvia cae fuerte sobre el tejado viejo.	ˈla ˈʝubja ˈkae ˈfweɾte ˈsobɾe ˈel teˈxaðo ˈbjexo	The rain falls hard on the old roof.	yeismo;diphthong_ie_ue;sandhi;statement	yeísmo ⟨ll/y⟩ to [ʝ]; tonic diphthong ⟨ie/ue⟩ [je we]; cross-word sandhi junction per lipski1994. general Guatemalan usage per hualde2005.
es-GT-009	Nosotros queremos una casa buena y barata.	noˈsotɾos keˈɾemos ˈuna ˈkasa ˈbwena ˈi baˈɾata	We want a good, cheap house.	diphthong_ie_ue;sandhi;statement;number	tonic diphthong ⟨ie/ue⟩ [je we]; cross-word sandhi junction per lipski1994. general usage per hualde2005.
es-GT-010	El carro rojo corre rápido por la carretera.	ˈel ˈkaro ˈroxo ˈkore ˈrapiðo ˈpoɾ ˈla kareˈteɾa	The red car runs fast along the highway.	rhotic;statement	strong-R trill [r] per lipski1994. general usage per hualde2005.
es-GT-011	Ese señor tiene mucha tierra en la montaña.	ˈese seˈɲoɾ ˈtjene ˈmutʃa ˈtjera ˈen ˈla moˈntaɲa	That gentleman has a lot of land on the mountain.	palatal_nasal;diphthong_ie_ue;rhotic;sandhi;statement	palatal nasal ⟨ñ⟩ [ɲ]; tonic diphthong ⟨ie/ue⟩ [je we]; strong-R trill [r]; cross-word sandhi junction per lipski1994. general usage per hualde2005.
es-GT-012	No vayás solo, andá con tu compañero.	ˈno baˈʝas ˈsolo aˈnda ˈkon ˈtu kompaˈɲeɾo	Don't go alone, go with your companion.	yeismo;palatal_nasal;final_u;sandhi;statement;negation;imperative	yeísmo ⟨ll/y⟩ to [ʝ]; palatal nasal ⟨ñ⟩ [ɲ]; cross-word sandhi junction per lipski1994. voseo negative imperative (vayás, andá) per hualde2005.
es-GT-013	La manzana y la naranja están en la mesa.	ˈla maˈnsana ˈi ˈla naˈɾanxa eˈstan ˈen ˈla ˈmesa	The apple and the orange are on the table.	seseo;sandhi;statement	seseo ⟨c/z⟩ merged to [s]; cross-word sandhi junction per lipski1994. general usage per hualde2005.
es-GT-014	¿Vos vivís lejos del parque nuevo?	ˈbos biˈbis ˈlexos ˈdel ˈpaɾke ˈnwebo	Do you live far from the new park?	diphthong_ie_ue;sandhi;question	tonic diphthong ⟨ie/ue⟩ [je we]; cross-word sandhi junction per lipski1994. voseo (vivís) per hualde2005.
es-GT-015	El caballo blanco pasta junto al arroyo.	ˈel kaˈβaʝo ˈblanko ˈpasta ˈxunto ˈal aˈroʝo	The white horse grazes next to the stream.	yeismo;rhotic;sandhi;statement	yeísmo ⟨ll/y⟩ to [ʝ]; strong-R trill [r]; cross-word sandhi junction per lipski1994. general usage per hualde2005.
es-GT-016	Comprá pan y guardá un poco para luego.	koˈmpɾa ˈpan ˈi ɡaˈɾda ˈun ˈpoko ˈpaɾa ˈlweɣo	Buy bread and save some for later.	diphthong_ie_ue;sandhi;statement;imperative	tonic diphthong ⟨ie/ue⟩ [je we]; cross-word sandhi junction per lipski1994. voseo imperatives (comprá, guardá) per hualde2005.
es-GT-017	Los zapatos viejos ya no sirven para nada.	ˈlos saˈpatos ˈbjexos ˈʝa ˈno ˈsiɾben ˈpaɾa ˈnaða	The old shoes are no good for anything anymore.	seseo;yeismo;diphthong_ie_ue;sandhi;statement;negation	seseo ⟨c/z⟩ merged to [s]; yeísmo ⟨ll/y⟩ to [ʝ]; tonic diphthong ⟨ie/ue⟩ [je we]; cross-word sandhi junction per lipski1994. general usage per hualde2005.
es-GT-018	Aquella niña baila con mucha alegría.	aˈkeʝa ˈniɲa ˈbajla ˈkon ˈmutʃa aleˈɡɾia	That girl dances with great joy.	yeismo;palatal_nasal;sandhi;statement	yeísmo ⟨ll/y⟩ to [ʝ]; palatal nasal ⟨ñ⟩ [ɲ]; cross-word sandhi junction per lipski1994. general usage per hualde2005.
es-GT-019	Tenés que llamar a tu mamá temprano.	teˈnes ˈke ʝaˈmaɾ ˈa ˈtu maˈma teˈmpɾano	You have to call your mom early.	yeismo;final_u;statement	yeísmo ⟨ll/y⟩ to [ʝ] per lipski1994. voseo (tenés) per hualde2005.
es-GT-020	El sol brilla sobre el mar azul y tranquilo.	ˈel ˈsol ˈbɾiʝa ˈsobɾe ˈel ˈmaɾ aˈsul ˈi tɾaˈnkilo	The sun shines over the blue, calm sea.	seseo;yeismo;sandhi;statement	seseo ⟨c/z⟩ merged to [s]; yeísmo ⟨ll/y⟩ to [ʝ]; cross-word sandhi junction per lipski1994. general usage per hualde2005.
