id	sentence	ipa	gloss_en	features	notes
es-PA-001	T√ļ sabes que el zorro azul corre por el patio.	ňątu ňąsaő≤eh ke el ňąsoro aňąsul ňąkore po…ĺ el ňąpatjo	You know the blue fox runs across the yard.	seseo;coda_s_aspiration;rhotic;sandhi;statement	seseo ‚ü®c/z‚ü© merged to [s]; coda /s/ aspirated to [h]; strong-R trill [r]; cross-word sandhi junction per hualde2005. Panamanian tuteo (sabes) per fontanella_de_weinberg1992.
es-PA-002	Toma los mangos y ven para la casa.	ňątoma loh ňąman…°oh i ňąbeŇč pa…ĺa la ňąkasa	Take the mangoes and come home.	coda_s_aspiration;velar_nasal;sandhi;statement;imperative	coda /s/ aspirated to [h]; final /n/ velarised to [Ňč]; cross-word sandhi junction per hualde2005. tuteo imperatives (toma, ven) per fontanella_de_weinberg1992.
es-PA-003	El pelao tiene un perro grande y bravo.	el ňąpelao ňątjene uŇč ňąpero ňą…°…ĺande i ňąb…ĺaő≤o	The kid has a big, fierce dog.	diphthong_ie_ue;velar_nasal;rhotic;sandhi;statement	tonic diphthong ‚ü®ie/ue‚ü© [je we]; final /n/ velarised to [Ňč]; strong-R trill [r]; cross-word sandhi junction per hualde2005. Panamanian 'pelao' for a child per fontanella_de_weinberg1992.
es-PA-004	Ma√Īana el ni√Īo juega en la plaza contigo.	maňą…≤ana el ňąni…≤o ňąxwe…£a eŇč la ňąplasa koňąnti…£o	Tomorrow the boy plays in the square with you.	seseo;palatal_nasal;diphthong_ie_ue;velar_nasal;sandhi;statement	seseo ‚ü®c/z‚ü© merged to [s]; palatal nasal ‚ü®√Ī‚ü© […≤]; tonic diphthong ‚ü®ie/ue‚ü© [je we]; final /n/ velarised to [Ňč]; cross-word sandhi junction per hualde2005. tuteo (contigo) per fontanella_de_weinberg1992.
es-PA-005	La calle est√° llena de gente joven.	la ňąka Ěe eňąhta ňą Ěena de ňąxente ňąxoő≤eŇč	The street is full of young people.	yeismo;coda_s_aspiration;velar_nasal;sandhi;statement	ye√≠smo ‚ü®ll/y‚ü© to [ Ě]; final /n/ velarised to [Ňč]; cross-word sandhi junction per hualde2005. general Panamanian usage per fontanella_de_weinberg1992.
es-PA-006	¬ŅQuieres arroz con pollo o prefieres carne guisada?	ňąkje…ĺeh aňąros koŇč ňąpo Ěo o p…ĺeňąfje…ĺeh ňąka…ĺne …°iňąsa√įa	Do you want rice with chicken or stewed meat?	seseo;yeismo;coda_s_aspiration;diphthong_ie_ue;velar_nasal;rhotic;sandhi;question	seseo ‚ü®c/z‚ü© merged to [s]; ye√≠smo ‚ü®ll/y‚ü© to [ Ě]; coda /s/ aspirated to [h]; tonic diphthong ‚ü®ie/ue‚ü© [je we]; final /n/ velarised to [Ňč]; strong-R trill [r]; cross-word sandhi junction per hualde2005. tuteo (quieres, prefieres) per fontanella_de_weinberg1992.
es-PA-007	Busca unos zapatos nuevos en aquel mercado.	ňąbuhka unoh saňąpatoh ňąnweő≤oh eŇč aňąkel meňą…ĺka√įo	Look for some new shoes in that market.	seseo;coda_s_aspiration;diphthong_ie_ue;velar_nasal;sandhi;statement;imperative	seseo ‚ü®c/z‚ü© merged to [s]; coda /s/ aspirated to [h]; tonic diphthong ‚ü®ie/ue‚ü© [je we]; final /n/ velarised to [Ňč]; cross-word sandhi junction per hualde2005. tuteo imperative (busca) per fontanella_de_weinberg1992.
es-PA-008	La lluvia cae fuerte sobre los tejados viejos.	la ňą Ěuő≤ja ňąkae ňąfwe…ĺte ňąsob…ĺe loh teňąxa√įoh ňąbjexoh	The rain falls hard on the old roofs.	yeismo;coda_s_aspiration;diphthong_ie_ue;sandhi;statement	ye√≠smo ‚ü®ll/y‚ü© to [ Ě]; coda /s/ aspirated to [h]; tonic diphthong ‚ü®ie/ue‚ü© [je we]; cross-word sandhi junction per hualde2005. general usage per fontanella_de_weinberg1992.
es-PA-009	Nosotros queremos una casa buena y barata.	noňąsot…ĺoh keňą…ĺemoh una ňąkasa ňąbwena i baňą…ĺata	We want a good, cheap house.	coda_s_aspiration;diphthong_ie_ue;sandhi;statement;number	coda /s/ aspirated to [h]; tonic diphthong ‚ü®ie/ue‚ü© [je we]; cross-word sandhi junction per hualde2005. general usage per fontanella_de_weinberg1992.
es-PA-010	El cami√≥n rojo corre r√°pido por la carretera.	el kaňąmioŇč ňąroxo ňąkore ňąrapi√įo po…ĺ la kareňąte…ĺa	The red truck runs fast along the highway.	velar_nasal;rhotic;statement	final /n/ velarised to [Ňč]; strong-R trill [r] per hualde2005. general usage per fontanella_de_weinberg1992.
es-PA-011	Ese se√Īor tiene bastante tierra en la monta√Īa.	ňąese seňą…≤o…ĺ ňątjene baňąhtante ňątjera eŇč la moňąnta…≤a	That man has plenty of land on the mountain.	palatal_nasal;coda_s_aspiration;diphthong_ie_ue;velar_nasal;rhotic;sandhi;statement	palatal nasal ‚ü®√Ī‚ü© […≤]; tonic diphthong ‚ü®ie/ue‚ü© [je we]; final /n/ velarised to [Ňč]; strong-R trill [r]; cross-word sandhi junction per hualde2005. general usage per fontanella_de_weinberg1992.
es-PA-012	No vayas solo, anda con los muchachos.	ňąno baňą Ěah ňąsolo ňąanda koŇč loh muňąt Éat Éoh	Don't go alone, go with the guys.	yeismo;coda_s_aspiration;velar_nasal;sandhi;statement;negation;imperative	ye√≠smo ‚ü®ll/y‚ü© to [ Ě]; coda /s/ aspirated to [h]; final /n/ velarised to [Ňč]; cross-word sandhi junction per hualde2005. tuteo negative imperative (vayas, anda) per fontanella_de_weinberg1992.
es-PA-013	Las manzanas y las naranjas est√°n en la mesa.	lah maňąnsanah i lah naňą…ĺanxah eňąhtaŇč eŇč la ňąmesa	The apples and oranges are on the table.	seseo;coda_s_aspiration;velar_nasal;sandhi;statement	seseo ‚ü®c/z‚ü© merged to [s]; coda /s/ aspirated to [h]; final /n/ velarised to [Ňč]; cross-word sandhi junction per hualde2005. general usage per fontanella_de_weinberg1992.
es-PA-014	¬ŅT√ļ vives lejos del parque nuevo?	ňątu ňąbiő≤eh ňąlexoh del ňąpa…ĺke ňąnweő≤o	Do you live far from the new park?	coda_s_aspiration;diphthong_ie_ue;sandhi;question	coda /s/ aspirated to [h]; tonic diphthong ‚ü®ie/ue‚ü© [je we]; cross-word sandhi junction per hualde2005. tuteo (vives) per fontanella_de_weinberg1992.
es-PA-015	Los caballos blancos pastan junto al arroyo.	loh kaňąő≤a Ěoh ňąblankoh ňąpahtaŇč ňąxunto al aňąro Ěo	The white horses graze by the stream.	yeismo;coda_s_aspiration;velar_nasal;rhotic;sandhi;statement	ye√≠smo ‚ü®ll/y‚ü© to [ Ě]; coda /s/ aspirated to [h]; final /n/ velarised to [Ňč]; strong-R trill [r]; cross-word sandhi junction per hualde2005. general usage per fontanella_de_weinberg1992.
es-PA-016	Compra pan y guarda un poco para despu√©s.	ňąkomp…ĺa ňąpaŇč i ňą…°wa…ĺda uŇč ňąpoko pa…ĺa deňąhpueh	Buy bread and save some for later.	coda_s_aspiration;velar_nasal;sandhi;statement;imperative	coda /s/ aspirated to [h]; final /n/ velarised to [Ňč]; cross-word sandhi junction per hualde2005. tuteo imperatives (compra, guarda) per fontanella_de_weinberg1992.
es-PA-017	Esos zapatos viejos ya no sirven para nada.	ňąesoh saňąpatoh ňąbjexoh ňą Ěa ňąno ňąsi…ĺbeŇč pa…ĺa ňąna√įa	Those old shoes are no good for anything anymore.	seseo;yeismo;coda_s_aspiration;diphthong_ie_ue;velar_nasal;sandhi;statement;negation	seseo ‚ü®c/z‚ü© merged to [s]; ye√≠smo ‚ü®ll/y‚ü© to [ Ě]; coda /s/ aspirated to [h]; tonic diphthong ‚ü®ie/ue‚ü© [je we]; final /n/ velarised to [Ňč]; cross-word sandhi junction per hualde2005. general usage per fontanella_de_weinberg1992.
es-PA-018	Aquella ni√Īa baila con mucha alegr√≠a.	aňąke Ěa ňąni…≤a ňąbajla koŇč ňąmut Éa aleňą…°…ĺia	That girl dances with great joy.	yeismo;palatal_nasal;velar_nasal;sandhi;statement	ye√≠smo ‚ü®ll/y‚ü© to [ Ě]; palatal nasal ‚ü®√Ī‚ü© […≤]; final /n/ velarised to [Ňč]; cross-word sandhi junction per hualde2005. general usage per fontanella_de_weinberg1992.
es-PA-019	Tienes que llamar a tus amigos temprano.	ňątjeneh ke  Ěaňąma…ĺ a tuh aňąmi…£oh teňąmp…ĺano	You have to call your friends early.	yeismo;coda_s_aspiration;diphthong_ie_ue;sandhi;statement	ye√≠smo ‚ü®ll/y‚ü© to [ Ě]; coda /s/ aspirated to [h]; tonic diphthong ‚ü®ie/ue‚ü© [je we]; cross-word sandhi junction per hualde2005. tuteo (tienes) per fontanella_de_weinberg1992.
es-PA-020	El sol brilla sobre el mar azul y tranquilo.	el ňąsol ňąb…ĺi Ěa ňąsob…ĺe el ňąma…ĺ aňąsul i t…ĺaňąnkilo	The sun shines over the blue, calm sea.	seseo;yeismo;sandhi;statement	seseo ‚ü®c/z‚ü© merged to [s]; ye√≠smo ‚ü®ll/y‚ü© to [ Ě]; cross-word sandhi junction per hualde2005. general usage per fontanella_de_weinberg1992.
