id	sentence	ipa	gloss_en	features	notes
es-PR-001	Los nenes juegan afuera con la pelota nueva.	loh ňąneneh ňąxwe…£aŇč aňąfwe…ĺa koŇč la peňąlota ňąnweba	The kids play outside with the new ball.	coda_s_aspiration;diphthong_ie_ue;velar_nasal;sandhi	coda /s/ aspiration to [h] (Caribbean weakening); word-final /n/ velarisation to [Ňč] per hualde2005.
es-PR-002	Mi mam√° compr√≥ arroz y habichuelas en el colmado.	mi maňąma koňąmp…ĺo aňąros i aő≤iňąt Éwelah eŇč el koňąlma√įo	My mom bought rice and beans at the corner store.	seseo;coda_s_aspiration;diphthong_ie_ue;velar_nasal;rhotic;sandhi	coda /s/ aspiration to [h] (Caribbean weakening); word-final /n/ velarisation to [Ňč] per fontanella_de_weinberg1992.
es-PR-003	¬ŅVas a coger la guagua para ir al pueblo?	ňąbah a koňąxe…ĺ la ňą…°a…°a pa…ĺa ňąi…ĺ al ňąpweblo	Are you going to take the bus into town?	coda_s_aspiration;diphthong_ie_ue;sandhi	coda /s/ aspiration to [h] (Caribbean weakening); Romance rising diphthong ‚ü®ie/ue‚ü© [je/we] per penny2002.
es-PR-004	La playa estaba llena de gente el domingo.	la plaňą Ěa eňąstaő≤a ňą Ěena de ňąxente el doňąmin…°o	The beach was full of people on Sunday.	yeismo;sandhi	ye√≠smo: ‚ü®ll/y‚ü© realised [ Ě] per hualde2005.
es-PR-005	Ese muchacho canta bien bonito en la fiesta.	ňąese muňąt Éat Éo ňąkanta ňąbjeŇč boňąnito eŇč la ňąfjesta	That boy sings really nicely at the party.	diphthong_ie_ue;velar_nasal;sandhi	word-final /n/ velarisation to [Ňč]; Romance rising diphthong ‚ü®ie/ue‚ü© [je/we] per fontanella_de_weinberg1992.
es-PR-006	El perro corre por la orilla del r√≠o.	el ňąpero ňąkore po…ĺ la oňą…ĺi Ěa del ňąrio	The dog runs along the riverbank.	yeismo;rhotic;sandhi	ye√≠smo: ‚ü®ll/y‚ü© realised [ Ě]; alveolar trill [r] preserved per penny2002.
es-PR-007	Compr√© diez chinas maduras en la plaza del mercado.	koňąmp…ĺe ňądjes ňąt Éinah maňą√įu…ĺah eŇč la ňąplasa del meňą…ĺka√įo	I bought ten ripe oranges at the market square.	seseo;coda_s_aspiration;diphthong_ie_ue;velar_nasal;sandhi	coda /s/ aspiration to [h] (Caribbean weakening); word-final /n/ velarisation to [Ňč] per hualde2005.
es-PR-008	La luz del sol brilla sobre las monta√Īas verdes.	la ňąlus del ňąsol ňąb…ĺi Ěa ňąsob…ĺe lah moňąnta…≤ah ňąbe…ĺdeh	The sunlight shines over the green mountains.	seseo;yeismo;palatal_nasal;coda_s_aspiration;sandhi	coda /s/ aspiration to [h] (Caribbean weakening); seseo: ‚ü®c/z‚ü© merged to [s] per fontanella_de_weinberg1992.
es-PR-009	Mi abuelo cuenta historias del campo y la ca√Īa.	mi aňąő≤welo ňąkwenta iňąsto…ĺjah del ňąkampo i la ňąka…≤a	My grandfather tells stories of the countryside and sugarcane.	palatal_nasal;coda_s_aspiration;diphthong_ie_ue;sandhi	coda /s/ aspiration to [h] (Caribbean weakening); Romance rising diphthong ‚ü®ie/ue‚ü© [je/we] per penny2002.
es-PR-010	¬ŅCu√°ntas personas caben en aquella lancha?	ňąkuantah peňą…ĺsonah ňąkaő≤eŇč eŇč aňąke Ěa ňąlant Éa	How many people fit in that boat?	yeismo;coda_s_aspiration;velar_nasal	coda /s/ aspiration to [h] (Caribbean weakening); word-final /n/ velarisation to [Ňč] per hualde2005.
es-PR-011	El ni√Īo peque√Īo duerme en la hamaca del patio.	el ňąni…≤o peňąke…≤o ňądwe…ĺme eŇč la aňąmaka del ňąpatjo	The little boy sleeps in the courtyard hammock.	palatal_nasal;diphthong_ie_ue;velar_nasal;sandhi	word-final /n/ velarisation to [Ňč]; Romance rising diphthong ‚ü®ie/ue‚ü© [je/we] per fontanella_de_weinberg1992.
es-PR-012	No quiero que llueva sobre la parranda esta noche.	ňąno ňąkje…ĺo ke ňą Ěweba ňąsob…ĺe la paňąranda ňąesta ňąnot Ée	I don't want it to rain over the party tonight.	yeismo;diphthong_ie_ue;rhotic;sandhi	ye√≠smo: ‚ü®ll/y‚ü© realised [ Ě]; Romance rising diphthong ‚ü®ie/ue‚ü© [je/we] per penny2002.
es-PR-013	Los pescadores salen temprano buscando su pesca.	loh peskaňą√įo…ĺeh ňąsaleŇč teňąmp…ĺano buňąskando su ňąpeska	The fishermen set out early after their catch.	coda_s_aspiration;velar_nasal	coda /s/ aspiration to [h] (Caribbean weakening); word-final /n/ velarisation to [Ňč] per hualde2005.
es-PR-014	La mujer canta una plena alegre en la calle.	la muňąxe…ĺ ňąkanta una ňąplena aňąle…°…ĺe eŇč la ňąka Ěe	The woman sings a lively plena in the street.	yeismo;velar_nasal;sandhi	word-final /n/ velarisation to [Ňč]; ye√≠smo: ‚ü®ll/y‚ü© realised [ Ě] per fontanella_de_weinberg1992.
es-PR-015	Dame un poco de agua bien fr√≠a, por favor.	ňądame uŇč ňąpoko de ňąa…°a ňąbjeŇč ňąf…ĺia po…ĺ faňąbo…ĺ	Give me a little very cold water, please.	diphthong_ie_ue;velar_nasal;sandhi	word-final /n/ velarisation to [Ňč]; Romance rising diphthong ‚ü®ie/ue‚ü© [je/we] per penny2002.
es-PR-016	El coraz√≥n del barrio late con tambor y baile.	el ko…ĺaňąsoŇč del ňąbarjo ňąlate koŇč taňąmbo…ĺ i ňąbajle	The heart of the neighborhood beats with drum and dance.	seseo;velar_nasal;rhotic	word-final /n/ velarisation to [Ňč]; seseo: ‚ü®c/z‚ü© merged to [s] per hualde2005.
es-PR-017	Aquella se√Īora vende piraguas junto al parque.	aňąke Ěa seňą…≤o…ĺa ňąbende piňą…ĺa…°ah ňąxunto al ňąpa…ĺke	That lady sells shaved-ice cones by the park.	yeismo;palatal_nasal;coda_s_aspiration;sandhi	coda /s/ aspiration to [h] (Caribbean weakening); ye√≠smo: ‚ü®ll/y‚ü© realised [ Ě] per fontanella_de_weinberg1992.
es-PR-018	Buenos d√≠as, ¬Ņc√≥mo durmi√≥ usted por ac√°?	ňąbwenoh ňądiah ňąkomo duňą…ĺmio uňąste po…ĺ aňąka	Good morning, how did you sleep around here?	coda_s_aspiration;diphthong_ie_ue;sandhi	coda /s/ aspiration to [h] (Caribbean weakening); Romance rising diphthong ‚ü®ie/ue‚ü© [je/we] per penny2002.
es-PR-019	Las estrellas alumbran el mar durante la madrugada.	lah eňąst…ĺe Ěah aňąlumb…ĺaŇč el ňąma…ĺ duňą…ĺante la mad…ĺuňą…£a√įa	The stars light up the sea in the early morning.	yeismo;coda_s_aspiration;velar_nasal;sandhi	coda /s/ aspiration to [h] (Caribbean weakening); word-final /n/ velarisation to [Ňč] per hualde2005.
es-PR-020	Mi hermano trabaja lejos, all√° por la monta√Īa.	mi eňą…ĺmano t…ĺaňąő≤axa ňąlexoh aňą Ěa po…ĺ la moňąnta…≤a	My brother works far away, out by the mountain.	yeismo;palatal_nasal;coda_s_aspiration;sandhi	coda /s/ aspiration to [h] (Caribbean weakening); ye√≠smo: ‚ü®ll/y‚ü© realised [ Ě] per fontanella_de_weinberg1992.
