id	sentence	ipa	gloss_en	features	notes
es-PE-x-andino-001	El taita llev√≥ las llamas hasta la puna alta.	el ňątajta  Ěeňąbo las ňą Ěamas ňąasta la ňąpuna ňąalta	The father took the llamas up to the high moor.	yeismo;sandhi;statement	Andean lexicon; seseo and yeismo per lipski1994
es-PE-x-andino-002	Dice pues que la cosecha estuvo buena este a√Īo.	ňądise ňąpwes ke la koňąset Éa eňąstubo ňąbwena ňąeste ňąa…≤o	He says the harvest was good this year.	seseo;palatal_nasal;diphthong_ie_ue;sandhi;statement	Andean 'pues' discourse marker; lipski1994
es-PE-x-andino-003	¬ŅYa sembraste el ma√≠z en la chacra de arriba?	ňą Ěa seňąmb…ĺaste el ňąmais en la ňąt Éak…ĺa de aňąriő≤a	Did you already sow the corn in the upper field?	seseo;yeismo;rhotic;sandhi;question	Quechua-contact syntax; seseo cosecha n/a; lipski1994
es-PE-x-andino-004	La wawa duerme abrigada con su lliclla.	la ňąwawa ňądwe…ĺme ab…ĺiňą…£a√įa kon su ňą Ěik Ěa	The baby sleeps wrapped in its carrying cloth.	yeismo;diphthong_ie_ue;final_u;sandhi;statement	Quechua loans wawa/lliclla; yeismo; lipski1994
es-PE-x-andino-005	No quiero que vendas la tierra del abuelo.	ňąno ňąkje…ĺo ke ňąbendas la ňątjera del aňąő≤welo	I don't want you to sell grandfather's land.	diphthong_ie_ue;rhotic;sandhi;negation	seseo vendas‚Üí[s]; diphthong quiero‚Üí[je]; lipski1994
es-PE-x-andino-006	Sirve el mate de coca bien caliente, por favor.	ňąsi…ĺbe el ňąmate de ňąkoka ňąbjen kaňąljente po…ĺ faňąbo…ĺ	Serve the coca tea nice and hot, please.	diphthong_ie_ue;sandhi;imperative	seseo n/a; diphthong caliente‚Üí[je]; lipski1994
es-PE-x-andino-007	Mi √Īa√Īo baja al pueblo a vender su queso.	mi ňą…≤a…≤o ňąbaxa al ňąpweblo a beňąnde…ĺ su ňąkeso	My brother goes down to town to sell his cheese.	palatal_nasal;palatal_initial;diphthong_ie_ue;final_u;sandhi;statement	word-initial √Ī‚Üí[…≤]; seseo queso n/a; lipski1994
es-PE-x-andino-008	Los cerros se pintan de amarillo en agosto.	los ňąseros se ňąpintan de amaňą…ĺi Ěo en aňą…£osto	The hills turn yellow in August.	seseo;yeismo;rhotic;sandhi;statement	trill cerros; yeismo amarillo; lipski1994
es-PE-x-andino-009	¬ŅCu√°ntos cuyes tienes en el corral, mamita?	ňąkuantos kuňą Ěes ňątjenes en el koňąral maňąmita	How many guinea pigs do you have in the pen?	yeismo;diphthong_ie_ue;rhotic;sandhi;question	diphthong tienes‚Üí[je]; Andean diminutive; lipski1994
es-PE-x-andino-010	Harto fr√≠o hace de noche en la comunidad.	ňąa…ĺto ňąf…ĺio ňąase de ňąnot Ée en la komuniňą√įa√į	It gets very cold at night in the community.	seseo;sandhi;statement	Andean 'harto' quantifier; lipski1994
es-PE-x-andino-011	Compramos cinco arrobas de papa nativa.	koňąmp…ĺamos ňąsinko aňąroő≤as de ňąpapa naňątiba	We bought five arrobas of native potato.	seseo;rhotic;sandhi;number	numeral; Andean produce; lipski1994
es-PE-x-andino-012	Ella teje un chullo rojo para la feria.	ňąe Ěa ňątexe un ňąt Éu Ěo ňąroxo pa…ĺa la ňąfe…ĺja	She weaves a red cap for the fair.	yeismo;rhotic;sandhi;statement	yeismo ella‚Üí[ Ě]; seseo n/a; lipski1994
es-PE-x-andino-013	Nadie conoce el camino a la laguna escondida.	ňąna√įje koňąnose el kaňąmino a la laňą…£una eskoňąndi√įa	Nobody knows the path to the hidden lagoon.	seseo;diphthong_ie_ue;sandhi;negation	seseo conoce‚Üí[s]; lipski1994
es-PE-x-andino-014	Sube nom√°s al carro que ya vamos a partir.	ňąsuő≤e noňąmas al ňąkaro ke ňą Ěa ňąbamos a paňą…ĺti…ĺ	Just get in the car, we are about to leave.	yeismo;rhotic;sandhi;imperative	Andean 'nom√°s'; diphthong n/a; lipski1994
es-PE-x-andino-015	El r√≠o Vilcanota baja con fuerza en lluvia.	el ňąrio bilkaňąnota ňąbaxa kon ňąfwe…ĺsa en ňą Ěubja	The Vilcanota river runs strong in the rains.	seseo;yeismo;diphthong_ie_ue;rhotic;sandhi;statement	trill r√≠o; yeismo lluvia; diphthong fuerza‚Üí[we]; lipski1994
es-PE-x-andino-016	La se√Īora vende ch'u√Īo seco en el mercado.	la seňą…≤o…ĺa ňąbende ňąt É ňąu…≤o ňąseko en el meňą…ĺka√įo	The lady sells freeze-dried potato at the market.	palatal_nasal;sandhi;statement	palatal nasal se√Īora; Andean lexicon; lipski1994
es-PE-x-andino-017	Traiga la chaquitaclla para arar el terreno.	ňąt…ĺaj…£a la t Éakiňątak Ěa pa…ĺa aňą…ĺa…ĺ el teňąreno	Bring the foot-plough to till the plot.	yeismo;rhotic;sandhi;imperative	Quechua loan chaquitaclla; lipski1994
es-PE-x-andino-018	Dos llamas cargan la le√Īa por el sendero.	ňądos ňą Ěamas ňąka…ĺ…°an la ňąle…≤a po…ĺ el seňąnde…ĺo	Two llamas carry the firewood along the trail.	yeismo;palatal_nasal;palatal_initial;sandhi;number	yeismo llamas‚Üí[ Ě]; lipski1994
es-PE-x-andino-019	¬ŅDe d√≥nde vienes tan cansado, hijito?	de ňądonde ňąbjenes ňątan kaňąnsa√įo iňąxito	Where are you coming from so tired, son?	diphthong_ie_ue;question	diphthong vienes‚Üí[je]; Andean diminutive; lipski1994
es-PE-x-andino-020	El ma√≠z y la quinua se guardan en el troje.	el ňąmais i la ňąkinwa se ňą…°wa…ĺdan en el ňąt…ĺoxe	The corn and quinoa are stored in the granary.	seseo;statement	seseo n/a; Andean lexicon; lipski1994
