id	sentence	ipa	gloss_en	features	notes
es-UY-001	Bo, ¬Ņvos ven√≠s al Parque este finde?	ňąbo ňąbos beňąnis al ňąpa…ĺke ňąeste ňąfinde	Hey, are you coming to the park this weekend?	sandhi;question	Montevideano voseo 'ven√≠s' and vocative 'bo' per fontanella_de_weinberg1992.
es-UY-002	Ella lleva la llave del apartamento en la mano.	ňąe Ěa ňą Ěeő≤a la ňą Ěaő≤e del apa…ĺtaňąmento en la ňąmano	She carries the apartment key in her hand.	yeismo;sandhi;statement	Ye√≠smo ‚ü®ll y‚ü© [ Ě] 'ella lleva llave' (Rioplatense  Ě with the montevideano devoicing trend) per hualde2005.
es-UY-003	Los championes azules cuestan mil pesos.	los t Éaňąmpjones aňąsules ňąkwestan ňąmil ňąpesos	The blue sneakers cost a thousand pesos.	seseo;diphthong_ie_ue;sandhi;statement;number	Uruguayan 'championes' (sneakers); seseo ‚ü®z‚ü© [s] 'azules' per penny2002; coda ‚ü®s‚ü© 'los'.
es-UY-004	El perro corre por la rambla al atardecer.	el ňąpero ňąkore po…ĺ la ňąrambla al ata…ĺdeňąőłe…ĺ	The dog runs along the waterfront at dusk.	distincion;rhotic;sandhi;statement	Trill [r] for ‚ü®rr‚ü© 'perro corre rambla' per hualde2005; montevideano 'rambla'.
es-UY-005	No quiero que llueva en el asado.	ňąno ňąkje…ĺo ke ňą Ěweő≤a en el aňąsa√įo	I don't want it to rain on the barbecue.	yeismo;diphthong_ie_ue;sandhi;statement;negation	Ye√≠smo ‚ü®ll‚ü© [ Ě] 'llueva' per hualde2005; negation 'no quiero'.
es-UY-006	¬ŅVos quer√©s un mate o tom√°s terer√©?	ňąbos keňą…ĺes un ňąmate o toňąmas te…ĺeňą…ĺe	Do you want a mate or do you drink terer√©?	sandhi;question	Voseo 'quer√©s tom√°s' per fontanella_de_weinberg1992.
es-UY-007	Ta, com√© tranquilo que hay tiempo de sobra.	ňąta koňąme t…ĺaňąnkilo ke ňąai ňątjempo de ňąsob…ĺa	OK, eat calmly, there's plenty of time.	diphthong_ie_ue;imperative	Uruguayan discourse marker 'ta'; voseo imperative 'com√©' per fontanella_de_weinberg1992.
es-UY-008	La calle estaba llena de murgas en Carnaval.	la ňąka Ěe eňąstaő≤a ňą Ěena de ňąmu…ĺ…°as en ka…ĺnaňąő≤al	The street was full of murgas at Carnival.	yeismo;sandhi;statement	Ye√≠smo ‚ü®ll‚ü© [ Ě] 'calle llena' per hualde2005; montevideano 'murga'.
es-UY-009	Mi hermano trabaja cerca del puerto viejo.	mi eňą…ĺmano t…ĺaňąő≤axa ňąőłe…ĺka del ňąpwe…ĺto ňąbjexo	My brother works near the old port.	distincion;diphthong_ie_ue;statement	Coverage of the Uruguayan consonant baseline per penny2002; ‚ü®j‚ü© [x] 'trabaja'.
es-UY-010	Nosotros vamos a la playa todos los veranos.	noňąsot…ĺos ňąbamos a la plaňą Ěa ňąto√įos los beňą…ĺanos	We go to the beach every summer.	yeismo;sandhi;statement	Coda ‚ü®s‚ü© conserved 'nosotros vamos los veranos' per penny2002; ye√≠smo ‚ü®y‚ü© [ Ě] 'playa'.
es-UY-011	Pon√© la pava que ya cebamos unos mates.	poňąne la ňąpaő≤a ke ňą Ěa őłeňąő≤amos unos ňąmates	Put the kettle on, let's brew some mates.	distincion;yeismo;sandhi;imperative	Voseo imperative 'pon√©' per fontanella_de_weinberg1992; sandhi 'que ya'.
es-UY-012	La lluvia moj√≥ toda la ropa del tendedero.	la ňą Ěuő≤ja moňąxo ňąto√įa la ňąropa del tendeňą√įe…ĺo	The rain soaked all the laundry on the line.	yeismo;rhotic;statement	Ye√≠smo ‚ü®ll‚ü© [ Ě] 'lluvia' per hualde2005.
es-UY-013	Decime la verdad, ¬Ņtrajiste los boletos?	deňąőłime la beňą…ĺda√į t…ĺaňąxiste los boňąletos	Tell me the truth, did you bring the tickets?	distincion;sandhi;question	Voseo 'decime trajiste' per fontanella_de_weinberg1992; coda ‚ü®s‚ü© 'los boletos'.
es-UY-014	No seas malo y prestame la bici un rato.	ňąno ňąseas ňąmalo i p…ĺeňąstame la ňąbiőłi un ňąrato	Don't be mean and lend me the bike for a while.	distincion;rhotic;sandhi;imperative;negation	Voseo 'seas prestame' per fontanella_de_weinberg1992; negation 'no seas'.
es-UY-015	El pollo con boniato ya est√° en la mesa.	el ňąpo Ěo kon boňąnjato ňą Ěa eňąsta en la ňąmesa	The chicken with sweet potato is on the table.	yeismo;sandhi;statement	Ye√≠smo ‚ü®ll‚ü© [ Ě] 'pollo' per hualde2005; Uruguayan 'boniato'.
es-UY-016	Ma√Īana llegan los primos desde Salto.	maňą…≤ana ňą Ěe…£an los ňąp…ĺimos ňądesde ňąsalto	Tomorrow the cousins arrive from Salto.	yeismo;palatal_nasal;palatal_initial;sandhi;statement	Palatal nasal ‚ü®√Ī‚ü© […≤] 'ma√Īana' per penny2002; coda ‚ü®s‚ü© 'los primos'.
es-UY-017	La barra se junta en la esquina a la tardecita.	la ňąbara se ňąxunta en la eňąskina a la ta…ĺdeňąőłita	The gang meets on the corner in the early evening.	distincion;rhotic;sandhi;statement	Trill [r] 'barra' per hualde2005; Uruguayan 'la barra' (group of friends).
es-UY-018	Salimos temprano porque el √≥mnibus tarda.	saňąlimos teňąmp…ĺano ňąpo…ĺke el ňąomniő≤us ňąta…ĺda	We leave early because the bus takes a while.	sandhi;statement	Coda ‚ü®s‚ü© conserved 'salimos' per penny2002; Uruguayan '√≥mnibus'.
es-UY-019	¬ŅQuer√©s que pasemos por la feria de Trist√°n Narvaja?	keňą…ĺes ke paňąsemos po…ĺ la ňąfe…ĺja de t…ĺiňąstan naňą…ĺbaxa	Do you want to stop by the Trist√°n Narvaja market?	question	Voseo 'quer√©s' per fontanella_de_weinberg1992; seseo baseline penny2002.
es-UY-020	Ella se llev√≥ el termo y el mate a la playa.	ňąe Ěa se  Ěeňąő≤o el ňąte…ĺmo i el ňąmate a la plaňą Ěa	She took the thermos and the mate to the beach.	yeismo;sandhi;statement	Ye√≠smo ‚ü®ll y‚ü© [ Ě] 'ella llev√≥ playa' per hualde2005.
