id	sentence	ipa	gloss_en	features	notes
gl-x-eonavia-001	O ceo non est√° claro hoxe.	ňąo ňąőłeo ňąnoŇč eňąsta ňąkla…ĺo ňąo Ée	The sky is not clear today.	distincion;velar_nasal;statement;negation	Distinci√≥n ‚ü®c‚ü© [őł] 'ceo' (general in the Navia-Eo zone); word-final velar [Ňč] 'non' per frias_conde2005.
gl-x-eonavia-002	Estos zapatos custan corenta euros.	ňąestos őłaňąpatos ňąkustaŇč koňą…ĺenta ňąew…ĺos	These shoes cost forty euros.	distincion;velar_nasal;sandhi;statement;number	‚ü®z‚ü© [őł] 'zapatos'; regional ‚ü®estos‚ü©; coda [Ňč] 'custan'; ‚ü®s‚ü©+voiced sandhi per alla_normas_gallego_asturiano2007.
gl-x-eonavia-003	A chegada dos amigos √© ma√Ī√° √°s tres.	ňąa t Éeňą…£a√įa ňądos aňąmi…£os ňą…õ maňą…≤a ňąas ňąt…ĺes	The friends' arrival is tomorrow at three.	palatal_nasal;open_mid;sandhi;statement;number	Word-initial ‚ü®ch‚ü© [t É] robustly preserved 'chegada' [t Ée…£a√įa]; open-mid […õ] '√©'; palatal nasal ‚ü®√Ī‚ü© […≤] 'ma√Ī√°' per frias_conde2005.
gl-x-eonavia-004	Meu irm√°n vive preto da aldea.	ňąmew iňą…ĺmaŇč ňąbibe ňąp…ĺeto ňąda ňąaldea	My brother lives near the village.	velar_nasal;sandhi;statement	Word-final velar [Ňč] 'irm√°n'; regional 'aldea'; intervocalic /…°/ lenited […£] carried from the Galician base per alla_normas_gallego_asturiano2007.
gl-x-eonavia-005	Vai de fronte e torce pola primeira congostra.	ňąbaj ňąde ňąf…ĺonte ňąe ňąto…ĺőłe ňąpola p…ĺiňąmej…ĺa koňąn…°ost…ĺa	Go straight ahead and turn down the first narrow path.	distincion;sandhi;imperative	No ńĒ/Ňé diphthongisation 'fronte'/'torce' (Galaico-Portuguese, not Asturleonese); regional 'congostra' (narrow path); distinci√≥n 'torce' [őł] per frias_conde2005.
gl-x-eonavia-006	A caldeirada daquel sitio estaba moi boa.	ňąa kaldeňąj…ĺa√įa daňąkel ňąsitjo eňąstaő≤a ňąmoj ňąboa	The fish stew at that place was very good.	sandhi;statement	Regional 'caldeirada'; the transitional variety keeps the Galician hiatus/sandhi behaviour per fernandez_rei1990.
gl-x-eonavia-007	Onde est√° a chave da corte?	ňąonde eňąsta ňąa ňąt Éabe ňąda ňąko…ĺte	Where is the cowshed key?	sandhi;question	Affricate ‚ü®ch‚ü© [t É] 'chave' preserved word-initially; regional 'corte' (cowshed) per frias_conde2005.
gl-x-eonavia-008	Cantas persoas ve√Īen cear?	ňąkantas ňąpe…ĺsoas ňąbe…≤eŇč ňąőłea…ĺ	How many people are coming to dinner?	distincion;palatal_nasal;velar_nasal;sandhi;question	Palatal nasal 've√Īen' […≤] with a velar coda [Ňč]; distinci√≥n ‚ü®ce‚ü© [őł] 'cear' per frias_conde2005.
gl-x-eonavia-009	Se eu puidese, mercar√≠a aquela casa vella.	ňąse ňąew pwiňą√įese me…ĺkaňą…ĺia aňąkela ňąkasa ňąbe éa	If I could, I would buy that old house.	lateral_palatal;sandhi;statement	Regional 'mercar'; palatal lateral ‚ü®ll‚ü© [ é] 'vella' retained (no ye√≠smo) per alla_normas_gallego_asturiano2007.
gl-x-eonavia-010	Onte merquei cinco quilos de casta√Īas na feira.	ňąonte ňąme…ĺkej ňąőłinko ňąkilos ňąde kaňąsta…≤as ňąna ňąfej…ĺa	Yesterday I bought five kilos of chestnuts at the fair.	distincion;palatal_nasal;sandhi;statement;number	Distinci√≥n ‚ü®c‚ü© [őł] 'cinco'; 'casta√Īas' […≤]; ‚ü®s‚ü©+voiced sandhi 'casta√Īas na' per frias_conde2005.
gl-x-eonavia-011	O ano que v√©n hei viaxar a Navia.	ňąo ňąano ňąke ňąb…õŇč ňąej bjaňą Éa…ĺ ňąa ňąnabja	Next year I will travel to Navia.	open_mid;velar_nasal;sandhi;statement	Open-mid […õ] 'v√©n' [b…õŇč]; ‚ü®x‚ü© [ É] 'viaxar'; place-name Navia (the eastern river border) per fernandez_rei1990.
gl-x-eonavia-012	Ch√°mame cando chegues √° casa.	ňąt Éamame ňąkando ňąt Ée…°es ňąa ňąkasa	Call me when you get home.	sandhi;imperative	Affricate ‚ü®ch‚ü© [t É] 'ch√°mame'/'chegues' preserved per frias_conde2005.
gl-x-eonavia-013	Boas tardes, como che vai a vida?	ňąboas ňąta…ĺdes ňąkomo ňąt Ée ňąbaj ňąa ňąbi√įa	Good afternoon, how is life treating you?	sandhi;question	Clitic ‚ü®ch‚ü© [t É] 'che'; hiatus 'vai a' per fernandez_rei1990.
gl-x-eonavia-014	M√°is vale paxaro na man que cento voando.	ňąmais ňąbale paňą Éa…ĺo ňąna ňąmaŇč ňąke ňąőłento ňąboando	A bird in the hand is worth two in the bush.	distincion;velar_nasal;sandhi;statement	‚ü®x‚ü© [ É] 'paxaro'; distinci√≥n ‚ü®ce‚ü© [őł] 'cento'; word-final velar [Ňč] 'man' per frias_conde2005.
gl-x-eonavia-015	O can corre pola ribeira do r√≠o.	ňąo ňąkaŇč ňąkore ňąpola riňąő≤ej…ĺa ňądo ňąrio	The dog runs along the riverbank.	velar_nasal;rhotic;statement	Word-final velar [Ňč] 'can'; trill [r] 'corre'/'r√≠o' vs tap 'ribeira' per fernandez_rei1990.
gl-x-eonavia-016	A muller vella colle a agulla amarela.	ňąa muňą ée…ĺ ňąbe éa ňąko ée ňąa ňąa…° éa amaňą…ĺela	The old woman picks up the yellow needle.	lateral_palatal;sandhi;statement	Palatal lateral ‚ü®ll‚ü© [ é] 'muller'/'vella'/'colle'/'agulla' ‚ÄĒ / é/ retained per alla_normas_gallego_asturiano2007.
gl-x-eonavia-017	A chuvia cae sobre o teito de lousa.	ňąa ňąt Éubja ňąkae ňąsob…ĺe ňąo ňątejto ňąde ňąlowsa	The rain falls on the slate roof.	sandhi;statement	Word-initial ‚ü®ch‚ü© [t É] 'chuvia' [t Éubja] and the -CT- outcome ‚ü®teito‚ü© [tejto] (Galaico-Portuguese [it], not Castilian [t É]); falling diphthong [ej] per frias_conde2005.
gl-x-eonavia-018	A vi√Īa da monta√Īa d√° bo vi√Īo.	ňąa ňąbi…≤a ňąda moňąnta…≤a ňąda ňąbo ňąbi…≤o	The vineyard on the mountain gives good wine.	palatal_nasal;statement	Palatal nasal ‚ü®√Ī‚ü© […≤] 'vi√Īa'/'monta√Īa'/'vi√Īo' per frias_conde2005.
gl-x-eonavia-019	Unha das mulleres colleu algunha flor.	ňąuŇča ňądas muňą ée…ĺes ňąko éew ňąal…°Ňča ňąflo…ĺ	One of the women picked some flower.	lateral_palatal;velar_nasal;sandhi;statement	Palatal lateral ‚ü®ll‚ü© [ é] 'mulleres'/'colleu'; velar nasal ‚ü®nh‚ü© [Ňč] 'unha'/'algunha' per alla_normas_gallego_asturiano2007.
gl-x-eonavia-020	A ponte da vila ten doce arcos de pedra.	ňąa ňąponte ňąda ňąbila ňąteŇč ňądoőłe ňąa…ĺkos ňąde ňąped…ĺa	The town bridge has twelve arches of stone.	distincion;velar_nasal;sandhi;statement;number	Distinci√≥n ‚ü®ce‚ü© [őł] 'doce'; word-final velar [Ňč] 'ten'; regional 'ponte' per frias_conde2005.
