id	sentence	ipa	gloss_en	features	notes
pt-BR-x-sul-001	O tempo não está nada bom hoje de tarde.	ˈu ˈtẽpu ˈnɐ̃w̃ eˈsta ˈnadɐ ˈbõ ˈoʒe ˈde ˈtaɾde	The weather is not good at all this afternoon.	vowel_reduction;close_mid;nasal_vowel;nasal_diphthong;sandhi;statement;negation	Conservative Gaúcho: final /e/ retained as [e] in 'hoje'/'tarde', not raised to [i] (mateus_dandrade2000); non-palatalising dental /d/ in 'de'/'tarde' per silva2002.
pt-BR-x-sul-002	Estes chinelos custam quarenta reais na feira.	ˈestes ʃiˈnelos ˈkustɐ̃ kaˈɾẽtɐ reˈajs ˈnɐ ˈfejɾɐ	These sandals cost forty reais at the market.	vowel_reduction;close_mid;nasal_vowel;rhotic;diphthong_ei_ou;sandhi;statement;number	Alveolar trill onset [r] in 'reais' — the European-sounding Gaúcho rhotic, not the guttural [ʁ] (silva2002); alveolar coda /s/ [s] in 'estes'/'reais', no palatalisation, per the falares do Sul division of nascentes1953.
pt-BR-x-sul-003	A consulta é amanhã às três da tarde.	ˈɐ kõˈsuwtɐ ˈɛ amaˈɲɐ̃ ˈas ˈtɾes ˈdɐ ˈtaɾde	The appointment is tomorrow at three in the afternoon.	vowel_reduction;open_mid;close_mid;nasal_vowel;palatal;l_dark_or_velar;sandhi;statement;number	Palatal [ɲ] in 'amanhã' (mateus_dandrade2000); coda /l/ vocalised to [w] in 'consulta' as in general BR (silva2002); alveolar coda /s/ in 'às'/'três' per nascentes1953.
pt-BR-x-sul-004	Meu irmão mora aqui perto do arroio.	ˈmew iˈɾmɐ̃w̃ ˈmoɾɐ aˈki ˈpeɾtu ˈdu aˈroju	My brother lives right near the stream.	vowel_reduction;close_mid;nasal_vowel;nasal_diphthong;rhotic;sandhi;statement	Regional lexicon 'arroio' (stream) from the Spanish/Platine adstrate of the Gaúcho region, documented for southern BR by noll2008; trill [r] in intervocalic 'arroio' (silva2002); nasal diphthong [ɐ̃w̃] in 'irmão' (mateus_dandrade2000).
pt-BR-x-sul-005	Segue reto e dobra na próxima esquina.	ˈseɡe ˈretu ˈe ˈdobɾɐ ˈnɐ ˈpɾɔʃimɐ eˈskinɐ	Go straight and turn at the next corner.	vowel_reduction;open_mid;close_mid;rhotic;sandhi;imperative	Alveolar trill onset [r] in 'reto' (silva2002); open-mid [ɔ] in 'próxima' (mateus_dandrade2000); 'reto e' vowel-junction sandhi (callou_leite2001).
pt-BR-x-sul-006	A costela com mandioca estava tri boa.	ˈɐ koˈstelɐ ˈkõ mɐ̃diˈokɐ eˈstavɐ ˈtɾi ˈboɐ	The rib with cassava was really good.	vowel_reduction;close_mid;nasal_vowel;sandhi;statement	Gaúcho intensifier 'tri' (= 'muito') and churrasco lexicon ('costela'), southern-BR register documented by noll2008; nasal [õ] in 'com', dental /d/ in 'mandioca' (silva2002).
pt-BR-x-sul-007	Onde é que tu deixaste o chimarrão?	ˈõde ˈɛ ˈke ˈtu deˈjʃaste ˈu ʃimaˈrɐ̃w̃	Where did you leave the mate?	vowel_reduction;open_mid;close_mid;nasal_vowel;nasal_diphthong;rhotic;diphthong_ei_ou;sandhi;question	Second-person 'tu' with 2sg preterite 'deixaste' — the Gaúcho campeiro paradigm attested for RS by cardoso_etal2014; 'chimarrão' (mate) regional lexicon (noll2008); trill [r] and nasal diphthong [ɐ̃w̃] in 'chimarrão' (silva2002).
pt-BR-x-sul-008	Quantos cavalos tem na tua estância?	ˈkɐ̃tos kaˈvalos ˈtẽ ˈnɐ ˈtuɐ eˈstɐ̃s̺iɐ	How many horses are there on your ranch?	vowel_reduction;close_mid;nasal_vowel;sandhi;question	'tua' + Platine ranching lexicon 'estância', southern-BR register (noll2008); possessive 'tua' consistent with the 'tu' paradigm of cardoso_etal2014; 'tua estância' vowel-junction sandhi (callou_leite2001).
pt-BR-x-sul-009	Se tu quisesses, comprava aquela chácara.	ˈse ˈtu kiˈzeses kõˈpɾavɐ aˈkelɐ ˈʃakaɾɐ	If you wanted, I would buy that little farm.	vowel_reduction;close_mid;nasal_vowel;sandhi;statement	'tu' + 2sg imperfect subjunctive 'quisesses' (cardoso_etal2014); reduced-apodosis conditional with imperfect 'comprava' typical of colloquial BR (noll2008); dental /d/ retained (silva2002).
pt-BR-x-sul-010	Tu compraste as frutas e as verduras na venda?	ˈtu kõˈpɾaste ˈas ˈfɾutas ˈe ˈas veˈɾduɾas ˈnɐ ˈvẽdɐ	Did you buy the fruit and the vegetables at the store?	vowel_reduction;close_mid;nasal_vowel;sandhi;question	'tu' + 2sg 'compraste' (cardoso_etal2014); 'venda' (small country store) regional lexicon (noll2008); alveolar coda /s/ across 'as frutas'/'as verduras', no palatalisation (nascentes1953).
pt-BR-x-sul-011	Amanhã nós vamos de carro até a serra.	amaˈɲɐ̃ ˈnɔs ˈvamos ˈde ˈkaru aˈtɛ ˈɐ ˈserɐ	Tomorrow we are going by car to the highlands.	vowel_reduction;open_mid;close_mid;nasal_vowel;palatal;rhotic;sandhi;statement	Trill [r] in 'carro'/'serra' (silva2002); palatal [ɲ] and nasal in 'amanhã' (mateus_dandrade2000); open-mid [ɔ] in 'nós' (silva2002).
pt-BR-x-sul-012	Me liga quando tu chegares em casa, tchê.	ˈme ˈliɡɐ ˈkɐ̃du ˈtu ʃeˈɡaɾes ˈẽ ˈkazɐ ˈtʃe	Call me when you get home, mate.	vowel_reduction;close_mid;nasal_vowel;sandhi;imperative	'tu' + 2sg future subjunctive 'chegares' (cardoso_etal2014); Gaúcho vocative 'tchê' [tʃe] from the Platine adstrate (noll2008); nasal [ẽ] in 'em' (silva2002).
pt-BR-x-sul-013	Bah, buenas, como é que tu vais, tchê?	ˈba buˈenas ˈkomu ˈɛ ˈke ˈtu ˈvajs ˈtʃe	Wow, hey, how are you doing, mate?	open_mid;close_mid;sandhi;question	Gaúcho discourse markers 'bah', 'buenas' and 'tchê' — Spanish/Platine adstrate greetings characteristic of RS speech (noll2008); 'tu vais' 2sg (cardoso_etal2014); 'como é' vowel-junction sandhi (callou_leite2001).
pt-BR-x-sul-014	Mais vale um pássaro na mão que dois voando.	ˈmajs ˈvale ˈũ ˈpasaɾu ˈnɐ ˈmɐ̃w̃ ˈke ˈdojs voˈɐ̃du	A bird in the hand is worth two in the bush.	vowel_reduction;close_mid;nasal_vowel;nasal_diphthong;sandhi;statement	Proverb in neutral register; nasal diphthong [ɐ̃w̃] in 'mão' (mateus_dandrade2000); coda /s/ [s] in 'mais'/'dois' with no palatalisation (nascentes1953).
pt-BR-x-sul-015	O carro do Rodrigo ferrou na estrada de terra.	ˈu ˈkaru ˈdu roˈdɾiɡu feˈrow ˈnɐ eˈstɾadɐ ˈde ˈterɐ	Rodrigo's car broke down on the dirt road.	vowel_reduction;close_mid;rhotic;diphthong_ei_ou;sandhi;statement	Dense alveolar trill [r] in 'carro'/'Rodrigo'/'ferrou'/'terra' — the defining Gaúcho onset/rr rhotic (silva2002; mateus_dandrade2000); [ow] in 'ferrou' (callou_leite2001).
pt-BR-x-sul-016	O leiteiro trouxe pouco leite outro dia.	ˈu leˈjtejɾu ˈtɾowʃe ˈpowku ˈlejte ˈowtɾu ˈdiɐ	The milkman brought little milk the other day.	vowel_reduction;close_mid;diphthong_ei_ou;sandhi;statement	Retained falling diphthongs [ej]/[ow] in 'leiteiro'/'pouco'/'outro' (mateus_dandrade2000); final /e/ kept as [e] in 'leite' (silva2002).
pt-BR-x-sul-017	O sol forte queimava o milharal.	ˈu ˈsow ˈfoɾte keˈjmavɐ ˈu miʎaˈɾaw	The strong sun scorched the cornfield.	vowel_reduction;close_mid;palatal;diphthong_ei_ou;l_dark_or_velar;sandhi;statement	Palatal [ʎ] in 'milharal' (mateus_dandrade2000); coda /l/ vocalised to [w] in 'sol'/'milharal' as in general BR (silva2002); [ej] in 'queimava' (callou_leite2001).
pt-BR-x-sul-018	A filha da vizinha mexia no ninho com galho.	ˈɐ ˈfiʎɐ ˈdɐ viˈziɲɐ meˈʃiɐ ˈnu ˈniɲu ˈkõ ˈɡaʎu	The neighbour's daughter poked at the nest with a twig.	vowel_reduction;close_mid;nasal_vowel;palatal;statement	Palatals [ʎ] ('filha','galho') and [ɲ] ('vizinha','ninho') (mateus_dandrade2000); dental /d/ in 'da' (silva2002).
pt-BR-x-sul-019	O café estava ótimo, mas a torta ficou meio seca.	ˈu kaˈfɛ eˈstavɐ ˈɔtimu ˈmas ˈɐ ˈtoɾtɐ fiˈkow ˈmeju ˈsekɐ	The coffee was great, but the pie came out a bit dry.	vowel_reduction;open_mid;close_mid;diphthong_ei_ou;sandhi;statement	Open-mids [ɛ] ('café') and [ɔ] ('ótimo') (mateus_dandrade2000); [ow] in 'ficou', [ej] in 'meio' (callou_leite2001).
pt-BR-x-sul-020	Quem não tem cão caça com gato, dizia a velha.	ˈkẽ ˈnɐ̃w̃ ˈtẽ ˈkɐ̃w̃ ˈkasɐ ˈkõ ˈɡatu diˈziɐ ˈɐ ˈveʎɐ	Who has no dog hunts with a cat, the old woman used to say.	vowel_reduction;close_mid;nasal_vowel;nasal_diphthong;palatal;sandhi;statement;negation	Nasal diphthongs [ɐ̃w̃] in 'não'/'cão' (mateus_dandrade2000); palatal [ʎ] in 'velha' (silva2002); 'dizia a' vowel-junction sandhi (callou_leite2001).
