id	sentence	ipa	gloss_en	features	notes
pt-BR-x-sp-001	O tempo n√£o est√° bom hoje, n√£o vou sair.	u ňąteŐÉpu ňąn…źŐÉwŐÉ eňąsta ňąboŐÉ ňąo íi ňąn…źŐÉwŐÉ ňąvow ňąsaj…ĺ	The weather is not good today, I'm not going out.	vowel_reduction;close_mid;nasal_vowel;nasal_diphthong;diphthong_ei_ou;sandhi;statement;negation	Nasal diphthong 'n√£o' [ňąn…źŐÉwŐÉ] and final raising 'hoje' [ňąo íi]; paulistano keeps an alveolar coda /s/ (no chiado) per silva2002 and barbosa_albano2004.
pt-BR-x-sp-002	Essas duas camisas custam trinta reais.	ňąesas ňąduas kaňąmizas ňąkust…źŐÉwŐÉ ňąt…ĺiŐÉt…ź  Āeňąajs	These two shirts cost thirty reais.	vowel_reduction;close_mid;nasal_vowel;rhotic;sandhi;statement;number	Intervocalic voiced 'camisas' [kaňąmizas], alveolar coda [s] and strong onset /r/ 'reais' [ Āeňąajs] per barbosa_albano2004 and silva2002.
pt-BR-x-sp-003	A consulta √© amanh√£ √†s tr√™s da tarde.	…ź koŐÉňąsuwt…ź ňą…õ amaňą…≤…źŐÉ as ňąt…ĺes d…ź ňąta…ĺdÕ° íi	The appointment is tomorrow at three in the afternoon.	vowel_reduction;open_mid;close_mid;nasal_vowel;palatal;l_dark_or_velar;sandhi;statement;number	Palatal […≤] 'amanh√£', coda /l/ vocalised 'consulta' [k√Ķňąsuwt…ź] and open-mid […õ] per silva2002 and mateus_dandrade2000.
pt-BR-x-sp-004	Meu irm√£o mora perto daqui com a fam√≠lia.	ňąmew iňą…ĺm…źŐÉwŐÉ ňąm…Ē…ĺ…ź ňąpe…ĺtu daňąki koŐÉ …ź faňąmili…ź	My brother lives near here with the family.	vowel_reduction;close_mid;nasal_vowel;nasal_diphthong;sandhi;statement	Nasal diphthong 'irm√£o' [iňą…ĺm…źŐÉwŐÉ] and 'com a' liaison per mateus_dandrade2000 and barbosa_albano2004.
pt-BR-x-sp-005	Vira √† direita e segue reto at√© a pra√ßa.	ňąvi…ĺ…ź a dÕ° íiňą…ĺejt…ź i ňąse…°i ňą Āetu aňąt…õ …ź ňąp…ĺas…ź	Turn right and keep straight on until the square.	vowel_reduction;open_mid;close_mid;rhotic;diphthong_ei_ou;sandhi;imperative	Affrication /d/ before [i] 'direita' [dÕ° íiňą…ĺejt…ź] and strong onset /r/ 'reto' [ňą Āetu] per barbosa_albano2004 and silva2002.
pt-BR-x-sp-006	A comida daquele restaurante estava deliciosa.	…ź koňąmid…ź daňąkeli  Āestaňąw…ĺ…źŐÉtÕ° Éi eňąstav…ź delisŐļiňąoz…ź	The food at that restaurant was delicious.	vowel_reduction;close_mid;nasal_vowel;rhotic;sandhi;statement	Strong onset /r/ 'restaurante' [ Ā] and light paulistano pretonic per silva2002 and callou_leite2001.
pt-BR-x-sp-007	Onde √© que a gente pega o √īnibus pro centro?	ňąoŐÉdÕ° íi ňą…õ ki …ź ňą íeŐÉtÕ° Éi ňąpe…°…ź u ňąonibus ňąp…ĺu ňąsŐļeŐÉt…ĺu	Where do we catch the bus to downtown?	vowel_reduction;open_mid;close_mid;nasal_vowel;sandhi;question	Colloquial 'a gente'/'√īnibus'; open-mid […õ] and 'que a gente' elision per silva2002 and mateus_dandrade2000.
pt-BR-x-sp-008	Quantas pessoas voc√™ vai levar na viagem?	kw…źŐÉňątas peňąsoas voňąsŐļe ňąvaj leňąva…ĺ n…ź viňąa íeŐÉjŐÉ	How many people are you taking on the trip?	vowel_reduction;close_mid;nasal_vowel;sandhi;question;number	'voc√™' with 3sg; paulistano coda /r/ is a plain tap 'levar' [leňąva…ĺ], NOT the caipira retroflex of amaral1920, per barbosa_albano2004.
pt-BR-x-sp-009	Se eu pudesse, comprava aquela casa azul.	si ňąew puňądesi koŐÉňąp…ĺav…ź aňąkel…ź ňąkaz…ź aňązuw	If I could, I would buy that blue house.	vowel_reduction;close_mid;nasal_vowel;l_dark_or_velar;sandhi;statement	Coda /l/ vocalised 'azul' [aňązuw] and final raising 'pudesse' [puňądesi] per silva2002 and callou_leite2001.
pt-BR-x-sp-010	Ontem eu comprei frutas e verduras na feira.	ňąoŐÉteŐÉjŐÉ ňąew koŐÉňąp…ĺej ňąf…ĺutas i veňą…ĺdu…ĺas n…ź ňąfej…ĺ…ź	Yesterday I bought fruit and vegetables at the market.	vowel_reduction;close_mid;nasal_vowel;diphthong_ei_ou;sandhi;statement	'ei' diphthong 'feira', tap coda /r/ 'verduras' and 'frutas e' liaison per barbosa_albano2004 and silva2002.
pt-BR-x-sp-011	Semana que vem a gente vai viajar de trem.	seňąman…ź ki ňąveŐÉjŐÉ …ź ňą íeŐÉtÕ° Éi ňąvaj viaňą ía…ĺ dÕ° íi ňąt…ĺeŐÉjŐÉ	Next week we're going to travel by train.	vowel_reduction;close_mid;nasal_vowel;statement	BR lexicon 'a gente'/'trem'; nasal [ŠļĹ] and tap coda /r/ 'viajar' per silva2002 and callou_leite2001.
pt-BR-x-sp-012	Me liga quando voc√™ chegar em casa, t√° legal?	mi ňąli…°…ź ňąkw…źŐÉdu voňąsŐļe  Éeňą…°a…ĺ eŐÉjŐÉ ňąkaz…ź ňąta leňą…°aw	Call me when you get home, all right?	vowel_reduction;close_mid;nasal_vowel;l_dark_or_velar;imperative;question	Imperative 'me liga'; coda /l/ vocalised 'legal' [leňą…°aw], tap coda /r/ 'chegar' per silva2002 and barbosa_albano2004.
pt-BR-x-sp-013	Bom dia, tudo bem com voc√™ hoje?	ňąboŐÉ ňądÕ° íi…ź ňątudu ňąbeŐÉjŐÉ koŐÉ voňąsŐļe ňąo íi	Good morning, how are you today?	vowel_reduction;close_mid;nasal_vowel;question	'voc√™' greeting; affrication 'dia' [ňądÕ° íi…ź] and nasal [√Ķ]/[ŠļĹ] per barbosa_albano2004 and mateus_dandrade2000.
pt-BR-x-sp-014	Quem n√£o arrisca n√£o petisca.	ňąkeŐÉjŐÉ ňąn…źŐÉwŐÉ aňą Āisk…ź ňąn…źŐÉwŐÉ peňątÕ° Éisk…ź	Nothing ventured, nothing gained.	vowel_reduction;close_mid;nasal_vowel;nasal_diphthong;rhotic;sandhi;statement	Strong onset /r/ 'arrisca' [aňą Āisk…ź] and affrication 'petisca' [peňątÕ° Éisk…ź] per barbosa_albano2004 and silva2002.
pt-BR-x-sp-015	O gato preto estava dormindo no sof√° da sala.	u ňą…°atu ňąp…ĺetu eňąstav…ź doňą…ĺmiŐÉdu nu soňąfa d…ź ňąsal…ź	The black cat was sleeping on the living-room sofa.	vowel_reduction;close_mid;nasal_vowel;sandhi;statement	'gato' [ňą…°atu] final raising and paulistano estar+ger√ļndio 'estava dormindo' per barbosa_albano2004 and silva2002.
pt-BR-x-sp-016	Aquele rato correu pro buraco do muro.	aňąkeli ňą Āatu koňą Āew ňąp…ĺu buňą…ĺaku du ňąmu…ĺu	That mouse ran into the hole in the wall.	close_mid;rhotic;statement	'rato' [ňą Āatu] strong initial /r/ and final raising 'muro' per barbosa_albano2004 and silva2002.
pt-BR-x-sp-017	O mundo inteiro fala desse assunto agora.	u ňąmuŐÉdu iŐÉňątej…ĺu ňąfal…ź ňądesi aňąsuŐÉtu aňą…°o…ĺ…ź	The whole world is talking about this subject now.	vowel_reduction;close_mid;nasal_vowel;diphthong_ei_ou;sandhi;statement	Nasal 'mundo' [ňąmŇ©du] and 'ei' 'inteiro'; 'mundo inteiro' junction per mateus_dandrade2000 and silva2002.
pt-BR-x-sp-018	Ele √© muito chato quando bebe demais.	ňąeli ňą…õ ňąmujtu ňą Éatu ňąkw…źŐÉdu ňąbebi deňąmajs	He is very annoying when he drinks too much.	vowel_reduction;open_mid;close_mid;nasal_vowel;sandhi;statement	Lexical [ É] 'chato', open-mid […õ] and 'ele √©' elision per barbosa_albano2004 and mateus_dandrade2000.
pt-BR-x-sp-019	A tia trouxe leite e p√£o doce de tarde.	…ź ňątÕ° Éi…ź ňąt…ĺowsi ňąlejtÕ° Éi i ňąp…źŐÉwŐÉ ňądosŐļi dÕ° íi ňąta…ĺdÕ° íi	Auntie brought milk and sweet bread in the afternoon.	vowel_reduction;close_mid;nasal_vowel;nasal_diphthong;diphthong_ei_ou;sandhi;statement	Affrication 'tia' [ňątÕ° Éi…ź], nasal diphthong 'p√£o' [ňąp…źŐÉwŐÉ] and 'ei' 'leite' per barbosa_albano2004 and silva2002.
pt-BR-x-sp-020	O sol brilha forte por cima dos telhados.	u ňąs…Ēw ňąb…ĺi é…ź ňąf…Ē…ĺtÕ° Éi po…ĺ ňąsŐļim…ź dus teňą éadus	The sun shines strongly over the rooftops.	vowel_reduction;close_mid;palatal;l_dark_or_velar;statement	Coda /l/ vocalised 'sol' [ňąsow] and palatal [ é] 'brilha' per silva2002 and mateus_dandrade2000.
