id	sentence	ipa	gloss_en	features	notes
pt-BR-001	O tempo n茫o est谩 bom hoje, n茫o vou sair.	藞u 藞te虄pu 藞n蓯虄w虄 e藞sta 藞bo虄 藞o蕭i 藞n蓯虄w虄 藞vow 藞saj删	The weather is not good today, I'm not going out.	vowel_reduction;close_mid;nasal_vowel;nasal_diphthong;diphthong_ei_ou;sandhi;statement;negation	Nasal diphthong 'n茫o' [藞n蓯虄w虄] and final-vowel raising 'hoje' [藞o蕭i]; BR base keeps an alveolar coda /s/ (no chiado) per camara1970 and barbosa_albano2004.
pt-BR-002	Essas duas camisas custam trinta reais.	藞es毯as 藞duas ka藞mizas 藞kust蓯虄 藞t删i虄t蓯 蕘e藞ajs	These two shirts cost thirty reais.	vowel_reduction;close_mid;nasal_vowel;rhotic;sandhi;statement;number	Intervocalic 's' voiced 'camisas' [ka藞mizas] with alveolar coda [s], strong onset /r/ 'reais' [蕘e藞ajs] per barbosa_albano2004 and callou_leite2001.
pt-BR-003	A consulta 茅 amanh茫 脿s tr锚s da tarde.	藞蓯 ko虄藞suwt蓯 藞蓻 ama藞刹茫 藞as 藞t删es 藞d蓯 藞ta删di	The appointment is tomorrow at three in the afternoon.	vowel_reduction;open_mid;close_mid;nasal_vowel;palatal;l_dark_or_velar;sandhi;statement;number	Palatal [刹] 'amanh茫', coda /l/ vocalised 'consulta' [k玫藞suwt蓯] and open-mid [蓻] per camara1970 and mateus_dandrade2000.
pt-BR-004	Meu irm茫o mora perto daqui com a fam铆lia.	藞mew i藞删m蓯虄w虄 藞mo删蓯 藞pe删tu da藞ki 藞ko虄 藞蓯 fa藞mili蓯	My brother lives near here with the family.	vowel_reduction;close_mid;nasal_vowel;nasal_diphthong;sandhi;statement	Nasal diphthong 'irm茫o' [i藞删m蓯虄w虄] and vowel-initial liaison 'com a' per mateus_dandrade2000 and barbosa_albano2004.
pt-BR-005	Vira 脿 direita e segue reto at茅 a pra莽a.	藞vi删蓯 藞a d汀蕭i藞删ejt蓯 藞i 藞se伞i 藞蕘etu a藞t蓻 藞蓯 藞p删as蓯	Turn right and keep straight on until the square.	vowel_reduction;open_mid;close_mid;rhotic;diphthong_ei_ou;sandhi;imperative	Affrication of /d/ before [i] 'direita' [d汀蕭i藞删ejt蓯] and strong onset /r/ 'reto' [藞蕘etu] per barbosa_albano2004 and camara1970.
pt-BR-006	A comida daquele restaurante estava deliciosa.	藞蓯 ko藞mid蓯 da藞keli 蕘esta藞w删蓯虄ti e藞stav蓯 delis毯i藞oz蓯	The food at that restaurant was delicious.	vowel_reduction;close_mid;nasal_vowel;rhotic;sandhi;statement	Strong onset /r/ 'restaurante' [蕘] and light BR pretonic (retained /e o/) per callou_leite2001 and camara1970.
pt-BR-007	Onde 茅 que a gente pega o 么nibus pro centro?	藞o虄di 藞蓻 藞ki 藞蓯 藞伞e虄ti 藞pe伞蓯 藞u 藞onibus 藞p删u 藞s毯e虄t删u	Where do we catch the bus to downtown?	vowel_reduction;open_mid;close_mid;nasal_vowel;sandhi;question	Colloquial BR lexicon 'a gente'/'么nibus'; open-mid [蓻] '茅' and elision 'que a gente' per callou_leite2001 and mateus_dandrade2000.
pt-BR-008	Quantas pessoas voc锚 vai levar na viagem?	藞k蓯虄tas pe藞s毯oas vo藞ke 藞vaj le藞va删 藞n蓯 vi藞a伞e虄	How many people are you taking on the trip?	vowel_reduction;close_mid;nasal_vowel;sandhi;question;number	'voc锚' address with 3sg verb; coda /r/ realised as tap 'levar' [le藞va删] per barbosa_albano2004 and camara1970.
pt-BR-009	Se eu pudesse, comprava aquela casa azul.	藞si 藞ew pu藞des毯i ko虄藞p删av蓯 a藞kel蓯 藞kaz蓯 a藞zuw	If I could, I would buy that blue house.	vowel_reduction;close_mid;nasal_vowel;l_dark_or_velar;sandhi;statement	Coda /l/ vocalised 'azul' [a藞zuw] and final raising 'pudesse' [pu藞des毯i] per camara1970 and callou_leite2001.
pt-BR-010	Ontem eu comprei frutas e verduras na feira.	藞o虄te虄 藞ew ko虄藞p删ej 藞f删utas 藞i ve藞删du删as 藞n蓯 藞fej删蓯	Yesterday I bought fruit and vegetables at the market.	vowel_reduction;close_mid;nasal_vowel;diphthong_ei_ou;sandhi;statement	'ei' diphthong retained 'feira' [藞fej删蓯], coda /r/ tap 'verduras' and 'frutas e' liaison per barbosa_albano2004 and callou_leite2001.
pt-BR-011	Semana que vem a gente vai viajar de trem.	se藞man蓯 藞ki 藞ve虄 藞蓯 藞伞e虄ti 藞vaj via藞蕭a删 藞di 藞t删e虄	Next week we're going to travel by train.	vowel_reduction;close_mid;nasal_vowel;statement	BR lexicon 'a gente'/'trem'; nasal [岷絔 'vem'/'trem' and coda /r/ tap 'viajar' per callou_leite2001 and camara1970.
pt-BR-012	Me liga quando voc锚 chegar em casa, t谩 legal?	藞mi 藞li伞蓯 藞k蓯虄du vo藞ke 蕛e藞伞a删 藞e虄 藞kaz蓯 藞ta le藞伞aw	Call me when you get home, all right?	vowel_reduction;close_mid;nasal_vowel;l_dark_or_velar;imperative;question	Imperative clitic 'me liga'; coda /l/ vocalised 'legal' [le藞伞aw], coda /r/ tap 'chegar' per camara1970 and barbosa_albano2004.
pt-BR-013	Bom dia, tudo bem com voc锚 hoje?	藞bo虄 藞d汀蕭i蓯 藞tudu 藞be虄 藞ko虄 vo藞ke 藞o蕭i	Good morning, how are you today?	vowel_reduction;close_mid;nasal_vowel;question	Greeting register with 'voc锚'; affrication /d/ before [i] 'dia' [藞d汀蕭i蓯] and nasal [玫]/[岷絔 per barbosa_albano2004 and mateus_dandrade2000.
pt-BR-014	Quem n茫o arrisca n茫o petisca.	藞ke虄 藞n蓯虄w虄 a藞蕘isk蓯 藞n蓯虄w虄 pe藞t汀蕛isk蓯	Nothing ventured, nothing gained.	vowel_reduction;close_mid;nasal_vowel;nasal_diphthong;rhotic;sandhi;statement	Proverb attested in cunha_cintra1984; strong onset /r/ 'arrisca' [a藞蕘isk蓯] and affrication 'petisca' [pe藞t汀蕛isk蓯] per barbosa_albano2004.
pt-BR-015	O gato preto estava dormindo no sof谩 da sala.	藞u 藞伞atu 藞p删etu e藞stav蓯 do藞删mi虄du 藞nu so藞fa 藞d蓯 藞sal蓯	The black cat was sleeping on the living-room sofa.	vowel_reduction;close_mid;nasal_vowel;sandhi;statement	'gato' [藞伞atu] final raising and BR estar+ger煤ndio 'estava dormindo' per camara1970 and barbosa_albano2004.
pt-BR-016	Aquele rato correu pro buraco do muro.	a藞keli 藞蕘atu ko藞蕘ew 藞p删u bu藞删aku 藞du 藞mu删u	That mouse ran into the hole in the wall.	close_mid;rhotic;statement	'rato' [藞蕘atu] with strong initial /r/ and final raising 'muro' [藞mu删u] per barbosa_albano2004 and camara1970.
pt-BR-017	O mundo inteiro fala desse assunto agora.	藞u 藞mu虄du i虄藞tej删u 藞fal蓯 藞des毯i a藞s毯u虄tu a藞伞o删蓯	The whole world is talking about this subject now.	vowel_reduction;close_mid;nasal_vowel;diphthong_ei_ou;sandhi;statement	Nasal 'mundo' [藞m农du] and 'ei' diphthong 'inteiro'; 'mundo inteiro' junction per mateus_dandrade2000 and camara1970.
pt-BR-018	Ele 茅 muito chato quando bebe demais.	藞eli 藞蓻 藞mujtu 藞蕛atu 藞k蓯虄du 藞bebi de藞majs	He is very annoying when he drinks too much.	vowel_reduction;open_mid;close_mid;nasal_vowel;sandhi;statement	Lexical [蕛] 'chato' and open-mid [蓻] '茅'; nasal [蓯虄] 'quando' and 'ele 茅' elision per barbosa_albano2004 and mateus_dandrade2000.
pt-BR-019	A tia trouxe leite e p茫o doce de tarde.	藞蓯 藞t汀蕛i蓯 藞t删ow蕛i 藞lejti 藞i 藞p蓯虄w虄 藞dos毯i 藞di 藞ta删di	Auntie brought milk and sweet bread in the afternoon.	vowel_reduction;close_mid;nasal_vowel;nasal_diphthong;diphthong_ei_ou;sandhi;statement	Affrication /t/ before [i] 'tia' [藞t汀蕛i蓯], nasal diphthong 'p茫o' [藞p蓯虄w虄] and 'ei' 'leite' per barbosa_albano2004 and camara1970.
pt-BR-020	O sol brilha forte por cima dos telhados.	藞u 藞sow 藞b删i蕩蓯 藞fo删ti 藞po删 藞s毯im蓯 藞dos te藞蕩ados	The sun shines strongly over the rooftops.	vowel_reduction;close_mid;palatal;l_dark_or_velar;statement	Coda /l/ vocalised 'sol' [藞sow] and palatal [蕩] 'brilha' per camara1970 and mateus_dandrade2000.
