id	sentence	ipa	gloss_en	features	notes
pt-GW-001	Hoje n茫o est谩 calor nem vento.	藞蓴蕭e 藞n蓯虄w虄 e藞sta k蓯藞l蓴r 藞ne虄 藞ve虄tu	Today it is neither hot nor windy.	vowel_reduction;open_mid;close_mid;nasal_vowel;nasal_diphthong;rhotic;sandhi	Open [蓴] in coda-rhotic 'calor' and alveolar trill [r] per couto1994; nasal [岷絔 in 'vento' per goncalves1996.
pt-GW-002	O bilhete custa mil francos.	u bi藞蕩蓻te 藞kust蓯 藞mi色 藞fr蓯虄kos	The ticket costs a thousand francs.	vowel_reduction;close_mid;nasal_vowel;palatal;rhotic;l_dark_or_velar	Guinean currency the CFA franc per kihm1994; palatal [蕩] in 'bilhete', dark coda [色] in 'mil' and nasal [蓯虄] in 'francos' per couto1994.
pt-GW-003	Tenho consulta na quinta-feira de manh茫.	藞t蓻刹u ko虄藞su色t蓯 n蓯 藞ki虄t蓯 藞fejr蓯 de m蓯藞刹茫	I have an appointment on Thursday morning.	vowel_reduction;close_mid;nasal_vowel;palatal;rhotic;diphthong_ei_ou;l_dark_or_velar	Palatal [刹] in 'tenho'/'manh茫' and dark coda [色] in 'consulta' per couto1994; retained /ej/ in 'feira' per kihm1994.
pt-GW-004	A minha fam铆lia mora numa tabanca perto do rio.	蓯 藞mi刹蓯 f蓯藞mili蓯 藞m蓴r蓯 藞num蓯 t蓯藞b蓯虄k蓯 藞p蓻rtu du 藞蕘iu	My family lives in a village near the river.	vowel_reduction;open_mid;nasal_vowel;palatal;rhotic	Kriol-origin lexicon 'tabanca' (village) widely used in Guinean Portuguese per kihm1994; strong [蕘] in 'rio' and palatal [刹] in 'minha' per couto1994.
pt-GW-005	Vira 脿 direita e segue sempre em frente.	藞vir蓯 a di藞rejt蓯 i 藞s蓻伞e 藞se虄pre e虄 藞fre虄te	Turn right and keep going straight ahead.	vowel_reduction;close_mid;nasal_vowel;rhotic;diphthong_ei_ou;sandhi	Retained /ej/ in 'direita' and alveolar trill [r] in the 'fr' cluster of 'frente' per couto1994; imperative register per goncalves1996.
pt-GW-006	Esta bianda de peixe est谩 muito boa.	藞蓻st蓯 bi藞蓯虄d蓯 de 藞pej蕛e e藞sta 藞mujtu 藞b蓴蓯	This fish bianda is very good.	vowel_reduction;open_mid;close_mid;nasal_vowel;diphthong_ei_ou;sandhi	Kriol-origin lexicon 'bianda' (staple rice-and-sauce meal) per kihm1994; retained /ej/ in 'peixe' and open [蓴] in 'boa' per couto1994.
pt-GW-007	Onde fica o lumo desta terra?	藞o虄de 藞fik蓯 u 藞lumu 藞d蓻st蓯 藞t蓻r蓯	Where is this town's weekly market?	vowel_reduction;close_mid;nasal_vowel;rhotic;sandhi	Kriol-origin lexicon 'lumo' (periodic country market) per kihm1994; alveolar trill [r] in 'terra' per couto1994; interrogative register per goncalves1996.
pt-GW-008	Quantos francos custa o peixe fresco?	藞kw蓯虄tos 藞fr蓯虄kos 藞kust蓯 u 藞pej蕛e 藞fr蓻sku	How many francs does the fresh fish cost?	vowel_reduction;close_mid;nasal_vowel;rhotic;diphthong_ei_ou;sandhi	Guinean CFA franc per kihm1994; nasal [蓯虄] in 'quantos'/'francos', retained /ej/ in 'peixe' and alveolar trill [r] in 'fresco' per couto1994.
pt-GW-009	Se chovesse, fic谩vamos em casa.	se 蕛o藞v蓻s毯e fi藞kav蓯mos e虄 藞kas蓯	If it rained, we would stay home.	vowel_reduction;close_mid;nasal_vowel;sandhi	[蕛] onset in 'chovesse' per couto1994; conditional-imperfect frame; alveolar rhotic system per couto1994.
pt-GW-010	Ontem comprei fruta no lumo da tabanca.	藞o虄te虄 ko虄藞prej 藞frut蓯 nu 藞lumu d蓯 t蓯藞b蓯虄k蓯	Yesterday I bought fruit at the village market.	vowel_reduction;close_mid;nasal_vowel;rhotic;diphthong_ei_ou	Kriol-origin lexicon 'lumo' (market) and 'tabanca' (village) per kihm1994; retained /ej/ in 'comprei' and alveolar trill [r] in 'fruta' per couto1994.
pt-GW-011	Para o ano vou viajar at茅 Bissau.	藞par蓯 u 藞蓯nu 藞vo vi蓯藞蕭ar 蓯藞t蓻 bi藞s毯aw	Next year I will travel to Bissau.	vowel_reduction;open_mid;close_mid;rhotic;diphthong_ei_ou;sandhi	Guinean capital Bissau per kihm1994; open [蓻] in 'at茅', /o/ monophthong in 'vou'->[藞vo] and /aw/ in 'Bissau' per couto1994.
pt-GW-012	Liga-me mais tarde, por favor.	藞li伞蓯 me 藞majs 藞tarde por f蓯藞v蓴r	Call me later, please.	vowel_reduction;open_mid;close_mid;rhotic	Open [蓴] in 'por'/'favor' and alveolar trill [r] in 'tarde' per couto1994; clitic imperative 'liga-me' per goncalves1996.
pt-GW-013	Ol谩, tudo bem na tua moran莽a?	o藞la 藞tudu 藞be虄 n蓯 藞tu蓯 mo藞r蓯虄s蓯	Hello, all well at your family compound?	vowel_reduction;close_mid;nasal_vowel;rhotic	Kriol-origin lexicon 'moran莽a' (family compound) per kihm1994; alveolar trill [r] in 'moran莽a' and nasal [蓯虄] per couto1994.
pt-GW-014	Quem n茫o arrisca, n茫o petisca.	藞ke虄 藞n蓯虄w虄 蓯藞risk蓯 藞n蓯虄w虄 pe藞tisk蓯	Nothing ventured, nothing gained.	vowel_reduction;close_mid;nasal_vowel;nasal_diphthong;rhotic;sandhi	Alveolar trill [r] from 'rr' in 'arrisca' per couto1994; nasal diphthong [蓯虄w虄] in 'n茫o'; proverb register per goncalves1996.
pt-GW-015	O carro parou na estrada de terra.	u 藞karu p蓯藞ro n蓯 e藞strad蓯 de 藞t蓻r蓯	The car stopped on the dirt road.	vowel_reduction;close_mid;rhotic;diphthong_ei_ou;sandhi	Alveolar trill [r] from 'rr' in 'carro' and in 'terra' per couto1994; retained /ou/->[o] in 'parou' per goncalves1996.
pt-GW-016	Ele trouxe um ramo de flores roxas.	藞蓻le 藞tro蕛e 藞u虄 藞蕘amu de 藞fl蓴res 藞蕘蓴蕛蓯s	He brought a bunch of red flowers.	vowel_reduction;open_mid;close_mid;nasal_vowel;rhotic;diphthong_ei_ou;sandhi	Strong word-initial [蕘] in 'ramo'/'roxas' and 'ou' diphthong in 'trouxe' per couto1994; open [蓴] in 'roxas'/'flores' per goncalves1996.
pt-GW-017	脌 tardinha gostamos de fazer djumbai na pra莽a.	a t蓯藞rdi刹蓯 伞o藞stamos de f蓯藞z蓻r d蕭u虄藞baj n蓯 藞pras蓯	In the late afternoon we like to hang out in the square.	vowel_reduction;close_mid;nasal_vowel;palatal;rhotic;sandhi	Kriol-origin lexicon 'djumbai' (chat, social gathering) per kihm1994; palatal [刹] in 'tardinha' and alveolar trill [r] per couto1994.
pt-GW-018	Aquele senhor vende jornais na esquina.	蓯藞k蓻le se藞刹蓴r 藞ve虄de 蕭o藞rnajs n蓯 e藞skin蓯	That gentleman sells newspapers on the corner.	vowel_reduction;open_mid;close_mid;nasal_vowel;palatal;rhotic;sandhi	Palatal [刹] in 'senhor' and alveolar trill [r] in 'senhor'/'jornais' per couto1994; open [蓻] in 'aquele' with coda /s/ kept alveolar and formal register per goncalves1996.
pt-GW-019	O melhor vinho branco vem de outra terra.	u me藞蕩蓴r 藞vi刹u 藞br蓯虄ku 藞ve虄 de 藞otr蓯 藞t蓻r蓯	The best white wine comes from elsewhere.	vowel_reduction;open_mid;close_mid;nasal_vowel;palatal;rhotic;diphthong_ei_ou;sandhi	Palatal [蕩] in 'melhor' and [刹] in 'vinho' per couto1994; 'ou' diphthong in 'outra' and alveolar trill [r] per goncalves1996.
pt-GW-020	Nunca vi um c茅u t茫o azul sobre o mar.	藞nu虄k蓯 藞vi 藞u虄 s蓻藞u 藞t蓯虄w虄 蓯藞zu色 藞s蓴bre u 藞mar	I never saw such a blue sky over the sea.	vowel_reduction;open_mid;close_mid;nasal_vowel;nasal_diphthong;rhotic;l_dark_or_velar;sandhi	Nasal diphthong [蓯虄w虄] in 't茫o', open [蓻] in 'c茅u' and dark coda [色] in 'azul' per couto1994; alveolar trill [r] in 'sobre'/'mar' per goncalves1996.
