id	sentence	ipa	gloss_en	features	notes
pt-PT-x-sao-miguel-001	O tempo n√£o est√° nada bom hoje.	ňąu ňąteŐÉpu ňąn…źŐÉwŐÉ eňą Éta ňąnad…ź ňąboŐÉ ňą…Ē í…®	The weather is not good at all today.	vowel_reduction;coda_sibilant;open_mid;close_mid;nasal_vowel;nasal_diphthong;sandhi;statement;negation	Unstressed reduction to […®]/[…ź] and nasal […źŐÉwŐÉ]/[√Ķ] inherited from the EP base per mateus_dandrade2000; micaelense register per pwl_saomiguel.
pt-PT-x-sao-miguel-002	Um quilo de fruta custa dois euros.	ňąŇ© ňąki éu ňąd…® ňąf…ĺyt…ź ňąky Ét…ź ňąd√ł í ňąew…ĺu É	A kilo of fruit costs two euros.	vowel_reduction;coda_sibilant;close_mid;palatal;u_fronting;sandhi;statement;number	Categorical stressed /u/ fronting to [y] in 'fruta'/'custa' per silva2008; intervocalic /l/ palatalised to [ é] in 'quilo' and [√ł] for 'dois' per pwl_saomiguel.
pt-PT-x-sao-miguel-003	A reuni√£o √© depois do almo√ßo.	ňą…ź  Āewniňą…źŐÉwŐÉ ňą…õ d…®ňąp√ł í ňądu …źňą…ęm…Ēsu	The meeting is after lunch.	vowel_reduction;coda_sibilant;open_mid;close_mid;nasal_vowel;nasal_diphthong;rhotic;l_dark_or_velar;sandhi;statement	[√ł] monophthong for 'depois' per silva2008; nasal diphthong […źŐÉwŐÉ], strong [ Ā] and dark coda […ę] in 'almo√ßo' per mateus_dandrade2000.
pt-PT-x-sao-miguel-004	A minha fam√≠lia mora perto do mar.	ňą…ź ňąmi…≤…ź f…źňąmi éi…ź ňąm…Ē…ĺ…ź ňąp…õ…ĺtu ňądu ňąma…ĺ	My family lives near the sea.	vowel_reduction;open_mid;palatal;statement	Palatal […≤] in 'minha' and intervocalic /l/ palatalised to [ é] in 'fam√≠lia' per pwl_saomiguel; open mid inherited per mateus_dandrade2000.
pt-PT-x-sao-miguel-005	Segue em frente e vira na segunda rua.	ňąs…®…°…® ňąeŐÉ ňąf…ĺeŐÉt…® ňąe ňąvi…ĺ…ź ňąn…ź s…®ňą…°uŐÉd…ź ňą Āy…ź	Keep straight ahead and turn on the second street.	vowel_reduction;close_mid;nasal_vowel;rhotic;u_fronting;sandhi;imperative	Stressed /u/ fronted to [y] in 'rua' (fronting applies even before a vowel here) per silva2008; 'segue em' liaison per mateus_dandrade2000; imperative register.
pt-PT-x-sao-miguel-006	A sopa de peixe estava muito boa.	ňą…ź ňąs…Ēp…ź ňąd…® ňąpej É eňą Étav…ź ňąmujtu ňąb…Ē…ź	The fish soup was very good.	vowel_reduction;coda_sibilant;open_mid;close_mid;diphthong_ei_ou;sandhi;statement	'ei' kept in 'peixe' and coda [ É] per mateus_dandrade2000; open […Ē] in 'sopa'/'boa' per segura2013.
pt-PT-x-sao-miguel-007	Onde √© que apanho o autocarro?	ňąoŐÉd…® ňą…õ ňąk…® …źňąpa…≤u ňąu awtuňąka Āu	Where do I catch the bus?	vowel_reduction;open_mid;close_mid;nasal_vowel;palatal;rhotic;sandhi;question	Palatal […≤] in 'apanho', strong [ Ā] in 'autocarro' and 'que apanho o' liaisons per mateus_dandrade2000; micaelense accent per pwl_saomiguel.
pt-PT-x-sao-miguel-008	Quantas pessoas v√™m ao jantar?	ňąkw…źŐÉt…ź É p…®ňąsŐļ…Ē…ź í ňąveŐÉ ňąaw  í…źŐÉňąta…ĺ	How many people are coming to dinner?	vowel_reduction;coda_sibilant;open_mid;close_mid;nasal_vowel;sandhi;question;number	Nasal […źŐÉ]/[ŠļĹ] and coda [ É] in 'quantas'; interrogative per segura2013.
pt-PT-x-sao-miguel-009	Se pudesse, comprava mais fruta no mercado.	ňąs…® puňąd…õsŐļ…® koŐÉňąp…ĺav…ź ňąmaj É ňąf…ĺyt…ź ňąnu m…®ňą…ĺkadu	If I could, I would buy more fruit at the market.	vowel_reduction;coda_sibilant;open_mid;close_mid;nasal_vowel;u_fronting;statement	Categorical /u/ fronted to [y] in 'fruta' per silva2008; open […õ] in 'pudesse' and reduced pretonics per mateus_dandrade2000.
pt-PT-x-sao-miguel-010	Comprei uvas e queijo na feira.	koŐÉňąp…ĺej ňąyv…ź í ňąe ňąkej íu ňąn…ź ňąfej…ĺ…ź	I bought grapes and cheese at the market.	vowel_reduction;coda_sibilant;close_mid;nasal_vowel;diphthong_ei_ou;u_fronting;sandhi;statement	Stressed /u/ fronted to [y] in 'uvas' per silva2008; 'ei' diphthongs in 'comprei'/'queijo'/'feira' per mateus_dandrade2000.
pt-PT-x-sao-miguel-011	Naquela noite fomos de barco at√© √† ilha.	n…źňąk…õl…ź ňąn√łt…® ňąf…Ēmu í ňąd…® ňąba…ĺku …źňąt…õ ňąa ňąi é…ź	That night we went by boat to the island.	vowel_reduction;coda_sibilant;open_mid;palatal;sandhi;statement	[√ł] monophthong for 'noite' per silva2008; [ é] in 'ilha' and 'at√© √†' liaison per mateus_dandrade2000.
pt-PT-x-sao-miguel-012	Telefona-me quando chegares a casa.	t…®l…®ňąf…Ēn…ź ňąm…® ňąkw…źŐÉdu  É…®ňą…°a…ĺ…® í ňą…ź ňąkaz…ź	Call me when you get home.	vowel_reduction;coda_sibilant;open_mid;nasal_vowel;sandhi;imperative	Nasal […źŐÉ] in 'quando', coda [ É] in 'chegares'; clitic imperative per mateus_dandrade2000.
pt-PT-x-sao-miguel-013	Boa tarde, ent√£o como tem passado?	ňąb…Ē…ź ňąta…ĺd eŐÉňąt…źŐÉwŐÉ ňąk…Ēmu ňąteŐÉ p…źňąsŐļadu	Good afternoon, so how have you been?	vowel_reduction;open_mid;close_mid;nasal_vowel;nasal_diphthong;sandhi;question	Nasal diphthong […źŐÉwŐÉ] in 'ent√£o' and [ŠļĹ] in 'tem' per mateus_dandrade2000; greeting register per pwl_saomiguel.
pt-PT-x-sao-miguel-014	Mais vale um p√°ssaro na m√£o que dois a voar.	ňąmaj í ňąval…® ňąŇ© ňąpasŐļ…ź…ĺu ňąn…ź ňąm…źŐÉwŐÉ ňąk…® ňąd√ł í ňą…ź vuňąa…ĺ	A bird in the hand is worth two in the bush.	vowel_reduction;coda_sibilant;nasal_vowel;nasal_diphthong;sandhi;statement	[√ł] for 'dois', coda [ É] in 'mais' and nasal […źŐÉwŐÉ] in 'm√£o' per silva2008; proverb frame per mateus_dandrade2000.
pt-PT-x-sao-miguel-015	O carro azul do meu primo √© muito r√°pido.	ňąu ňąka Āu …źňązy…ę ňądu ňąmew ňąp…ĺimu ňą…õ ňąmujtu ňą Āapidu	My cousin's blue car is very fast.	vowel_reduction;open_mid;close_mid;rhotic;l_dark_or_velar;u_fronting;sandhi;statement	Stressed /u/ fronted to [y] before a coda liquid in 'azul' ([…źňązy…ę]) per silva2008; strong [ Ā] in 'carro' per mateus_dandrade2000.
pt-PT-x-sao-miguel-016	De noite bebo pouco por causa da cruz.	ňąd…® ňąn√łt…® ňąb…õbu ňąp√łku ňąp…Ē…ĺ ňąkawz…ź ňąd…ź ňąk…ĺy É	At night I drink little because of the cross.	vowel_reduction;coda_sibilant;open_mid;diphthong_ei_ou;u_fronting;statement	[√ł] for 'noite'/'pouco' and /u/ fronted to [y] before a coda in 'cruz' ([kry É]) per silva2008; open […õ] in 'bebo'.
pt-PT-x-sao-miguel-017	O sol brilha por cima do mar.	ňąu ňąs…Ē…ę ňąb…ĺi é…ź ňąp…Ē…ĺ ňąsim…ź ňądu ňąma…ĺ	The sun shines over the sea.	vowel_reduction;open_mid;palatal;l_dark_or_velar;statement	Velarised coda […ę] in 'sol', palatal [ é] in 'brilha' per mateus_dandrade2000; conservative back vowels per rogers1948.
pt-PT-x-sao-miguel-018	O trabalho do meu filho √© dif√≠cil.	ňąu t…ĺ…źňąba éu ňądu ňąmew ňąfi éu ňą…õ diňąfisi…ę	My son's job is difficult.	vowel_reduction;open_mid;close_mid;palatal;l_dark_or_velar;sandhi;statement	Palatals [ é] in 'trabalho'/'filho' and dark coda […ę] in 'dif√≠cil' per mateus_dandrade2000; micaelense register per pwl_saomiguel.
pt-PT-x-sao-miguel-019	O caf√© est√° muito quente e forte.	ňąu k…źňąf…õ eňą Éta ňąmujtu ňąkeŐÉt…® ňąe ňąf…Ē…ĺt…®	The coffee is very hot and strong.	vowel_reduction;coda_sibilant;open_mid;close_mid;nasal_vowel;sandhi;statement	Open […õ] in 'caf√©'/'forte', nasal [ŠļĹ] in 'quente' and coda [ É] per mateus_dandrade2000.
pt-PT-x-sao-miguel-020	O n√ļmero da tua porta √© treze.	ňąu ňąnym…®…ĺu ňąd…ź ňąty…ź ňąp…Ē…ĺt…ź ňą…õ ňąt…ĺ…õz…®	The number of your door is thirteen.	vowel_reduction;open_mid;u_fronting;sandhi;statement;number	Stressed /u/ fronted to [y] in 'n√ļmero' and 'tua' per silva2008; open […Ē]/[…õ] in 'porta'/'treze' per mateus_dandrade2000.
