id	sentence	ipa	gloss_en	features	notes
pt-PT-x-aveiro-001	O tempo hoje não está nada bom.	ˈo ˈtẽpu ˈɔʒɨ ˈnɐ̃w̃ eˈʃta ˈnadɐ ˈbõ	The weather is not good at all today.	vowel_reduction;coda_sibilant;open_mid;close_mid;nasal_vowel;nasal_diphthong;sandhi;statement;negation	Unstressed reduction [ˈɔʒɨ] and coda chiado [ʃ] in 'está' inherited from the base per mateus_dandrade2000; nasal [õ] in 'bom' and nasal diphthong [ɐ̃w̃] in 'não' per cintra1971.
pt-PT-x-aveiro-002	Estes sapatos custam quarenta euros.	ˈeʃtɨʃ s̺ɐˈpatuʃ ˈkuʃtɐ̃ kwɐˈɾẽtɐ ˈewɾuʃ	These shoes cost forty euros.	vowel_reduction;coda_sibilant;close_mid;nasal_vowel;sandhi;statement;number	Onset ⟨s⟩ of 'sapatos' is the apico-alveolar [s̺] diagnostic of the Baixo-Minhoto-Duriense-Beirao group per cintra1971; coda chiado [ʃ] kept in 'estes'/'sapatos' per alvarezperez2014.
pt-PT-x-aveiro-003	A consulta é amanhã às três horas.	ˈɐ kõˈsuɫtɐ ˈɛ ɐmɐˈɲã ˈaʃ ˈtɾez ˈɔɾɐʃ	The appointment is tomorrow at three.	vowel_reduction;coda_sibilant;open_mid;close_mid;nasal_vowel;palatal;l_dark_or_velar;sandhi;statement;number	Dark coda [ɫ] in 'consulta' and coda [ʃ] in 'às'/'horas' per mateus_dandrade2000; 'três horas' junction voices the coda sibilant to [z] per cintra1971.
pt-PT-x-aveiro-004	A minha família vive numa aldeia perto de Aveiro.	ˈɐ ˈmiɲɐ fɐˈmiliɐ ˈbiβɨ ˈnumɐ ɐˈɫdejɐ ˈpɛɾtu ˈdɨ ɐˈβejɾu	My family lives in a village near Aveiro.	vowel_reduction;open_mid;close_mid;palatal;diphthong_ei_ou;l_dark_or_velar;sandhi;statement	Betacism merges /v/ to [b]~[β]: 'vive' [ˈbiβɨ], 'Aveiro' [ɐˈβejɾu] — the bilabial-merger coast north of Coimbra per alvarezperez2014 and cintra1971; local placename grounding per boleo1974.
pt-PT-x-aveiro-005	Vira à esquerda e segue sempre em frente.	ˈbiɾɐ ˈa eˈʃkɛɾdɐ ˈe ˈs̺ɨɡɨ ˈs̺ẽpɾɨ ˈẽ ˈfɾẽtɨ	Turn left and keep straight ahead.	vowel_reduction;coda_sibilant;open_mid;close_mid;nasal_vowel;sandhi;imperative	Betacism 'vira' [ˈbiɾɐ] and apico-alveolar [s̺] onsets in 'segue'/'sempre' per cintra1971; 'vira a' liaison and imperative register per cunha_cintra1984.
pt-PT-x-aveiro-006	A caldeirada de enguias estava saborosa.	ˈɐ kɐɫdeˈjɾadɐ ˈd ẽˈɡiɐz eˈʃtaβɐ s̺ɐbuˈɾɔz̺ɐ	The eel stew was tasty.	vowel_reduction;coda_sibilant;open_mid;close_mid;nasal_vowel;diphthong_ei_ou;l_dark_or_velar;sandhi;statement	Apico-alveolar [s̺]/[z̺] in 'saborosa' and betacism [β] in 'estava' per alvarezperez2014; 'ei' kept in 'caldeirada' and dark [ɫ] per cintra1971; ria cuisine grounding per boleo1974.
pt-PT-x-aveiro-007	Onde é que apanho o autocarro para Vagos?	ˈõdɨ ˈɛ ˈkɨ ɐˈpaɲu ˈo awtuˈkaʁu ˈpaɾɐ ˈbaɡuʃ	Where do I catch the bus to Vagos?	vowel_reduction;coda_sibilant;open_mid;close_mid;nasal_vowel;palatal;rhotic;sandhi;question	Palatal [ɲ] in 'apanho' and strong [ʁ] in 'autocarro' per mateus_dandrade2000; betacism gives 'Vagos' [ˈbaɡuʃ] per cintra1971; Vagos names the Aveiro littoral per boleo1974.
pt-PT-x-aveiro-008	Quantas pessoas vêm ao jantar?	ˈkwɐ̃tɐʃ pɨˈs̺ɔɐʒ ˈbẽ ˈɐu ʒɐ̃ˈtaɾ	How many people are coming to dinner?	vowel_reduction;coda_sibilant;open_mid;close_mid;nasal_vowel;sandhi;question;number	Apico-alveolar intervocalic [s̺] in 'pessoas' per cintra1971; betacism 'vêm' [ˈbẽ] per alvarezperez2014; coda [ʃ] in 'quantas' per mateus_dandrade2000.
pt-PT-x-aveiro-009	Se eu pudesse, comprava aquela casa.	ˈs̺ɨ ˈew puˈdɛs̺ɨ kõˈpɾaβɐ ɐˈkɛlɐ ˈkaz̺ɐ	If I could, I would buy that house.	vowel_reduction;open_mid;close_mid;nasal_vowel;sandhi;statement	Apico-alveolar [s̺] in 'se'/'pudesse' and intervocalic [z̺] in 'casa' per cintra1971; betacism [β] in 'comprava' per alvarezperez2014; conditional-imperfect frame per cunha_cintra1984.
pt-PT-x-aveiro-010	Ontem comprámos cebolas e azeite na feira.	ˈõtɨ̃ kõˈpɾamuʃ s̺ɨˈbɔlɐz ˈe ɐˈz̺ejtɨ ˈnɐ ˈfejɾɐ	Yesterday we bought onions and oil at the market.	vowel_reduction;coda_sibilant;open_mid;close_mid;nasal_vowel;diphthong_ei_ou;sandhi;statement	⟨c⟩ before ⟨e⟩ in 'cebolas' and ⟨z⟩ in 'azeite' both surface apico-alveolar [s̺]/[z̺] per cintra1971 and alvarezperez2014; 'ei' retained in 'azeite'/'feira' per mateus_dandrade2000.
pt-PT-x-aveiro-011	Para o ano vamos viajar até à ria.	ˈpaɾɐ ˈo ˈɐnu ˈbamuʒ biɐˈʒaɾ ɐˈtɛ ˈa ˈʁiɐ	Next year we will travel down to the lagoon.	vowel_reduction;coda_sibilant;open_mid;close_mid;rhotic;sandhi;statement	Betacism 'vamos' [ˈbamuʒ] and 'viajar' [biɐˈʒaɾ] per alvarezperez2014; 'até a' liaison and strong initial [ʁ] in 'ria' per mateus_dandrade2000; the Ria de Aveiro grounding per boleo1974.
pt-PT-x-aveiro-012	Telefona-me quando chegares a casa.	tɨlɨˈfɔnɐ ˈmɨ ˈkwɐ̃du ʃɨˈɡaɾɨz ˈɐ ˈkaz̺ɐ	Call me when you get home.	vowel_reduction;open_mid;nasal_vowel;sandhi;imperative	Nasal [ɐ̃] in 'quando' and [ʃ] onset in 'chegares' per mateus_dandrade2000; 'chegares a' voices the coda sibilant and intervocalic [z̺] in 'casa' is apical per cintra1971; clitic imperative per cunha_cintra1984.
pt-PT-x-aveiro-013	Boa tarde, então como tem passado?	ˈbɔɐ ˈtaɾd ẽˈtɐ̃w̃ ˈkɔmu ˈtẽ pɐˈs̺adu	Good afternoon, so how have you been?	vowel_reduction;open_mid;close_mid;nasal_vowel;nasal_diphthong;sandhi;question	Nasal diphthong [ɐ̃w̃] in 'então' and nasal [ẽ] in 'tem' per mateus_dandrade2000; intervocalic ⟨ss⟩ of 'passado' is apico-alveolar [s̺] per cintra1971.
pt-PT-x-aveiro-014	Mais vale um pássaro na mão que dois a voar.	ˈmajʒ ˈbalɨ ˈũ ˈpas̺ɐɾu ˈnɐ ˈmɐ̃w̃ ˈkɨ ˈdojz ˈɐ buˈaɾ	A bird in the hand is worth two in the bush.	vowel_reduction;coda_sibilant;close_mid;nasal_vowel;nasal_diphthong;sandhi;statement	Betacism 'vale' [ˈbalɨ], 'voar' [buˈaɾ] and apico-alveolar ⟨ss⟩ in 'pássaro' per alvarezperez2014 and cintra1971; proverb attested in cunha_cintra1984.
pt-PT-x-aveiro-015	O carro velho arranca com muito custo.	ˈo ˈkaʁu ˈbɛʎu ɐˈʁɐ̃kɐ ˈkõ ˈmujtu ˈkuʃtu	The old car starts with great difficulty.	vowel_reduction;coda_sibilant;open_mid;close_mid;nasal_vowel;palatal;rhotic;sandhi;statement	Strong [ʁ] from ⟨rr⟩ in 'carro'/'arranca' per mateus_dandrade2000; betacism 'velho' [ˈbɛʎu] with palatal [ʎ] per alvarezperez2014.
pt-PT-x-aveiro-016	Ele trouxe um ramo de flores vermelhas.	ˈelɨ ˈtɾoʃɨ ˈũ ˈʁamu ˈdɨ ˈflɔɾɨʒ bɨˈɾmɛʎɐʃ	He brought a bunch of red flowers.	vowel_reduction;coda_sibilant;open_mid;close_mid;nasal_vowel;palatal;rhotic;diphthong_ei_ou;sandhi;statement	Strong word-initial [ʁ] in 'ramo' and 'ou' monophthong in 'trouxe' per mateus_dandrade2000; betacism gives 'vermelhas' [bɨˈɾmɛʎɐʃ] with palatal [ʎ] per alvarezperez2014.
pt-PT-x-aveiro-017	O sol brilha por cima das salinas.	ˈo ˈs̺ɔɫ ˈbɾiʎɐ ˈpɔɾ ˈs̺imɐ ˈdaʃ s̺ɐˈlinɐʃ	The sun shines over the salt pans.	vowel_reduction;coda_sibilant;open_mid;close_mid;palatal;l_dark_or_velar;statement	Apico-alveolar [s̺] onsets in 'sol'/'cima'/'salinas' per cintra1971 and alvarezperez2014; dark coda [ɫ] in 'sol' and palatal [ʎ] in 'brilha' per mateus_dandrade2000; Aveiro salt-pan lexicon per boleo1974.
pt-PT-x-aveiro-018	A vizinha varre o chão da cozinha.	ˈɐ biˈz̺iɲɐ ˈbaʁɨ ˈo ˈʃɐ̃w̃ ˈdɐ kuˈz̺iɲɐ	The neighbour sweeps the kitchen floor.	vowel_reduction;close_mid;nasal_vowel;nasal_diphthong;palatal;rhotic;sandhi;statement	Betacism 'vizinha' [biˈz̺iɲɐ], 'varre' [ˈbaʁɨ] with intervocalic apical [z̺] and palatal [ɲ] per alvarezperez2014 and cintra1971; nasal diphthong [ɐ̃w̃] in 'chão' per mateus_dandrade2000.
pt-PT-x-aveiro-019	O rio leva os barcos até ao mar.	ˈo ˈʁiu ˈlɛβɐ ˈoʒ ˈbaɾkuz ɐˈtɛ ˈɐu ˈmaɾ	The river carries the boats out to sea.	vowel_reduction;coda_sibilant;open_mid;close_mid;rhotic;sandhi;statement	Strong word-initial [ʁ] in 'rio' per mateus_dandrade2000; betacism [β] in 'leva' and 'os barcos' voices the coda sibilant to [ʒ] per alvarezperez2014 and cintra1971.
pt-PT-x-aveiro-020	A velha ponte de pedra ainda aguenta.	ˈɐ ˈbɛʎɐ ˈpõtɨ ˈdɨ ˈpɛdɾɐ ˈaj̃dɐ ɐˈɡẽtɐ	The old stone bridge still holds.	vowel_reduction;open_mid;close_mid;nasal_vowel;nasal_diphthong;palatal;sandhi;statement	Betacism 'velha' [ˈbɛʎɐ] with palatal [ʎ] per alvarezperez2014; nasal [õ] in 'ponte' and open-mid [ɛ] in 'pedra' per mateus_dandrade2000.
