id	sentence	ipa	gloss_en	features	notes
pt-PT-x-alentejo-001	Hoje n茫o est谩 fazendo calor nenhum.	藞蓴蕭 藞n蓯虄w虄 e藞蕛ta 藞f蓯ze虄d k蓯藞l蓴删 n扫藞刹y虄	It is not hot at all today.	vowel_reduction;coda_sibilant;open_mid;close_mid;nasal_vowel;nasal_diphthong;palatal;u_fronting;sandhi;statement;negation	Gerund progressive 'est谩 fazendo' is the southern/Alentejano register per cunha_cintra1984; final unstressed vowel deletion (hoje->[藞蓴蕭], fazendo->[藞f蓯z岷絛]) per brissos2014; stressed /u/->[y] in 'nenhum' per cintra1971.
pt-PT-x-alentejo-002	Este cabaz custa nove euros e n茫o mais.	藞e蕛t k蓯藞ba蕛 藞ky蕛t蓯 藞n蓴v 藞ew删uz 藞e 藞n蓯虄w虄 藞maj蕛	This basket costs nine euros and no more.	vowel_reduction;coda_sibilant;open_mid;close_mid;nasal_vowel;nasal_diphthong;u_fronting;sandhi;statement;number	Stressed /u/->[y] in 'custa' per cintra1971 and brissos2014; final-vowel deletion (este->[藞e蕛t], nove->[藞n蓴v]) per brissos2014; 'euros e' liaison and coda [蕛] per mateus_dandrade2000.
pt-PT-x-alentejo-003	Tenho consulta na quinta-feira 脿s nove horas.	藞t蓻刹 ko虄藞sy色t蓯 藞n蓯 藞ki虄t蓯 藞fe删蓯 藞a蕭 藞n蓴v 藞蓴删蓯蕛	I have an appointment on Thursday at nine.	vowel_reduction;coda_sibilant;open_mid;close_mid;nasal_vowel;palatal;diphthong_ei_ou;l_dark_or_velar;u_fronting;sandhi;statement;number	Stressed /u/->[y] with dark coda [色] in 'consulta' per cintra1971 and brissos2014; /ej/->[e] monophthong in 'feira' per cintra1971; '脿s nove' regressive voicing to [蕭] per mateus_dandrade2000.
pt-PT-x-alentejo-004	A minha fam铆lia mora numa aldeia pequena.	藞蓯 藞mi刹蓯 f蓯藞mili蓯 藞m蓴删蓯 藞nym蓯 蓯藞色de蓯 p扫藞k蓻n蓯	My family lives in a small village.	vowel_reduction;open_mid;close_mid;palatal;diphthong_ei_ou;l_dark_or_velar;u_fronting;sandhi;statement	/ej/->[e] in 'aldeia' with dark coda [色] per cintra1971; palatal [刹] in 'minha' per mateus_dandrade2000; stressed /u/->[y] in 'numa' per brissos2014.
pt-PT-x-alentejo-005	Vira 脿 direita e segue sempre em frente.	藞vi删蓯 藞a di藞删et蓯 藞e 藞s扫伞 藞se虄p删 藞e虄 藞f删e虄t	Turn right and keep going straight ahead.	vowel_reduction;close_mid;nasal_vowel;diphthong_ei_ou;sandhi;imperative	/ej/->[e] in 'direita' per cintra1971; final-vowel deletion (segue->[藞s扫伞], frente->[藞f删岷絫]) per brissos2014; imperative register per cunha_cintra1984.
pt-PT-x-alentejo-006	Este bacalhau est谩 muito salgado.	藞e蕛t b蓯k蓯藞蕩aw e藞蕛ta 藞mujt 藞s蓯色伞a	This cod is very salty.	vowel_reduction;coda_sibilant;close_mid;palatal;l_dark_or_velar;sandhi;statement	Palatal [蕩] in 'bacalhau' per mateus_dandrade2000; dark coda [色] and intervocalic /d/ deletion with final loss in 'salgado'->[藞s蓯色伞a] per brissos2014.
pt-PT-x-alentejo-007	Onde fica a esta莽茫o dos comboios?	藞o虄d 藞fik蓯 藞蓯 e蕛t蓯藞s蓯虄w虄 藞du蕛 ko虄藞boju蕛	Where is the train station?	vowel_reduction;coda_sibilant;close_mid;nasal_vowel;nasal_diphthong;sandhi;question	Nasal diphthong [蓯虄w虄] in 'esta莽茫o' per mateus_dandrade2000; final-vowel deletion (onde->[藞玫d]) per brissos2014; interrogative register per cunha_cintra1984.
pt-PT-x-alentejo-008	Quantos quilos de p茫o queres?	藞kw蓯虄tu蕛 藞kilu蕭 藞d扫 藞p蓯虄w虄 藞k蓻删扫蕛	How many kilos of bread do you want?	vowel_reduction;coda_sibilant;open_mid;nasal_vowel;nasal_diphthong;sandhi;question;number	Nasal diphthong [蓯虄w虄] in 'p茫o' and coda [蕛]/[蕭] per mateus_dandrade2000; open-mid [蓻] in 'queres' per cintra1971.
pt-PT-x-alentejo-009	Se chovesse, fic谩vamos em casa.	藞s扫 藞蕛uv蓻s毯 fi藞kav蓯muz 藞e虄 藞kaz蓯	If it rained, we would stay home.	vowel_reduction;open_mid;close_mid;nasal_vowel;sandhi;statement	[蕛] onset in 'chovesse' and open-mid [蓻] per mateus_dandrade2000; conditional-imperfect frame per cunha_cintra1984.
pt-PT-x-alentejo-010	Ontem comprei peixe fresco no mercado.	藞o虄t扫虄 ko虄藞p删e 藞pe蕛 藞f删蓻蕛k 藞nu 藞m扫删ka	Yesterday I bought fresh fish at the market.	vowel_reduction;coda_sibilant;open_mid;close_mid;nasal_vowel;diphthong_ei_ou;statement	/ej/->[e] in 'comprei' and 'peixe' per cintra1971; intervocalic /d/ deletion with final loss in 'mercado'->[藞m扫删ka] per brissos2014.
pt-PT-x-alentejo-011	Para o ano estou pensando em ir at茅 ao Porto.	藞pa删蓯 藞u 藞蓯n e藞蕛to 藞p扫虄s蓯虄d 藞e虄 藞i删 蓯藞t蓻 藞aw 藞p蓴删t	Next year I am planning to go to Porto.	vowel_reduction;coda_sibilant;open_mid;close_mid;nasal_vowel;diphthong_ei_ou;sandhi;statement	Gerund progressive 'estou pensando' is the Alentejano register per cunha_cintra1984; /ow/->[o] in 'estou' and 'para o'/'at茅 ao' liaison per cintra1971.
pt-PT-x-alentejo-012	Liga-me mais tarde, se fazes favor.	藞li伞蓯 藞m扫 藞maj蕛 藞ta删d 藞s扫 藞faz扫蕛 f蓯藞v蓴删	Call me later, please.	vowel_reduction;coda_sibilant;open_mid;imperative	Coda [蕛] in 'mais' and open-mid [蓴] in 'favor' per mateus_dandrade2000; clitic imperative 'liga-me' per cunha_cintra1984.
pt-PT-x-alentejo-013	Ol谩, ent茫o tudo bem contigo?	o藞la e虄藞t蓯虄w虄 藞ty 藞be虄 藞ko虄ti伞	Hi, so are you doing well?	vowel_reduction;close_mid;nasal_vowel;nasal_diphthong;u_fronting;sandhi;question	Stressed /u/->[y] with final-vowel deletion in 'tudo'->[藞ty] per cintra1971 and brissos2014; nasal diphthong [蓯虄w虄] in 'ent茫o' per mateus_dandrade2000; greeting register per cunha_cintra1984.
pt-PT-x-alentejo-014	Quem n茫o arrisca, n茫o petisca.	藞k扫虄 藞n蓯虄w虄 蓯藞蕘i蕛k蓯 藞n蓯虄w虄 p扫藞ti蕛k蓯	Nothing ventured, nothing gained.	vowel_reduction;coda_sibilant;nasal_vowel;nasal_diphthong;rhotic;sandhi;statement;negation	Strong [蕘] from 'rr' in 'arrisca' per mateus_dandrade2000; nasal diphthong [蓯虄w虄] in 'n茫o'; proverb attested in cunha_cintra1984.
pt-PT-x-alentejo-015	O sul 茅 lindo quando o c茅u est谩 azul.	藞u 藞sy色 藞蓻 藞li虄d 藞kw蓯虄d 藞u s蓻藞y e藞蕛ta 蓯藞zy色	The south is beautiful when the sky is blue.	vowel_reduction;coda_sibilant;open_mid;close_mid;nasal_vowel;l_dark_or_velar;u_fronting;sandhi;statement	Stressed /u/->[y] with dark coda [色] in 'sul' and 'azul' per cintra1971 and brissos2014; open-mid [蓻] in 'c茅u' per mateus_dandrade2000.
pt-PT-x-alentejo-016	Ele trouxe um ramo de flores roxas.	藞el 藞t删oz 藞农 藞蕘am 藞d扫 藞fl蓴删扫蕭 藞蕘蓴蕛蓯蕛	He brought a bunch of purple flowers.	vowel_reduction;coda_sibilant;open_mid;close_mid;rhotic;diphthong_ei_ou;sandhi;statement	Strong word-initial [蕘] in 'ramo'/'roxas' and /ow/->[o] in 'trouxe' per cintra1971; coda [蕭]/[蕛] per mateus_dandrade2000.
pt-PT-x-alentejo-017	A velha ponte de pedra ainda aguenta.	藞蓯 藞v蓻蕩蓯 藞po虄t 藞d扫 藞p蓻d删蓯 藞aj虄d蓯 蓯藞伞e虄t蓯	The old stone bridge still holds.	vowel_reduction;open_mid;close_mid;nasal_vowel;nasal_diphthong;palatal;sandhi;statement	Palatal [蕩] in 'velha' and open-mid [蓻] in 'pedra' per mateus_dandrade2000; nasal [玫] in 'ponte' per cintra1971.
pt-PT-x-alentejo-018	Aquele rapaz vende jornais na esquina.	藞蓯k蓻l 蕘蓯藞pa蕭 藞ve虄d 蕭u藞删naj蕭 藞n蓯 e藞蕛kin蓯	That young man sells newspapers on the corner.	vowel_reduction;coda_sibilant;open_mid;close_mid;nasal_vowel;rhotic;sandhi;statement	Strong word-initial [蕘] in 'rapaz', coda [蕭] in 'jornais' and coda [蕛] in 'esquina' per mateus_dandrade2000.
pt-PT-x-alentejo-019	O melhor vinho branco vem do Douro.	藞u m扫藞蕩蓴删 藞vi刹 藞b删蓯虄k 藞ve虄 藞du 藞do删	The best white wine comes from the Douro.	vowel_reduction;open_mid;close_mid;nasal_vowel;palatal;diphthong_ei_ou;statement	Palatal [蕩] in 'melhor' and [刹] in 'vinho' per mateus_dandrade2000; /ow/->[o] in 'Douro' per cintra1971.
pt-PT-x-alentejo-020	Ando trabalhando na horta desde manh茫.	藞蓯虄d t删蓯藞b蓯蕩蓯虄d 藞n蓯 藞蓴删t蓯 藞d蓻蕛d m蓯藞刹茫	I have been working in the vegetable garden since morning.	vowel_reduction;coda_sibilant;open_mid;nasal_vowel;palatal;statement	Gerund progressive 'ando trabalhando' is the Alentejano register per cunha_cintra1984; palatal [蕩] in 'trabalhando' and [刹] in 'manh茫' per mateus_dandrade2000; final-vowel deletion in 'desde'->[藞d蓻蕛d] per brissos2014.
