id	sentence	ipa	gloss_en	features	notes
pt-PT-x-sao-miguel-001	O tempo n茫o est谩 nada bom hoje.	藞u 藞te虄pu 藞n蓯虄w虄 e藞蕛ta 藞nad蓯 藞bo虄 藞蓴蕭扫	The weather is not good at all today.	vowel_reduction;coda_sibilant;open_mid;close_mid;nasal_vowel;nasal_diphthong;sandhi;statement;negation	Unstressed reduction to [扫]/[蓯] and nasal [蓯虄w虄]/[玫] inherited from the EP base per mateus_dandrade2000; micaelense register per pwl_saomiguel.
pt-PT-x-sao-miguel-002	Um quilo de fruta custa dois euros.	藞农 藞ki蕩u 藞d扫 藞f删yt蓯 藞ky蕛t蓯 藞d酶蕭 藞ew删u蕛	A kilo of fruit costs two euros.	vowel_reduction;coda_sibilant;close_mid;palatal;u_fronting;sandhi;statement;number	Categorical stressed /u/ fronting to [y] in 'fruta'/'custa' per silva2008; intervocalic /l/ palatalised to [蕩] in 'quilo' and [酶] for 'dois' per pwl_saomiguel.
pt-PT-x-sao-miguel-003	A reuni茫o 茅 depois do almo莽o.	藞蓯 蕘ewni藞蓯虄w虄 藞蓻 d扫藞p酶蕭 藞du 蓯藞色m蓴su	The meeting is after lunch.	vowel_reduction;coda_sibilant;open_mid;close_mid;nasal_vowel;nasal_diphthong;rhotic;l_dark_or_velar;sandhi;statement	[酶] monophthong for 'depois' per silva2008; nasal diphthong [蓯虄w虄], strong [蕘] and dark coda [色] in 'almo莽o' per mateus_dandrade2000.
pt-PT-x-sao-miguel-004	A minha fam铆lia mora perto do mar.	藞蓯 藞mi刹蓯 f蓯藞mi蕩i蓯 藞m蓴删蓯 藞p蓻删tu 藞du 藞ma删	My family lives near the sea.	vowel_reduction;open_mid;palatal;statement	Palatal [刹] in 'minha' and intervocalic /l/ palatalised to [蕩] in 'fam铆lia' per pwl_saomiguel; open mid inherited per mateus_dandrade2000.
pt-PT-x-sao-miguel-005	Segue em frente e vira na segunda rua.	藞s扫伞扫 藞e虄 藞f删e虄t扫 藞e 藞vi删蓯 藞n蓯 藞s扫伞nd蓯 藞蕘y蓯	Keep straight ahead and turn on the second street.	vowel_reduction;close_mid;nasal_vowel;rhotic;u_fronting;sandhi;imperative	Stressed /u/ fronted to [y] in 'rua' (fronting applies even before a vowel here) per silva2008; 'segue em' liaison per mateus_dandrade2000; imperative register.
pt-PT-x-sao-miguel-006	A sopa de peixe estava muito boa.	藞蓯 藞s蓴p蓯 藞d扫 藞pej蕛 e藞蕛tav蓯 藞mujtu 藞b蓴蓯	The fish soup was very good.	vowel_reduction;coda_sibilant;open_mid;close_mid;diphthong_ei_ou;sandhi;statement	'ei' kept in 'peixe' and coda [蕛] per mateus_dandrade2000; open [蓴] in 'sopa'/'boa' per segura2013.
pt-PT-x-sao-miguel-007	Onde 茅 que apanho o autocarro?	藞o虄d扫 藞蓻 藞k扫 蓯藞pa刹u 藞u awtu藞ka蕘u	Where do I catch the bus?	vowel_reduction;open_mid;close_mid;nasal_vowel;palatal;rhotic;sandhi;question	Palatal [刹] in 'apanho', strong [蕘] in 'autocarro' and 'que apanho o' liaisons per mateus_dandrade2000; micaelense accent per pwl_saomiguel.
pt-PT-x-sao-miguel-008	Quantas pessoas v锚m ao jantar?	藞k蓯虄t蓯蕛 p扫藞s毯蓴蓯蕭 藞ve虄 藞aw 蕭蓯虄藞ta删	How many people are coming to dinner?	vowel_reduction;coda_sibilant;open_mid;close_mid;nasal_vowel;sandhi;question;number	Nasal [蓯虄]/[岷絔 and coda [蕛] in 'quantas'; interrogative per segura2013.
pt-PT-x-sao-miguel-009	Se pudesse, comprava mais fruta no mercado.	藞s扫 pu藞d蓻s毯扫 ko虄藞p删av蓯 藞maj蕛 藞f删yt蓯 藞nu m扫藞删kadu	If I could, I would buy more fruit at the market.	vowel_reduction;coda_sibilant;open_mid;close_mid;nasal_vowel;u_fronting;statement	Categorical /u/ fronted to [y] in 'fruta' per silva2008; open [蓻] in 'pudesse' and reduced pretonics per mateus_dandrade2000.
pt-PT-x-sao-miguel-010	Comprei uvas e queijo na feira.	ko虄藞p删ej 藞yv蓯蕭 藞e 藞kej蕭u 藞n蓯 藞fej删蓯	I bought grapes and cheese at the market.	vowel_reduction;coda_sibilant;close_mid;nasal_vowel;diphthong_ei_ou;u_fronting;sandhi;statement	Stressed /u/ fronted to [y] in 'uvas' per silva2008; 'ei' diphthongs in 'comprei'/'queijo'/'feira' per mateus_dandrade2000.
pt-PT-x-sao-miguel-011	Naquela noite fomos de barco at茅 脿 ilha.	n蓯藞k蓻l蓯 藞n酶t扫 藞f蓴mu蕭 藞d扫 藞ba删ku 蓯藞t蓻 藞a 藞i蕩蓯	That night we went by boat to the island.	vowel_reduction;coda_sibilant;open_mid;palatal;sandhi;statement	[酶] monophthong for 'noite' per silva2008; [蕩] in 'ilha' and 'at茅 脿' liaison per mateus_dandrade2000.
pt-PT-x-sao-miguel-012	Telefona-me quando chegares a casa.	t扫l扫藞f蓴n蓯 藞m扫 藞k蓯虄du 蕛扫藞伞a删扫蕭 藞蓯 藞kaz蓯	Call me when you get home.	vowel_reduction;coda_sibilant;open_mid;nasal_vowel;sandhi;imperative	Nasal [蓯虄] in 'quando', coda [蕛] in 'chegares'; clitic imperative per mateus_dandrade2000.
pt-PT-x-sao-miguel-013	Boa tarde, ent茫o como tem passado?	藞b蓴蓯 藞ta删d e虄藞t蓯虄w虄 藞k蓴mu 藞te虄 p蓯藞s毯adu	Good afternoon, so how have you been?	vowel_reduction;open_mid;close_mid;nasal_vowel;nasal_diphthong;sandhi;question	Nasal diphthong [蓯虄w虄] in 'ent茫o' and [岷絔 in 'tem' per mateus_dandrade2000; greeting register per pwl_saomiguel.
pt-PT-x-sao-miguel-014	Mais vale um p谩ssaro na m茫o que dois a voar.	藞maj蕭 藞val扫 藞农 藞pas毯蓯删u 藞n蓯 藞m蓯虄w虄 藞k扫 藞d酶蕭 藞蓯 vu藞a删	A bird in the hand is worth two in the bush.	vowel_reduction;coda_sibilant;nasal_vowel;nasal_diphthong;sandhi;statement	[酶] for 'dois', coda [蕛] in 'mais' and nasal [蓯虄w虄] in 'm茫o' per silva2008; proverb frame per mateus_dandrade2000.
pt-PT-x-sao-miguel-015	O carro azul do meu primo 茅 muito r谩pido.	藞u 藞ka蕘u 蓯藞zy色 藞du 藞mew 藞p删imu 藞蓻 藞mujtu 藞蕘apidu	My cousin's blue car is very fast.	vowel_reduction;open_mid;close_mid;rhotic;l_dark_or_velar;u_fronting;sandhi;statement	Stressed /u/ fronted to [y] before a coda liquid in 'azul' ([蓯藞zy色]) per silva2008; strong [蕘] in 'carro' per mateus_dandrade2000.
pt-PT-x-sao-miguel-016	De noite bebo pouco por causa da cruz.	藞d扫 藞n酶t扫 藞b蓻bu 藞p酶ku 藞p蓴删 藞kawz蓯 藞d蓯 藞k删y蕛	At night I drink little because of the cross.	vowel_reduction;coda_sibilant;open_mid;diphthong_ei_ou;u_fronting;statement	[酶] for 'noite'/'pouco' and /u/ fronted to [y] before a coda in 'cruz' ([kry蕛]) per silva2008; open [蓻] in 'bebo'.
pt-PT-x-sao-miguel-017	O sol brilha por cima do mar.	藞u 藞s蓴色 藞b删i蕩蓯 藞p蓴删 藞sim蓯 藞du 藞ma删	The sun shines over the sea.	vowel_reduction;open_mid;palatal;l_dark_or_velar;statement	Velarised coda [色] in 'sol', palatal [蕩] in 'brilha' per mateus_dandrade2000; conservative back vowels per rogers1948.
pt-PT-x-sao-miguel-018	O trabalho do meu filho 茅 dif铆cil.	藞u t删蓯藞ba蕩u 藞du 藞mew 藞fi蕩u 藞蓻 di藞fisi色	My son's job is difficult.	vowel_reduction;open_mid;close_mid;palatal;l_dark_or_velar;sandhi;statement	Palatals [蕩] in 'trabalho'/'filho' and dark coda [色] in 'dif铆cil' per mateus_dandrade2000; micaelense register per pwl_saomiguel.
pt-PT-x-sao-miguel-019	O caf茅 est谩 muito quente e forte.	藞u k蓯藞f蓻 e藞蕛ta 藞mujtu 藞ke虄t扫 藞e 藞f蓴删t扫	The coffee is very hot and strong.	vowel_reduction;coda_sibilant;open_mid;close_mid;nasal_vowel;sandhi;statement	Open [蓻] in 'caf茅'/'forte', nasal [岷絔 in 'quente' and coda [蕛] per mateus_dandrade2000.
pt-PT-x-sao-miguel-020	O n煤mero da tua porta 茅 treze.	藞u 藞nym扫删u 藞d蓯 藞ty蓯 藞p蓴删t蓯 藞蓻 藞t删蓻z扫	The number of your door is thirteen.	vowel_reduction;open_mid;u_fronting;sandhi;statement;number	Stressed /u/ fronted to [y] in 'n煤mero' and 'tua' per silva2008; open [蓴]/[蓻] in 'porta'/'treze' per mateus_dandrade2000.
