id	sentence	ipa	gloss_en	features	notes
pt-ST-001	Hoje n√£o faz sol nem calor.	ňą…Ē íe ňąn…źŐÉwŐÉ ňąfas ňąs…Ē…ę ňąneŐÉjŐÉ k…źňąlor	Today it is neither sunny nor hot.	vowel_reduction;open_mid;close_mid;nasal_vowel;nasal_diphthong;rhotic;l_dark_or_velar	Velarised coda […ę] in 'sol' and open […Ē] per goncalves1996; alveolar rhotic [r] in coda 'calor' per ferraz1979.
pt-ST-002	O bilhete custa cem dobras.	u biňą é…õte ňąkust…ź ňąseŐÉjŐÉ ňąd…Ēbr…źs	The ticket costs a hundred dobras.	vowel_reduction;open_mid;close_mid;nasal_vowel;palatal;rhotic	Santomean currency 'dobra' per hagemeijer2009; palatal [ é] in 'bilhete' and alveolar trill [r] in 'dobras' per ferraz1979.
pt-ST-003	Tenho consulta na quinta-feira √†s nove horas.	ňąt…õ…≤u koŐÉňąsu…ęt…ź n…ź ňąkiŐÉt…ź ňąfejr…ź as ňąn…Ēve ňą…Ēr…źs	I have an appointment on Thursday at nine.	vowel_reduction;open_mid;close_mid;nasal_vowel;palatal;rhotic;diphthong_ei_ou;l_dark_or_velar;sandhi	Palatal […≤] in 'tenho' and dark coda […ę] in 'consulta' per goncalves1996; retained /ej/ in 'feira' and alveolar [r] in 'horas' per ferraz1979.
pt-ST-004	A minha fam√≠lia mora numa ro√ßa antiga.	…ź ňąmi…≤…ź f…źňąmili…ź ňąm…Ēr…ź ňąnum…ź ňą Ā…Ēs…ź …źŐÉňąti…°…ź	My family lives on an old plantation estate.	vowel_reduction;open_mid;nasal_vowel;palatal;rhotic;sandhi	Santomean lexicon 'ro√ßa' (plantation estate) central to island life per hagemeijer2009; strong word-initial [ Ā] in 'ro√ßa' and palatal […≤] in 'minha' per ferraz1979.
pt-ST-005	Vira √† direita e segue sempre em frente.	ňąvir…ź a diňąrejt…ź i ňąs…õ…°e ňąseŐÉpre eŐÉjŐÉ ňąfreŐÉte	Turn right and keep going straight ahead.	vowel_reduction;open_mid;close_mid;nasal_vowel;rhotic;diphthong_ei_ou;sandhi	Retained /ej/ in 'direita' and alveolar trill [r] in the 'fr' cluster of 'frente' per ferraz1979; imperative register per goncalves1996.
pt-ST-006	Este calulu est√° muito bom com banana p√£o.	ňąeste k…źluňąlu eňąsta ňąmujtu ňąboŐÉ koŐÉ b…źňąnan…ź ňąp…źŐÉwŐÉ	This calulu is very good with plantain.	vowel_reduction;close_mid;nasal_vowel;nasal_diphthong;sandhi	Gulf-of-Guinea dish 'calulu' and 'banana p√£o' per hagemeijer2009; nasal diphthong […źŐÉwŐÉ] in 'p√£o' and open nasal /o/ in 'bom' per goncalves1996.
pt-ST-007	Onde fica a praia mais perto?	ňąoŐÉde ňąfik…ź …ź ňąpraj…ź ňąmajs ňąp…õrtu	Where is the nearest beach?	vowel_reduction;open_mid;close_mid;nasal_vowel;rhotic;sandhi	Alveolar trill [r] in 'perto', retained /ej/? no, open […õ] in 'perto' per ferraz1979; interrogative register per goncalves1996.
pt-ST-008	Quantas dobras custa o peixe fresco?	ňąkw…źŐÉt…źs ňąd…Ēbr…źs ňąkust…ź u ňąpej Ée ňąfresku	How many dobras does the fresh fish cost?	vowel_reduction;open_mid;close_mid;nasal_vowel;rhotic;diphthong_ei_ou;sandhi	Santomean currency 'dobra' per hagemeijer2009; nasal […źŐÉ] in 'quantas', retained /ej/ in 'peixe' and alveolar trill [r] in 'fresco' per ferraz1979.
pt-ST-009	Se chovesse, fic√°vamos em casa.	se  Éoňąv…õsŐļe fiňąkav…źmos eŐÉjŐÉ ňąkas…ź	If it rained, we would stay home.	vowel_reduction;open_mid;close_mid;nasal_vowel;sandhi	[ É] onset and open […õ] in 'chovesse' per goncalves1996; conditional-imperfect frame; alveolar rhotic system per ferraz1979.
pt-ST-010	Ontem comprei safu no mercado.	ňąoŐÉteŐÉjŐÉ koŐÉňąprej s…źňąfu nu meňąrkadu	Yesterday I bought safu fruit at the market.	vowel_reduction;close_mid;nasal_vowel;rhotic;diphthong_ei_ou	Santomean fruit 'safu' per hagemeijer2009; retained /ej/ in 'comprei' and alveolar trill [r] in 'mercado' per ferraz1979.
pt-ST-011	Para o ano vou viajar at√© ao Pr√≠ncipe.	ňąpar…ź u ňą…źnu ňąvo vi…źňą íar …źňąt…õ …źu ňąpriŐÉsipe	Next year I will travel to Principe.	vowel_reduction;open_mid;close_mid;nasal_vowel;rhotic;diphthong_ei_ou;sandhi	Santomean island name Principe per hagemeijer2009; open […õ] in 'at√©', /o/ monophthong in 'vou'->[ňąvo] and alveolar trill [r] in 'Pr√≠ncipe' per ferraz1979.
pt-ST-012	Liga-me mais tarde, por favor.	ňąli…°…ź me ňąmajs ňątarde por f…źňąv…Ēr	Call me later, please.	vowel_reduction;open_mid;rhotic	Open […Ē] in 'por'/'favor' and alveolar trill [r] in 'tarde' per ferraz1979; clitic imperative 'liga-me' per goncalves1996.
pt-ST-013	Ol√°, tudo leve-leve contigo?	oňąla ňątudu ňąl…õve ňąl…õve koŐÉňąti…°u	Hello, are you taking it easy?	open_mid;close_mid;nasal_vowel	Santomean catchphrase 'leve-leve' (easy does it), emblematic of the islands, per hagemeijer2009; open […õ] in 'leve' and full vowels per goncalves1996.
pt-ST-014	Quem n√£o arrisca, n√£o petisca.	ňąkeŐÉjŐÉ ňąn…źŐÉwŐÉ …źňąrisk…ź ňąn…źŐÉwŐÉ peňątisk…ź	Nothing ventured, nothing gained.	vowel_reduction;close_mid;nasal_vowel;nasal_diphthong;rhotic;sandhi	Alveolar trill [r] from 'rr' in 'arrisca' per ferraz1979; nasal diphthong […źŐÉwŐÉ] in 'n√£o'; proverb register per goncalves1996.
pt-ST-015	O carro velho ficou na estrada molhada.	u ňąkaru ňąv…õ éu fiňąko n…ź eňąstrad…ź moňą éad…ź	The old car ended up on the wet road.	vowel_reduction;open_mid;close_mid;palatal;rhotic;diphthong_ei_ou;sandhi	Alveolar trill [r] from 'rr' in 'carro' and palatal [ é] in 'velho'/'molhada' per ferraz1979; retained /ou/->[o] in 'ficou' per goncalves1996.
pt-ST-016	Ele trouxe um ramo de flores roxas.	ňąele ňątrose ňąuŐÉ ňą Āamu de ňąfl…Ēres ňą Ā…Ē É…źs	He brought a bunch of red flowers.	vowel_reduction;open_mid;close_mid;nasal_vowel;rhotic;diphthong_ei_ou;sandhi	Strong word-initial [ Ā] in 'ramo'/'roxas' and 'ou' diphthong in 'trouxe' per ferraz1979; open […Ē] in 'roxas'/'flores' per goncalves1996.
pt-ST-017	Na gravana a terra fica seca e quente.	n…ź …°r…źňąvan…ź …ź ňąt…õr…ź ňąfik…ź ňąs…õk…ź i ňąkeŐÉte	In the dry season the land goes dry and hot.	vowel_reduction;open_mid;close_mid;nasal_vowel;rhotic;sandhi	Santomean 'gravana' (dry season) per hagemeijer2009; alveolar trill [r] in 'terra', open […õ] in 'terra'/'seca' per ferraz1979.
pt-ST-018	Aquele rapaz vende jornais na esquina.	…źňąk…õle  Ā…źňąpas ňąveŐÉde  íoňąrnajs n…ź eňąskin…ź	That young man sells newspapers on the corner.	vowel_reduction;open_mid;close_mid;nasal_vowel;rhotic;sandhi	Strong word-initial [ Ā] in 'rapaz', open […õ] in 'aquele' and alveolar [r] in 'jornais' per ferraz1979; register per goncalves1996.
pt-ST-019	O melhor cacau da ilha vem daquela ro√ßa.	u meňą é…Ēr k…źňąkaw d…ź ňąi é…ź ňąveŐÉjŐÉ d…źňąk…õl…ź ňą Ā…Ēs…ź	The island's best cocoa comes from that estate.	vowel_reduction;open_mid;close_mid;nasal_vowel;palatal;rhotic;sandhi	Santomean 'ro√ßa' (cocoa estate) and the island cocoa economy per hagemeijer2009; palatal [ é] in 'ilha' and /aw/ in 'cacau' per ferraz1979.
pt-ST-020	Nunca vi um c√©u t√£o azul sobre o mar.	ňąnuŐÉk…ź ňąvi ňąuŐÉ ňąs…õw ňąt…źŐÉwŐÉ …źňązu…ę ňąsobre u ňąmar	I never saw such a blue sky over the sea.	vowel_reduction;open_mid;close_mid;nasal_vowel;nasal_diphthong;rhotic;l_dark_or_velar;sandhi	Nasal diphthong […źŐÉwŐÉ] in 't√£o', open […õ] in 'c√©u' and dark coda […ę] in 'azul' per goncalves1996; alveolar trill [r] in 'sobre'/'mar' per ferraz1979.
