id	sentence	ipa	gloss_en	features	notes
pt-TL-001	Hoje n√£o faz sol nem calor.	ňą…Ē íe ňąn…źŐÉwŐÉ ňąfaz ňąs…Ē…ę ňąneŐÉ kaňąl…Ē…ĺ	Today it is neither sunny nor hot.	open_mid;close_mid;nasal_vowel;nasal_diphthong;l_dark_or_velar;statement;negation	No unstressed reduction: 'hoje' -> [ňą…Ē íe], 'calor' -> [kaňąl…Ē…ĺ] with full [a], per albuquerque2010; coda /z/ 'faz' -> [z] alveolar and velarised coda […ę] 'sol' from the EP baseline per mateus_dandrade2000.
pt-TL-002	O bilhete custa doze euros e meio.	ňąo biňąl…õte ňąkusta ňąd…Ēze ňąew…ĺos ňąe ňąmejo	The ticket costs twelve euros fifty.	open_mid;close_mid;diphthong_ei_ou;sandhi;statement;number	Full unstressed vowels 'euros' -> [ňąew…ĺos] and digraph simplification 'bilhete' -> [biňąl…õte] ([l], no [ é]) with the 'ei' diphthong retained, per albuquerque2010.
pt-TL-003	Tenho consulta na quinta-feira √†s nove horas.	ňąt…õno koŐÉňąsu…ęta ňąna ňąkiŐÉta ňąfej…ĺa ňąas ňąn…Ēve ňą…Ē…ĺas	I have an appointment on Thursday at nine.	open_mid;close_mid;nasal_vowel;diphthong_ei_ou;l_dark_or_velar;sandhi;statement;number	Alveolar coda /s/ in '√†s'/'horas' -> [s] (no Lisbon chiado) and ‚ü®nh‚ü© -> [n] in 'tenho' -> [ňąt…õno], per albuquerque2010.
pt-TL-004	A minha fam√≠lia mora numa casa antiga.	ňąa ňąmina faňąmilia ňąm…Ē…ĺa ňąnuma ňąkaza …źŐÉňąti…°a	My family lives in an old house.	open_mid;nasal_vowel;sandhi;statement	‚ü®nh‚ü© -> [n] in 'minha' -> [ňąmina] and full unstressed vowels; 'casa antiga' liaison per albuquerque2010.
pt-TL-005	Vira √† direita e segue sempre em frente.	ňąvi…ĺa ňąa diňą…ĺejta ňąe ňąs…õ…°e ňąseŐÉpre ňąeŐÉ ňąfreŐÉte	Turn right and keep going straight ahead.	open_mid;close_mid;nasal_vowel;rhotic;diphthong_ei_ou;sandhi;imperative	Alveolar rhotic […ĺ]/[r] in 'vira'/'direita'/'frente' and retained 'ei' diphthong per albuquerque2010.
pt-TL-006	Este bacalhau est√° muito salgado.	ňąeste bakaňąlaw eňąsta ňąmujto saňą…ę…°ado	This cod is very salty.	close_mid;l_dark_or_velar;sandhi;statement	‚ü®lh‚ü© -> [l] in 'bacalhau' -> [bakaňąlaw], alveolar coda [s] in 'este' and velarised coda […ę] in 'salgado' per albuquerque2010.
pt-TL-007	Onde fica a esta√ß√£o de comboios?	ňąoŐÉde ňąfika ňąa estaňąs…źŐÉwŐÉ ňąde koŐÉňąbojos	Where is the train station?	close_mid;nasal_vowel;nasal_diphthong;sandhi;question	Nasal diphthong […źŐÉwŐÉ] in 'esta√ß√£o' retained and alveolar coda per albuquerque2010.
pt-TL-008	Quantos quilos de p√£o queres?	ňąk…źŐÉtos ňąkilos ňąde ňąp…źŐÉwŐÉ ňąk…õ…ĺes	How many kilos of bread do you want?	open_mid;close_mid;nasal_vowel;nasal_diphthong;sandhi;question;number	Nasal diphthong […źŐÉwŐÉ] in 'p√£o' and full unstressed vowels 'quilos' -> [ňąkilos] per albuquerque2010.
pt-TL-009	Se chovesse, fic√°vamos em casa.	ňąse  Éoňąv…õsŐļe fiňąkavamos ňąeŐÉ ňąkaza	If it rained, we would stay home.	open_mid;close_mid;nasal_vowel;sandhi;statement	Open mid […õ] in 'chovesse', full unstressed vowels 'fic√°vamos' -> [fiňąkavamos] and alveolar coda per albuquerque2010.
pt-TL-010	Ontem comprei peixe fresco no mercado.	ňąoŐÉteŐÉ koŐÉňąprej ňąpej Ée ňąfr…õsko ňąno meňąrkado	Yesterday I bought fresh fish at the market.	open_mid;close_mid;nasal_vowel;rhotic;diphthong_ei_ou;statement	Retained 'ei' diphthong in 'comprei'/'peixe' and alveolar rhotic [r] in 'mercado' per albuquerque2010.
pt-TL-011	Para o ano vou viajar at√© ao Porto.	ňąpa…ĺa ňąo ňąano ňąvo viaňą ía…ĺ aňąt…õ ňąao ňąp…Ērto	Next year I will travel to Porto.	open_mid;close_mid;rhotic;diphthong_ei_ou;sandhi;statement	'at√© ao' vowel liaison and full [o] in 'ano'/'Porto'; alveolar rhotic per albuquerque2010.
pt-TL-012	Liga-me mais tarde, por favor.	ňąli…°a ňąme ňąmajs ňątarde ňąp…Ē…ĺ faňąv…Ē…ĺ	Call me later, please.	open_mid;close_mid;rhotic;imperative	Alveolar coda [s] in 'mais' and alveolar rhotic in 'tarde'/'favor' per albuquerque2010.
pt-TL-013	Ol√°, tudo bem contigo?	oňąla ňątudo ňąbeŐÉ koŐÉňąti…°o	Hi, are you doing well?	close_mid;nasal_vowel;question	Nasal [ŠļĹ] in 'bem' and full [o] in 'tudo'/'contigo' per albuquerque2010.
pt-TL-014	Quem n√£o arrisca, n√£o petisca.	ňąkeŐÉ ňąn…źŐÉwŐÉ aňąriska ňąn…źŐÉwŐÉ peňątiska	Nothing ventured, nothing gained.	close_mid;nasal_vowel;nasal_diphthong;rhotic;sandhi;statement;negation	Alveolar trill [r] from 'rr' in 'arrisca' ‚ÄĒ the EP uvular is absent ‚ÄĒ per albuquerque2010.
pt-TL-015	O carro corre depressa na estrada molhada.	ňąo ňąkaro ňąk…Ēre deňąpr…õsŐļa ňąna eňąstrada moňąlada	The car speeds down the wet road.	open_mid;close_mid;rhotic;sandhi;statement	Alveolar rhotic in 'carro'/'corre' and ‚ü®lh‚ü© -> [l] in 'molhada' -> [moňąlada] per albuquerque2010.
pt-TL-016	O melhor vinho branco vem do Douro.	ňąo meňąl…Ē…ĺ ňąvino ňąbr…źŐÉko ňąveŐÉ ňądo ňądo…ĺo	The best white wine comes from the Douro.	open_mid;close_mid;nasal_vowel;rhotic;diphthong_ei_ou;statement	‚ü®lh‚ü© -> [l] in 'melhor' -> [meňąl…Ē…ĺ], ‚ü®nh‚ü© -> [n] in 'vinho' -> [ňąvino] and the 'ou' diphthong in 'Douro' per albuquerque2010.
pt-TL-017	A velha ponte de pedra ainda aguenta.	ňąa ňąv…õla ňąpoŐÉte ňąde ňąp…õdra ňąajŐÉda aňą…°eŐÉta	The old stone bridge still holds.	open_mid;close_mid;nasal_vowel;nasal_diphthong;rhotic;sandhi;statement	‚ü®lh‚ü© -> [l] in 'velha' -> [ňąv…õla], nasal [√Ķ] in 'ponte' and open mid […õ] in 'pedra' per albuquerque2010.
pt-TL-018	Nunca vi um c√©u t√£o azul.	ňąnuŐÉka ňąvi ňąuŐÉ k…õňąu ňąt…źŐÉwŐÉ aňązu…ę	I never saw such a blue sky.	open_mid;nasal_vowel;nasal_diphthong;l_dark_or_velar;sandhi;statement;negation	Open mid […õ] in 'c√©u', nasal diphthong […źŐÉwŐÉ] in 't√£o' and velarised coda […ę] in 'azul' per albuquerque2010; nasal diphthong from the EP baseline per mateus_dandrade2000.
pt-TL-019	O sol p√īs-se atr√°s da montanha.	ňąo ňąs…Ē…ę ňąpos ňąse aňątras ňąda moŐÉňątana	The sun set behind the mountain.	open_mid;close_mid;nasal_vowel;rhotic;l_dark_or_velar;sandhi;statement	Velarised coda […ę] in 'sol', ‚ü®nh‚ü© -> [n] in 'montanha' -> [m√Ķňątana] and alveolar coda [s] in 'atr√°s' per albuquerque2010.
pt-TL-020	Ele trouxe rosas roxas do jardim.	ňąele ňątro Ée ňąr…Ēzas ňąr…Ē Éas ňądo  íaňąrdiŐÉ	He brought red roses from the garden.	open_mid;close_mid;nasal_vowel;rhotic;diphthong_ei_ou;sandhi;statement	Alveolar trill [r] in 'rosas'/'roxas' and the 'ou' diphthong in 'trouxe' per albuquerque2010.
